"","id","ReportType","CurrentStatus","Description","DateCreate_Converted","DateClosed_Converted","location","crecondate","clocondate","HLReportType"
"1",639275,"Tree","Referred To Dept","This tree has termites. I think these are termite droppings. With all this wind and trees falling over Iam concerned that this tree may fall.","01/31/2019 08:58:52 PM","","(21.301713493, -157.686601305)",2019-01-31 20:58:52,NA,"Tree"
"2",639148,"Trash","Referred To Dept","On behalf of council district 7 constituents, please note that this has been here for the last two weeks, please have violations issued/DFM remove sidewalk nuisances.","01/31/2019 12:22:42 PM","","(21.31641754, -157.861943807)",2019-01-31 12:22:42,NA,"Trash"
"3",638862,"Light","Referred To Dept","Two or three street lights out on Diamond Head side of Iwilei Rd.","01/31/2019 06:37:34 AM","","(21.3158271, -157.8656878)",2019-01-31 06:37:34,NA,"RoadSafety"
"4",638704,"Broken / Vandalized signs","Referred To Dept","It is downed sign as you get on freeway from waikele center","01/30/2019 02:48:53 PM","","(21.4022825, -158.0067617)",2019-01-30 14:48:53,NA,"RoadSafety"
"5",638702,"Broken / Vandalized signs","Referred To Dept","Missing sign on light pole reported over 2 years ago. Request State or City to remove brackets from pole if sign isn,t going to be replaced. Brackets pose a safety hazard of teenagers climbing on post.","01/30/2019 02:28:53 PM","","(21.40780939, -158.010341394)",2019-01-30 14:28:53,NA,"RoadSafety"
"6",638699,"Broken / Vandalized signs","Referred To Dept","Sign rusted and broken off the bass.","01/30/2019 02:19:57 PM","","(21.401343931, -158.009180038)",2019-01-30 14:19:57,NA,"RoadSafety"
"7",638549,"Stream","Referred To Dept","Homeless living under the bridge. Belongings blocking under stream and up stream!","01/30/2019 10:35:37 AM","","(21.303912535, -157.833826789)",2019-01-30 10:35:37,NA,"Water"
"8",638388,"Light","Referred To Dept","The only two streetlights on the cul-de-sac are out and have been out for 2+ weeks","01/30/2019 06:53:03 AM","","(21.3873713, -157.9418847)",2019-01-30 06:53:03,NA,"RoadSafety"
"9",638220,"Trash","Referred To Dept","Hey guys! Yes it me again! I need your help! There is a flat screen tv on the side walk on Funchal street and itas broke glass everywhere! Itns next to a school and I donat know how long itns been there! I would take it across the street to put it with t","01/29/2019 05:12:10 PM","","(21.320063955, -157.851134733)",2019-01-29 17:12:10,NA,"Trash"
"10",637863,"Trash","Referred To Dept","Trash/couch has been along Lumiauau St in Waikele fronting the Highlands Association for a couple weeks.","01/29/2019 07:26:05 AM","","(21.408479735, -158.008465649)",2019-01-29 07:26:05,NA,"Trash"
"11",637549,"Homeless","Referred To Dept","Various items blocking sidewalk","01/28/2019 04:43:07 PM","","(21.312320828, -157.860400747)",2019-01-28 16:43:07,NA,"Homeless"
"12",637542,"Homeless","Referred To Dept","By the bridge leading in to chinatown. You cant miss the hard structure on the sidewalk.","01/28/2019 04:25:02 PM","","(21.314058659, -157.863907303)",2019-01-28 16:25:02,NA,"Homeless"
"13",637541,"Light","Referred To Dept","Light in front of shopping area where Pali liquor is is out.","01/28/2019 04:22:34 PM","","(21.394597994, -157.743325818)",2019-01-28 16:22:34,NA,"RoadSafety"
"14",637314,"Trash","Referred To Dept","Welcome to Waikiki!","01/28/2019 10:40:17 AM","","(21.28588159, -157.832365553)",2019-01-28 10:40:17,NA,"Trash"
"15",637170,"Trash","Referred To Dept","There is a couch on the sidewalk.","01/28/2019 08:34:34 AM","","(21.408619, -158.008775)",2019-01-28 08:34:34,NA,"Trash"
"16",637103,"Homeless","Referred To Dept","Homeless have set up structures","01/28/2019 07:43:27 AM","","(21.312426044, -157.860406242)",2019-01-28 07:43:27,NA,"Homeless"
"17",636867,"Broken / Vandalized signs","Closed","Looks like someone hit the signs down. On Paiwa heading toward the east bound on ramp.","01/27/2019 10:23:25 PM","02/01/2019 08:16:54 AM","(21.396820276, -158.009726946)",2019-01-27 22:23:25,2019-02-01 08:16:54,"RoadSafety"
"18",636822,"Broken / Vandalized signs","Referred To Dept","wind blew down street signs at 9th and hardesty. I have the signs in my yard.","01/27/2019 03:35:24 PM","","(21.288345559, -157.799913781)",2019-01-27 15:35:24,NA,"RoadSafety"
"19",636799,"Homeless","Referred To Dept","Homeless living in bus stop","01/27/2019 02:00:12 PM","","(21.314670167, -157.857509629)",2019-01-27 14:00:12,NA,"Homeless"
"20",636704,"Trash","Referred To Dept","Illegal dumps site and homeless camp causing problems in residential neighborhoods. Property damage and theft increasing in the neighborhood.","01/27/2019 10:20:56 AM","","(21.391165359, -157.956523706)",2019-01-27 10:20:56,NA,"Trash"
"21",636699,"Trash","Referred To Dept","City forgot to pick up monthly bulk trash at end of culdasac.","01/27/2019 09:59:24 AM","","(21.3873713, -157.9418847)",2019-01-27 09:59:24,NA,"Trash"
"22",636383,"Flooding","Referred To Dept","Sidewalk needs to be resloped to prevent puddle every time it rains.","01/25/2019 07:24:07 PM","","(21.318654732, -158.016534944)",2019-01-25 19:24:07,NA,"Water"
"23",636270,"Homeless","Referred To Dept","HPD Sergeant Gibson called me yesterday to tell me that the Grey Jeep had been moved.  I told him to go look,  and to check the 911 log for the week.  I called every morning this week.  Jeep SDG 144.  If officers did go to see the multiple illegally park","01/25/2019 12:54:43 PM","","(21.394074755, -157.723512827)",2019-01-25 12:54:43,NA,"Homeless"
"24",636107,"Trash","Referred To Dept","Hi guys! Sorry for being a pain! But I have an idea! Under the bridge are homeless staying and dumping their things after they are finished with them! For instance, a microwave oven in the stream! Luckily no one notices it! But my idea is that you fence","01/25/2019 10:20:23 AM","","(21.32020837, -157.854415441)",2019-01-25 10:20:23,NA,"Trash"
"25",635774,"Homeless","Referred To Dept","Homeless built hard structure on sidewalk","01/24/2019 04:46:01 PM","","(21.312501889, -157.860482284)",2019-01-24 16:46:01,NA,"Homeless"
"26",635709,"Trash","Closed","illegal dump site and abandoned red and white boat","01/24/2019 01:29:04 PM","01/24/2019 02:25:01 PM","(21.324708421, -157.681087532)",2019-01-24 13:29:04,2019-01-24 14:25:01,"Trash"
"27",635660,"Light","Referred To Dept","light stays on","01/24/2019 11:55:53 AM","","(21.3605757, -158.0285147)",2019-01-24 11:55:53,NA,"RoadSafety"
"28",635176,"Trash","Referred To Dept","Someone dumped their boxes and other items","01/23/2019 04:30:04 PM","","(21.313958959, -157.86400672)",2019-01-23 16:30:04,NA,"Trash"
"29",635111,"Trash","Referred To Dept","Appliance","01/23/2019 12:57:26 PM","","(21.396077194, -157.93741159)",2019-01-23 12:57:26,NA,"Trash"
"30",634899,"Light","Referred To Dept","light out","01/23/2019 09:05:40 AM","","(21.3551296, -158.0226344)",2019-01-23 09:05:40,NA,"RoadSafety"
"31",634890,"Light","Referred To Dept","light out","01/23/2019 08:56:17 AM","","(21.359740489, -158.027873393)",2019-01-23 08:56:17,NA,"RoadSafety"
"32",634889,"Light","Referred To Dept","light out","01/23/2019 08:54:24 AM","","(21.359611714, -158.028152272)",2019-01-23 08:54:24,NA,"RoadSafety"
"33",634884,"Light","Referred To Dept","light out","01/23/2019 08:50:00 AM","","(21.359826, -158.028592)",2019-01-23 08:50:00,NA,"RoadSafety"
"34",634617,"Trash","Referred To Dept","Abandoned junks that belong to homeless. It was piled in front of park all day. Please take it away. Nobody was around it all day","01/22/2019 11:43:04 PM","","(21.311992349, -157.861520611)",2019-01-22 23:43:04,NA,"Trash"
"35",634181,"Light","Referred To Dept","Exposed wire at the base","01/22/2019 06:58:00 AM","","(21.311883723, -157.857947656)",2019-01-22 06:58:00,NA,"RoadSafety"
"36",633960,"Trash","Closed","There are abt 4 damaged/abandoned cars parked on Bingham Street close to the Church of the Crossroad.","01/21/2019 06:34:00 PM","01/22/2019 09:03:17 AM","(21.2941362, -157.8225843)",2019-01-21 18:34:00,2019-01-22 09:03:17,"Trash"
"37",633940,"Light","Referred To Dept","New led lamp has stopped coming on at dark. Small red lamp on top is illuy","01/21/2019 04:39:35 PM","","(21.367607311, -158.0247542)",2019-01-21 16:39:35,NA,"RoadSafety"
"38",633876,"Light","Referred To Dept","Plate off bottom of pole.","01/21/2019 01:06:31 PM","","(21.315193838, -157.860147854)",2019-01-21 13:06:31,NA,"RoadSafety"
"39",633770,"Tree","Referred To Dept","Multiple trees between bridge and post office hanging over sidewalk. 5 ft off ground. Have to duck under low hanging trees to walk. Photo not relavent","01/21/2019 09:27:29 AM","","(21.2885596, -157.6994747)",2019-01-21 09:27:29,NA,"Tree"
"40",633589,"Trash","Referred To Dept","The Chinese guy that lives there dump all his construction rubbish and block the side walk. This is not the first or second time ..","01/20/2019 09:08:02 PM","","(21.322922717, -157.865701528)",2019-01-20 21:08:02,NA,"Trash"
"41",633470,"Homeless","Referred To Dept","trailer in street","01/20/2019 09:48:50 AM","","(21.2945036, -157.6981354)",2019-01-20 09:48:50,NA,"Homeless"
"42",633401,"Light","Referred To Dept","The only pole on left side of the street. Light flickers. Off for most of the night.","01/19/2019 10:20:41 PM","","(21.293168, -157.7037829)",2019-01-19 22:20:41,NA,"RoadSafety"
"43",633255,"Trash","Referred To Dept","Homeless dumping. unsanitary and unsafe.","01/19/2019 07:37:38 AM","","(21.321316615, -157.865792643)",2019-01-19 07:37:38,NA,"Trash"
"44",633188,"Trash","Referred To Dept","The bank that recently acquired the building cleaned their parking lot and left a gross pile of trash behind","01/19/2019 12:47:56 AM","","(21.28568702, -157.832572741)",2019-01-19 00:47:56,NA,"Trash"
"45",633187,"Trash","Referred To Dept","The bank that recently took over the property hire people to clean it up and dumped all of the trash  from their parking lot on the curb drug deals and homeless people are now my new neighbors","01/19/2019 12:34:20 AM","","(21.286109883, -157.832282198)",2019-01-19 00:34:20,NA,"Trash"
"46",633172,"Tree","Referred To Dept","dry dead three, leaning and about to fall in the road.","01/18/2019 05:14:39 PM","","(21.3205496, -158.0168473)",2019-01-18 17:14:39,NA,"Tree"
"47",632956,"Homeless","Closed","is this one of the private street parking areas in Kaka'ako? if not, how are they allowed to set up a 3 story house and business in a public street parking stalls?","01/18/2019 08:58:24 AM","01/18/2019 09:23:12 AM","(21.2959865, -157.859981)",2019-01-18 08:58:24,2019-01-18 09:23:12,"Homeless"
"48",632759,"Tree","Referred To Dept","The trees along Lunalilo st. Between Ernest St and Victoria St. have overgrown over the lanes so low, and into the power lines","01/17/2019 11:03:29 PM","","(21.305122987, -157.846197667)",2019-01-17 23:03:29,NA,"Tree"
"49",632738,"Light","Referred To Dept","Light out","01/17/2019 05:39:12 PM","","(21.428365042, -157.741403074)",2019-01-17 17:39:12,NA,"RoadSafety"
"50",632562,"Tree","Referred To Dept","Coconut trees need trimming. Dropping nuts into street","01/17/2019 10:12:39 AM","","(21.404085293, -157.742657568)",2019-01-17 10:12:39,NA,"Tree"
"51",632091,"Light","Referred To Dept","This light is located where traffic from Kalanianaole Hwy. merges onto Auloa Rd.  Is is right across the bus stop. Very dark now. Light housing is marked t15e. Not sure whether this is State light or City.","01/16/2019 11:57:12 AM","","(21.376384688, -157.763561999)",2019-01-16 11:57:12,NA,"RoadSafety"
"52",631871,"Light","Referred To Dept","Only 2 in the culdasac, both out","01/16/2019 06:49:19 AM","","(21.3873713, -157.9418847)",2019-01-16 06:49:19,NA,"RoadSafety"
"53",631519,"Tree","Closed","Looks like a broken irrigation pipe, lots of water flowing.","01/15/2019 12:05:10 PM","01/16/2019 08:02:21 AM","(21.370179349, -157.926698705)",2019-01-15 12:05:10,2019-01-16 08:02:21,"Tree"
"54",631316,"Broken / Vandalized signs","Referred To Dept","The H1 on ramp signage is a bit worn... But, not anything we locals need help finding;)","01/15/2019 07:20:11 AM","","(21.283829331, -157.799619199)",2019-01-15 07:20:11,NA,"RoadSafety"
"55",631098,"Light","Referred To Dept","See 630285 submitted earlier.  Adding photos now.","01/14/2019 05:30:26 PM","","(21.321414586, -157.803167609)",2019-01-14 17:30:26,NA,"RoadSafety"
"56",631076,"Light","Closed","Heading Westbound on H1, All highway lights from Kalihi, though Moanalua and Red Hill are off during the evening. We would appreciate it if you could investigate and repair.","","","",NA,NA,"RoadSafety"
"57",630941,"Tree","Referred To Dept","trees over grown into my property","","","",NA,NA,"Tree"
"58",630830,"Trash","Referred To Dept","Two black garbage bags of trash on the Diamond Head side of the street","01/14/2019 08:15:49 AM","","(21.306167595, -157.856534839)",2019-01-14 08:15:49,NA,"Trash"
"59",630543,"Light","Referred To Dept","flickering lights","01/13/2019 09:42:29 PM","","(21.276406762, -157.75803965)",2019-01-13 21:42:29,NA,"RoadSafety"
"60",630285,"Light","Referred To Dept","HECO put in two new poles.  The street lights on the two old poles are not working.","01/12/2019 08:29:20 PM","","(21.321349775, -157.803350855)",2019-01-12 20:29:20,NA,"RoadSafety"
"61",630261,"Homeless","Closed","Storing property on public roads","01/12/2019 03:56:56 PM","01/14/2019 09:02:13 AM","(21.289425734, -157.706973171)",2019-01-12 15:56:56,2019-01-14 09:02:13,"Homeless"
"62",630210,"Trash","Referred To Dept","White appliances","01/12/2019 12:07:50 PM","","(21.396137173, -157.940531433)",2019-01-12 12:07:50,NA,"Trash"
"63",630073,"Homeless","Referred To Dept","I know you wonpt do anything but refer to sept but there is garbage everywhere in the mountain and people camping with loose dogs. ACLU scares you so you donWt do anything but what if we sued you for treating them better than us?","01/11/2019 09:27:01 PM","","(21.461217489, -158.210931434)",2019-01-11 21:27:01,NA,"Homeless"
"64",630063,"Light","Referred To Dept","New LED Light has stopped coming on at dark","01/11/2019 06:32:54 PM","","(21.367421917, -158.024663539)",2019-01-11 18:32:54,NA,"RoadSafety"
"65",629989,"Stormwater","Referred To Dept","Oil and grease wash water going to storm drain","01/11/2019 01:25:29 PM","","(21.3761176, -158.017709)",2019-01-11 13:25:29,NA,"Water"
"66",629951,"Trash","Referred To Dept","There is a great amount of trash at the Halewiliko Place  cul de sac that has been there for a long time and needs to be picked up. It is hazardous for students using that route to get to Aiea Intermediate.","01/11/2019 11:47:43 AM","","(21.379996717, -157.925835325)",2019-01-11 11:47:43,NA,"Trash"
"67",629947,"Homeless","Referred To Dept","Trash bin, wooden pallets, heavy metal A/C unit stored illegally for several months","01/11/2019 11:41:53 AM","","(21.297791986, -157.858155336)",2019-01-11 11:41:53,NA,"Homeless"
"68",629836,"Tree","Referred To Dept","Please have the grass cut. Too long to enjoy the field.","","","",NA,NA,"Tree"
"69",629825,"Homeless","Referred To Dept","Red Jeep continues to park in the roadway placing cyclists and pedestrians at danger with steel bumper without rounded edge.  I have reported to police, police have discussed with homeowners , owners move the Jeep for a period, and then continue to park","01/11/2019 08:49:32 AM","","(21.397818649, -157.729726934)",2019-01-11 08:49:32,NA,"Homeless"
"70",629591,"Stormwater","Referred To Dept","Illegal dumping of water with strong odor of chlorine.","01/10/2019 06:20:34 PM","","(21.287142, -157.8330399)",2019-01-10 18:20:34,NA,"Water"
"71",629480,"Tree","Referred To Dept","Oven that again grass has not been mowed in a month.","01/10/2019 11:01:04 AM","","(21.400799265, -157.76415138)",2019-01-10 11:01:04,NA,"Tree"
"72",629370,"Stormwater","Referred To Dept","Evidence of sediment running off excavation into storm drain","01/10/2019 08:14:33 AM","","(21.286963283, -157.822964099)",2019-01-10 08:14:33,NA,"Water"
"73",629120,"Trash","Closed","Under the pedestrian overpass on the mauka side of H1","01/09/2019 05:05:15 PM","01/10/2019 08:08:14 AM","(21.296316461, -157.823964103)",2019-01-09 17:05:15,2019-01-10 08:08:14,"Trash"
"74",629077,"Tree","Referred To Dept","When the trash pickup comes he grabs the trash can and then leaves is either on the sidewalk or on the road sort of in the way of reversing up our driveway.  We put the rubbish can there on that side of the sidewalk because sometimes there is a car parke","01/09/2019 02:36:44 PM","","(21.2823956, -157.701406)",2019-01-09 14:36:44,NA,"Tree"
"75",628956,"Homeless","Referred To Dept","Homeless camp along sidewalks on river street. Harbor Village residents complaining of confrontations and foul smell. Wheelchairs unable to access sidewalk.","01/09/2019 11:03:19 AM","","(21.313558627, -157.864495146)",2019-01-09 11:03:19,NA,"Homeless"
"76",628860,"Broken / Vandalized signs","Referred To Dept","The school zone street sign is dangling","01/09/2019 09:04:36 AM","","(21.371824, -157.736039)",2019-01-09 09:04:36,NA,"RoadSafety"
"77",628574,"Tree","Closed","Trees are growing into the power lines","01/08/2019 09:51:01 PM","01/09/2019 07:54:02 AM","(21.45467, -157.8276516)",2019-01-08 21:51:01,2019-01-09 07:54:02,"Tree"
"78",628552,"Homeless","Referred To Dept","Residents are storing vehicles in the unimproved sidewalk area. Letters from the Mayors Office, and Department of Transportation services state that this is illegal activity -   Not being enforced by HPD -  walls and fences designate the private property","01/08/2019 05:17:38 PM","","(21.393859505, -157.723660574)",2019-01-08 17:17:38,NA,"Homeless"
"79",287589,"Light","Closed","College Walk Mall - Mauka end","","","",NA,NA,"RoadSafety"
"80",628551,"Homeless","Referred To Dept","Both 120 and 126 South Kalaheo Ave. Have realty signs in the unimproved sidewalk area","01/08/2019 05:11:53 PM","","(21.3991255, -157.7325614)",2019-01-08 17:11:53,NA,"Homeless"
"81",628538,"Homeless","Referred To Dept","Homeless camps in the bushes, people doing drugs in the open, people urinating and defecting in the open. Trash and garbage all around the camps and in the trees and bushes and in the ocean.","","","",NA,NA,"Homeless"
"82",628122,"Light","Referred To Dept","Street light out.","01/08/2019 06:05:46 AM","","(21.284465491, -157.712717313)",2019-01-08 06:05:46,NA,"RoadSafety"
"83",627964,"Light","Referred To Dept","Light is at the end of the cul de sac. Next to 1615 Ulualana Pl.","01/07/2019 07:48:38 PM","","(21.375205037, -157.756926036)",2019-01-07 19:48:38,NA,"RoadSafety"
"84",627934,"Light","Referred To Dept","Light on the pole in front of 1863 Paula Drive doesn.t work. Sorry, donit have a photo.","01/07/2019 04:47:39 PM","","(21.289760915, -157.787384932)",2019-01-07 16:47:39,NA,"RoadSafety"
"85",627332,"Homeless","Referred To Dept","Many homeless camps. Heath issues, safety issues. Check with the prosecutors office. They have cases of violence by homeless gang on joggers and walkers in the area. These are young healthy adults gaming the system and make our government look like fools","01/06/2019 10:05:25 PM","","(21.25510963, -157.808852283)",2019-01-06 22:05:25,NA,"Homeless"
"86",627321,"Light","Referred To Dept","Light out","01/06/2019 06:37:12 PM","","(21.28665684, -157.825597559)",2019-01-06 18:37:12,NA,"RoadSafety"
"87",626600,"Homeless","Closed","This car is always blocking the sidewalk and when I pass I9m forced to go on the roadway.","01/04/2019 10:10:42 AM","01/04/2019 10:26:06 AM","(21.3758771, -157.7376376)",2019-01-04 10:10:42,2019-01-04 10:26:06,"Homeless"
"88",626464,"Tree","Referred To Dept","Refer to police report 19-004298","","","",NA,NA,"Tree"
"89",625136,"Homeless","Referred To Dept","Large homeless camp. Always there. No enforcement of camping regulations.  Easy to access from street. Illegal drugs. Health hazard with discarded needles. Sanitation issue open excrement. What else do you need?","01/01/2019 11:49:53 AM","","(21.255574077, -157.805235862)",2019-01-01 11:49:53,NA,"Homeless"
"90",625135,"Homeless","Referred To Dept","Large homeless camp. Always there. No enforcement of camping regulations.  Easy to access from street. Illegal drugs. Health hazard with discarded needles. Sanitation issue open excrement. What else do you need?","01/01/2019 11:47:17 AM","","(21.255424364, -157.807228321)",2019-01-01 11:47:17,NA,"Homeless"
"91",625128,"Homeless","Referred To Dept","Large homeless camp. Always there. No enforcement of camping regulations.  Easy to access from street. Illegal drugs. Health hazard with discarded needles. Sanitation issue open excrement. What else do you need?","01/01/2019 11:32:23 AM","","(21.255952987, -157.809160421)",2019-01-01 11:32:23,NA,"Homeless"
"92",625127,"Homeless","Referred To Dept","Large homeless camp. Always there. No enforcement of camping regulations.  Easy to access from street. Illegal drugs. Health hazard with discarded needles. Sanitation issue open excrement. What else do you need?","01/01/2019 11:27:26 AM","","(21.256258062, -157.810929295)",2019-01-01 11:27:26,NA,"Homeless"
"93",625126,"Homeless","Referred To Dept","Large homeless camp. Always there. No enforcement of camping regulations.  Easy to access from street. Illegal drugs. Health hazard with discarded needles. Sanitation issue open excrement. What else do you need?","01/01/2019 11:25:40 AM","","(21.256347741, -157.811436127)",2019-01-01 11:25:40,NA,"Homeless"
"94",625061,"Light","Referred To Dept","Light is flashing. 1516 Ulupuni St.","01/01/2019 06:45:10 AM","","(21.377687594, -157.756335758)",2019-01-01 06:45:10,NA,"RoadSafety"
"95",624953,"Broken / Vandalized signs","Closed","Pole no sign","12/31/2018 12:30:03 PM","12/31/2018 01:44:28 PM","(21.315409212, -157.865392285)",2018-12-31 12:30:03,2018-12-31 13:44:28,"RoadSafety"
"96",624853,"Light","Referred To Dept","Downed pole due to accident on 12/27/2018. Information on pole  has been washed off by the rain","12/31/2018 09:39:33 AM","","(21.360188455, -158.028449344)",2018-12-31 09:39:33,NA,"RoadSafety"
"97",624612,"Broken / Vandalized signs","Referred To Dept","Bent/tagged pedestrian crosswalk sign. It s been like this for a long time.","12/30/2018 03:45:57 PM","","(21.422677749, -157.802234131)",2018-12-30 15:45:57,NA,"RoadSafety"
"98",624601,"Tree","Referred To Dept","Second request - on Kahekili Hwy  Just before the hygenic store the green overgrowth means there's no shoulder to safely walk on in daylight or dark. This was previously referred to the state and then back to Kahaluu and then forgotten","12/30/2018 01:46:42 PM","","(21.456981454, -157.837780493)",2018-12-30 13:46:42,NA,"Tree"
"99",624563,"Homeless","Referred To Dept","Trailer stored on public road. Has not been used in months","12/30/2018 10:17:12 AM","","(21.286653184, -157.715471865)",2018-12-30 10:17:12,NA,"Homeless"
"100",624418,"Homeless","Referred To Dept","At Thomas square on Victoria st","12/29/2018 01:02:31 PM","","(21.302077598, -157.848524371)",2018-12-29 13:02:31,NA,"Homeless"
"101",624259,"Trash","Referred To Dept","the residents are putting out trash outside of the pick up windows. the trash is collected sat and wed and within a few hours bags are out there again","12/28/2018 04:30:20 PM","","(21.289513997, -157.827575511)",2018-12-28 16:30:20,NA,"Trash"
"102",624258,"Tree","Referred To Dept","growth starting to block sidewalk","12/28/2018 04:27:26 PM","","(21.290116045, -157.829377121)",2018-12-28 16:27:26,NA,"Tree"
"103",624249,"Broken / Vandalized signs","Referred To Dept","There is no sign for one way street ,,,paoakalani, often tourists try and turn left , very dangerous situation.","12/28/2018 03:23:30 PM","","(21.2748546, -157.8204658)",2018-12-28 15:23:30,NA,"RoadSafety"
"104",623884,"Flooding","Closed","Spilling water pipe is flooding the trail and potentially causing a landslide.","12/27/2018 10:18:55 PM","12/28/2018 08:21:47 AM","(21.316984872, -157.776954601)",2018-12-27 22:18:55,2018-12-28 08:21:47,"Water"
"105",623821,"Tree","Closed","Tree has fallen over past few weeks and is blocking the sidewalk causing a safety hazard. This tree has been leaning more and more when there is rain and may fall if not cut at base. Many students use the walkway to travel to and from nearby Lehua Elemen","12/27/2018 01:09:25 PM","12/27/2018 01:17:54 PM","(21.388484022, -157.972544855)",2018-12-27 13:09:25,2018-12-27 13:17:54,"Tree"
"106",623819,"Tree","Referred To Dept","Tree has fallen over past few weeks and is blocking the sidewalk causing a safety hazard. This tree has been leaning more and more when there is rain and may fall if not cut at base. Many students use the walkway to travel to and from nearby Lehua Elemen","12/27/2018 01:01:22 PM","","(21.388484022, -157.972544855)",2018-12-27 13:01:22,NA,"Tree"
"107",623629,"Light","Referred To Dept","Light pole on Ala Wai canal side just before Ainakea way","","","",NA,NA,"RoadSafety"
"108",623618,"Light","Referred To Dept","pedestrian push button doesn't work.","12/27/2018 07:11:45 AM","","(21.324986045, -157.874963989)",2018-12-27 07:11:45,NA,"RoadSafety"
"109",623356,"Light","Referred To Dept","traffic light out, left turn makai, Hawaii Kai Dr","12/26/2018 11:04:47 AM","","(21.288202738, -157.702016478)",2018-12-26 11:04:47,NA,"RoadSafety"
"110",623110,"Homeless","Referred To Dept","vehicles park2d in cul de sac every single day. alsonabandoned boat with damaged trailer parked in cul de sac for over 2 months.","12/25/2018 06:22:26 PM","","(21.440546781, -158.182584065)",2018-12-25 18:22:26,NA,"Homeless"
"111",623083,"Homeless","Referred To Dept","Abandoned vehicle someone living in it","12/25/2018 10:40:23 AM","","(21.28923777, -157.706849192)",2018-12-25 10:40:23,NA,"Homeless"
"112",623063,"Light","Referred To Dept","light is out, street is very dark","12/25/2018 05:57:16 AM","","(21.296873819, -157.839380316)",2018-12-25 05:57:16,NA,"RoadSafety"
"113",622989,"Tree","Referred To Dept","branch, possibly less than 2"" is hanging. Not over the sidewalk, but if it does fall it may land in the sidewalk","12/24/2018 09:20:20 AM","","(21.3580204, -158.026116)",2018-12-24 09:20:20,NA,"Tree"
"114",622894,"Trash","Closed","Hello again! Sorry to be a bother! But I canit  pickup the trash that was taken from the garbage can, next to the bus stop, on Nuuanu! I just donht have the tools, otherwise I would and not bother you guys!","12/24/2018 01:46:21 AM","","(21.316589682, -157.855736757)",2018-12-24 01:46:21,NA,"Trash"
"115",622821,"Trash","Referred To Dept","Decorated shopping carts filled with random items have been left in front of the Happy Day Restaurant along Waialae Ave.","12/23/2018 08:07:55 AM","","(21.283184272, -157.79988714)",2018-12-23 08:07:55,NA,"Trash"
"116",622819,"Trash","Referred To Dept","Garbage bags are filled with trash, other random items are dumped right by the school field along the railing","12/23/2018 08:05:24 AM","","(21.310112191, -157.842297609)",2018-12-23 08:05:24,NA,"Trash"
"117",622738,"Broken / Vandalized signs","Referred To Dept","Tipped over no parking sign","12/22/2018 11:21:11 AM","","(21.301516996, -157.84577334)",2018-12-22 11:21:11,NA,"RoadSafety"
"118",622313,"Homeless","Referred To Dept","homeless have been here over 2weeks at this intersection.","12/20/2018 06:50:20 PM","","(21.292259732, -157.819523197)",2018-12-20 18:50:20,NA,"Homeless"
"119",622233,"Trash","Referred To Dept","Car tires and a pallet dumped on a bare area; just take a right from Kapolei Golf Club onto Farrington Hwy heading to Honolulu and youwll see them at the bare bus stop which is across from the Makakilo Quarry.","12/20/2018 12:22:55 PM","","(21.354221056, -158.061771501)",2018-12-20 12:22:55,NA,"Trash"
"120",622229,"Trash","Referred To Dept","Looks like car parts and insulation foam dumped on a bare area; just take a right from Kapolei Golf Club onto Farrington Hwy heading to Honolulu and youell see them.","12/20/2018 12:18:11 PM","","(21.349841737, -158.06422836)",2018-12-20 12:18:11,NA,"Trash"
"121",621885,"Trash","Referred To Dept","There is an abandoned blue garbage bin, itas been here for more than a month. Our neighbors have theirs. The entire block on Kaialiu Street belongs to one person, so no reason for them to leave their bin on Bingham Street. Please come and get the blue bi","12/19/2018 04:37:22 PM","","(21.2939976, -157.8225377)",2018-12-19 16:37:22,NA,"Trash"
"122",621682,"Stream","Referred To Dept","Storm drain nlocked","12/19/2018 07:52:27 AM","","(21.291377374, -157.792409951)",2018-12-19 07:52:27,NA,"Water"
"123",621508,"Light","Referred To Dept","Light goes iff and on. Crosswalk right down. Visibility is terrible.  Needs immediate fix. We live on Center street and this is been our for years.","12/18/2018 06:44:01 PM","","(21.282831738, -157.799131818)",2018-12-18 18:44:01,NA,"RoadSafety"
"124",620814,"Light","Referred To Dept","Plate at base is off","12/17/2018 09:59:46 AM","","(21.310763703, -157.856860646)",2018-12-17 09:59:46,NA,"RoadSafety"
"125",620398,"Tree","Referred To Dept","Update on weeds on planting strip.  Photos taken from both directions.","12/16/2018 10:04:12 AM","","(21.3215527, -157.8032567)",2018-12-16 10:04:12,NA,"Tree"
"126",620261,"Trash","Referred To Dept","Full garbage bag and clothing at bus stop 3851","12/15/2018 10:54:23 AM","","(21.315933909, -157.842572381)",2018-12-15 10:54:23,NA,"Trash"
"127",620225,"Homeless","Referred To Dept","in the street","12/15/2018 08:01:45 AM","","(21.30293901, -157.710534112)",2018-12-15 08:01:45,NA,"Homeless"
"128",620130,"Homeless","Closed","Tires, rubbish, tents, loose dogs and manic drug addicts run this mountain. Please do something. I know you wongt. I know youvll just update this to referee to department and then it will be closed with nothing done. Surprise us neighbors would you and a","12/14/2018 01:35:15 PM","","(21.461313677, -158.210923738)",2018-12-14 13:35:15,NA,"Homeless"
"129",620021,"Homeless","Referred To Dept","bulky item pickup violation. trash out too early.","12/14/2018 09:56:08 AM","","(21.289401687, -157.831056562)",2018-12-14 09:56:08,NA,"Homeless"
"130",619800,"Light","Closed","Street light","12/13/2018 11:03:54 PM","12/14/2018 08:30:10 AM","(21.442829479, -158.018615626)",2018-12-13 23:03:54,2018-12-14 08:30:10,"RoadSafety"
"131",619799,"Light","Referred To Dept","Street light","12/13/2018 11:02:47 PM","","(21.442829479, -158.018615626)",2018-12-13 23:02:47,NA,"RoadSafety"
"132",619798,"Broken / Vandalized signs","Referred To Dept","fallen sign.","12/13/2018 10:38:39 PM","","(21.305931061, -157.835103014)",2018-12-13 22:38:39,NA,"RoadSafety"
"133",619787,"Light","Referred To Dept","Crews swapping out old style lights for new LEDs about a week ago replaced all but this light in Hanale Place.  Still has old orange tint light.  Maybe they missed it. Please replace with same LED as others.","12/13/2018 07:14:06 PM","","(21.388383806, -157.75043672)",2018-12-13 19:14:06,NA,"RoadSafety"
"134",619618,"Tree","Referred To Dept","Plants need to be off the exit ramp. Fence need to be repaired. Behind the stage needs to be cleaned","12/13/2018 09:22:24 AM","","(21.309002872, -157.861510459)",2018-12-13 09:22:24,NA,"Tree"
"135",619615,"Tree","Closed","Plants need to be off the exit ramp. Fence need to be repaired. Behind the stage needs to be cleaned","12/13/2018 09:20:15 AM","12/13/2018 09:33:29 AM","(21.309002872, -157.861510459)",2018-12-13 09:20:15,2018-12-13 09:33:29,"Tree"
"136",619577,"Tree","Referred To Dept","The sidewalks along Auwaiolimu are overgrown with weeds and grass. Itas hard for pedestrians especially parents with their kids to walk on the sidewalk. Some have to walk along the street to avoid the high grass.","12/13/2018 08:03:38 AM","","(21.310032023, -157.839322285)",2018-12-13 08:03:38,NA,"Tree"
"137",619564,"Homeless","Referred To Dept","Abandoned homeless property on vacant lot blocking street parking.","12/13/2018 07:37:46 AM","","(21.280736524, -157.813115833)",2018-12-13 07:37:46,NA,"Homeless"
"138",619407,"Trash","Referred To Dept","One of the units at 1425 liliha street dumped this right by the fire hydrant infront of the building.","12/12/2018 10:27:32 PM","","(21.320172269, -157.860942551)",2018-12-12 22:27:32,NA,"Trash"
"139",619402,"Stormwater","Referred To Dept","Under the Waipahu Stream Bridge fronting 7-11/Tanioka's there is numerous amounts of stolen property including bicycles, gas trimmers, and yard tools. The homeless under the bridge constantly dump trash into the river which includes cloths, tools, bicycl","12/12/2018 08:11:42 PM","","(21.384646, -158.000487)",2018-12-12 20:11:42,NA,"Water"
"140",618626,"Flooding","Referred To Dept","Flooding along sidewalk caused by sprinklers. Has been a problem for more that 30 days on busy sidewalk with city, state, daycare, BWS, and Queen's Hospital pedestrian and bicycle traffic.  Even when water isn't covering the entire sidewalk, it's now sli","12/11/2018 07:56:30 AM","","(21.3055066, -157.8552438)",2018-12-11 07:56:30,NA,"Water"
"141",618608,"Stormwater","Referred To Dept","Drain inlet protection causing water to pool onto the road way in the intersection of school and Nuuanu","12/11/2018 07:37:54 AM","","(21.316465381, -157.855808472)",2018-12-11 07:37:54,NA,"Water"
"142",618604,"Tree","Referred To Dept","Branches down on Waioli st. Blocking road","12/11/2018 07:27:46 AM","","(21.300920635, -157.686870261)",2018-12-11 07:27:46,NA,"Tree"
"143",618579,"Tree","Referred To Dept","A large branch from the tree along the street fell into the street. I tried to move it as much as possible to the side, but it is still partway on the sidewalk and the street.","12/11/2018 06:55:34 AM","","(21.332099055, -157.869999461)",2018-12-11 06:55:34,NA,"Tree"
"144",618374,"Broken / Vandalized signs","Referred To Dept","Xmas tree in disrepair","12/10/2018 05:05:51 PM","","(21.277970444, -157.799389401)",2018-12-10 17:05:51,NA,"RoadSafety"
"145",618347,"Tree","Closed","large cactus has fallen into the bike lane north bound before the bridge","12/10/2018 02:47:56 PM","12/10/2018 02:58:44 PM","(21.423840232, -158.007738042)",2018-12-10 14:47:56,2018-12-10 14:58:44,"Tree"
"146",618076,"Homeless","Referred To Dept","For sale property sign in unimproved sidewalk,  overgrown trees that we hit with helmets while riding bike on asphalt shoulder.","12/10/2018 07:37:23 AM","","(21.3991255, -157.7325614)",2018-12-10 07:37:23,NA,"Homeless"
"147",617839,"Light","Referred To Dept","Pedestrian Crosswalk indicator facing Diamond Head direction for pedestrians walking Ewa direction across Keeaumoku and Wilder is not working during """"DONT WALK"""" Light.","12/09/2018 05:43:22 PM","","(21.304677435, -157.836425757)",2018-12-09 17:43:22,NA,"RoadSafety"
"148",617689,"Tree","Referred To Dept","tree branch fell to ground in wind.","","","",NA,NA,"Tree"
"149",617639,"Light","Closed","on traffic island at Kona intersection","12/08/2018 06:43:29 PM","12/10/2018 08:37:16 AM","(21.290105872, -157.838497759)",2018-12-08 18:43:29,2018-12-10 08:37:16,"RoadSafety"
"150",617634,"Trash","Referred To Dept","Shopping cart filled with household items left near the bus stop on the Ewa side of the street.  No need to follow up with a phone call.","12/08/2018 06:29:15 PM","","(21.307034365, -157.841585774)",2018-12-08 18:29:15,NA,"Trash"
"151",617633,"Light","Referred To Dept","on traffic island at Kona intersection","12/08/2018 06:29:12 PM","","(21.290105872, -157.838497759)",2018-12-08 18:29:12,NA,"RoadSafety"
"152",617622,"Trash","Referred To Dept","Various household items have been dumped on the side of the street next to the School field. These items have been laid next to the metal guard rail. No need to call me for follow up.","12/08/2018 04:39:35 PM","","(21.310122983, -157.842204115)",2018-12-08 16:39:35,NA,"Trash"
"153",617617,"Trash","Referred To Dept","Garbage bags, broken iron board, and broken furniture are located in two spots along the road not far from the bus stop along Prospect Street. Please let me know if these items needs to be placed on the side walk for pick up. My email address is caroline","12/08/2018 03:27:57 PM","","(21.309236306, -157.844996143)",2018-12-08 15:27:57,NA,"Trash"
"154",617581,"Homeless","Referred To Dept","Tents on public sidewalk along River Street, unattended.","12/08/2018 12:36:13 PM","","(21.313363824, -157.864704811)",2018-12-08 12:36:13,NA,"Homeless"
"155",617443,"Broken / Vandalized signs","Referred To Dept","Very FADED  STOP","12/08/2018 01:22:16 AM","","(21.302879951, -157.852641856)",2018-12-08 01:22:16,NA,"RoadSafety"
"156",617198,"Trash","Referred To Dept","bus stop needs trash can people just throw trash into plants because you took away the trash can.","12/07/2018 07:37:24 AM","","(21.271153299, -157.811654168)",2018-12-07 07:37:24,NA,"Trash"
"157",616659,"Light","Closed","At intersection of Ulupii St. and Uluamahi Pl. Very dark corner now.","12/06/2018 06:59:14 AM","12/06/2018 08:27:42 AM","(21.37542901, -157.756160058)",2018-12-06 06:59:14,2018-12-06 08:27:42,"RoadSafety"
"158",616649,"Light","Referred To Dept","At intersection of Ulupii and Uluanahi Pl.","12/06/2018 06:52:14 AM","","(21.375378669, -157.756236405)",2018-12-06 06:52:14,NA,"RoadSafety"
"159",616430,"Trash","Referred To Dept","Bulky items out on curbside","12/05/2018 02:19:28 PM","","(21.298481845, -157.831569042)",2018-12-05 14:19:28,NA,"Trash"
"160",616412,"Tree","Referred To Dept","west loch shoreline park bike  path is overgrow and impassablein some places when riding a bike","12/05/2018 12:50:58 PM","","(21.356225234, -158.021972634)",2018-12-05 12:50:58,NA,"Tree"
"161",615873,"Trash","Closed","items piled up","12/04/2018 01:16:40 PM","12/05/2018 07:54:05 AM","(21.3600765, -158.0276065)",2018-12-04 13:16:40,2018-12-05 07:54:05,"Trash"
"162",615770,"Flooding","Referred To Dept","Water has been ponding for several months. Could be water pipe leak.","12/04/2018 10:33:02 AM","","(21.33913403, -157.711591112)",2018-12-04 10:33:02,NA,"Water"
"163",615481,"Homeless","Closed","South-bound side of the bridge, the homeless are really starting to take over the sidewalk. They already have their lean-to tents taking half of the side walk, and ""fishermen"" taking over the half, but now they are starting to park mopeds in the little","12/04/2018 05:39:23 AM","12/04/2018 08:29:28 AM","(21.314567894, -157.888184896)",2018-12-04 05:39:23,2018-12-04 08:29:28,"Homeless"
"164",615348,"Broken / Vandalized signs","Referred To Dept","Speed limit sign (Speed Limit 25) found laying on the ground partially still attach to the ground. Sign is still attached to the pole.","12/04/2018 01:05:29 AM","","(21.3347395, -158.0278277)",2018-12-04 01:05:29,NA,"RoadSafety"
"165",615048,"Tree","Closed","multiple trees on the corner of 91-1015 Olepekupe St, Ewa Beach, HI 96706 that are low hanging , have dead branches. these trees are a saftey concern as while I was taking the photo of the trees a branch fell and just about hit me. something needs to be","12/03/2018 09:46:26 AM","12/04/2018 12:49:06 PM","(21.369634543, -158.024848216)",2018-12-03 09:46:26,2018-12-04 12:49:06,"Tree"
"166",614507,"Light","Referred To Dept","Second pole from beretania st and ewa side of river","12/02/2018 11:52:19 AM","","(21.314171286, -157.862207265)",2018-12-02 11:52:19,NA,"RoadSafety"
"167",614373,"Light","Referred To Dept","Signal Button to cross the street is stuck and ticks rapidly all night. The housing for the signal button is also very loose and shakes pretty badly. Needs to be replaced.","12/01/2018 08:38:45 PM","","(21.333268887, -158.071107882)",2018-12-01 20:38:45,NA,"RoadSafety"
"168",614370,"Light","Referred To Dept","Constituent reports street light off at night. Requests City DFM/Streetlight Dept assess and make repairs as needed. Mahalo, Michael Leong on behalf of office of Rep Bert Kobayashi 808 551-7896","12/01/2018 07:59:26 PM","","(21.265224908, -157.786603459)",2018-12-01 19:59:26,NA,"RoadSafety"
"169",614185,"Light","Referred To Dept","Street light is burnt out creating an extremely dark situation at night. We have had car break-ins and garage intrusions at night in the past and having no light creates an unsecured environment for petty thieves to thrive in.","11/30/2018 04:04:29 PM","","(21.2862348, -157.7844882)",2018-11-30 16:04:29,NA,"RoadSafety"
"170",613205,"Homeless","Referred To Dept","Abandoned oversized trash, illegal camping","11/28/2018 02:43:14 PM","","(21.300467549, -157.859235601)",2018-11-28 14:43:14,NA,"Homeless"
"171",612993,"Tree","Referred To Dept","Tree became a monster in front of my house .","","","",NA,NA,"Tree"
"172",612984,"Tree","Referred To Dept","Tree foliage is obscuring STOP sign.","11/28/2018 08:46:09 AM","","(21.332960663, -158.081522084)",2018-11-28 08:46:09,NA,"Tree"
"173",612706,"Trash","Referred To Dept","Yesterday, I reported this illegal dump site (#611973) and warned","","","",NA,NA,"Trash"
"174",612647,"Broken / Vandalized signs","Referred To Dept","At least three signs in error. No lane ends or requires a merge. One sign East and one sign west of this location. Kapolei Parkway.","11/27/2018 01:08:00 PM","","(21.329012039, -158.074569109)",2018-11-27 13:08:00,NA,"RoadSafety"
"175",612176,"Light","Referred To Dept","Both lights on pole with traffic camera mounted on it are malfunctioning.","11/27/2018 01:36:22 AM","","(21.29184461, -157.821981873)",2018-11-27 01:36:22,NA,"RoadSafety"
"176",612149,"Pothole","Referred To Dept","pothole is wearing down vehicles","11/26/2018 05:56:39 PM","","(21.32719624, -157.694751396)",2018-11-26 17:56:39,NA,"RoadSafety"
"177",612123,"Broken / Vandalized signs","Referred To Dept","Sign was hit by a car on Kokohead drive between Claudine and where it turns into Paula drive","11/26/2018 04:10:12 PM","","(21.286115271, -157.789863222)",2018-11-26 16:10:12,NA,"RoadSafety"
"178",611973,"Trash","Referred To Dept","Over the weekend, a large amount of trash was piled up at the end of our lane where we place our refuse cans for collection. This morning the refuse came and collected what was inside the cans, but left the pile of refuse. This is not only becoming an ey","11/26/2018 11:43:02 AM","","(21.323257, -157.8391399)",2018-11-26 11:43:02,NA,"Trash"
"179",607348,"Broken / Vandalized signs","Referred To Dept","No Parking sign broken off at sidewalk","11/12/2018 05:49:55 PM","","(21.299844479, -157.860221233)",2018-11-12 17:49:55,NA,"RoadSafety"
"180",611145,"Light","Referred To Dept","Light not working","11/24/2018 09:34:34 PM","","(21.3551908, -158.0254174)",2018-11-24 21:34:34,NA,"RoadSafety"
"181",611126,"Light","Referred To Dept","Light is not working, Cul-de-sac has no light","11/24/2018 04:04:48 PM","","(21.393717101, -158.027904952)",2018-11-24 16:04:48,NA,"RoadSafety"
"182",611116,"Tree","Closed","Broken branch","11/24/2018 02:35:37 PM","11/26/2018 09:07:28 AM","(21.283011326, -157.799630315)",2018-11-24 14:35:37,2018-11-26 09:07:28,"Tree"
"183",610963,"Tree","Referred To Dept","Trees and brush growing in the right of way prevents a clear walking path.","11/23/2018 05:49:57 PM","","(21.313587696, -157.8130427)",2018-11-23 17:49:57,NA,"Tree"
"184",610798,"Tree","Referred To Dept","3441 Pipa Place. Weeds on planting strip are a tripping hazard.  Nobody uses the sidewalk.  Repeat offender needs another reminder.","11/22/2018 05:53:14 PM","","(21.321477038, -157.803219576)",2018-11-22 17:53:14,NA,"Tree"
"185",610721,"Broken / Vandalized signs","Referred To Dept","The school zone sign next to the Waikiki fire station is crooked/leaning over the sidewalk. Tonight I walked into the sign hurting my shoulder.","11/21/2018 10:35:06 PM","","(21.273192394, -157.816030559)",2018-11-21 22:35:06,NA,"RoadSafety"
"186",610716,"Light","Referred To Dept","All of the lights for courts 3 and 4 are out. Itks not just a pole s- it is the entire center bank of lights.","11/21/2018 06:08:41 PM","","(21.3945948, -157.7380738)",2018-11-21 18:08:41,NA,"RoadSafety"
"187",610651,"Tree","Referred To Dept","Road side plants growing into single narrow lane. Neighbors trying to trim but plants are growing out of control creating hazard on single lane rd.","11/21/2018 11:47:07 AM","","(21.29190634, -157.789705295)",2018-11-21 11:47:07,NA,"Tree"
"188",610392,"Trash","Closed","several mattresses had been dumped at the stop sign a few days ago","11/20/2018 05:30:24 PM","11/21/2018 07:58:30 AM","(21.335855703, -157.877754559)",2018-11-20 17:30:24,2018-11-21 07:58:30,"Trash"
"189",610313,"Pothole","Referred To Dept","Several potholes on Kam Hwy","11/20/2018 12:13:58 PM","","(21.675366977, -158.038806876)",2018-11-20 12:13:58,NA,"RoadSafety"
"190",610278,"Tree","Referred To Dept","weeds are over grown and a lot of the weeds are going into the neighbors yards.","11/20/2018 11:19:19 AM","","(21.402728112, -157.969059432)",2018-11-20 11:19:19,NA,"Tree"
"191",610253,"Homeless","Referred To Dept","Illegal campers","11/20/2018 10:47:52 AM","","(21.461082074, -158.208679503)",2018-11-20 10:47:52,NA,"Homeless"
"192",609973,"Light","Referred To Dept","Light not working","11/19/2018 07:41:28 PM","","(21.36970916, -157.737400534)",2018-11-19 19:41:28,NA,"RoadSafety"
"193",609966,"Light","Referred To Dept","Street light burnt out in front of scenic tower on isenberg street","11/19/2018 06:27:55 PM","","(21.291065, -157.826508)",2018-11-19 18:27:55,NA,"RoadSafety"
"194",609962,"Trash","Referred To Dept","Parts of a refrigerator door or dresser dumped on the mauka side of Prospect St near the bus stop. This is the third time I am reporting this. No need to call me to follow up.","11/19/2018 05:35:31 PM","","(21.309224201, -157.845068335)",2018-11-19 17:35:31,NA,"Trash"
"195",609961,"Trash","Referred To Dept","Black garbage bags of green waste dumped near the bus stop on Prospect Street. This is the second time I am reporting this. No need to call me for the follow up.","11/19/2018 05:32:56 PM","","(21.309246183, -157.844940576)",2018-11-19 17:32:56,NA,"Trash"
"196",609960,"Trash","Referred To Dept","Wood, ironing board, crutch dumped by the bus stop on Prospect Street. No need to call me for the follow up.","11/19/2018 05:31:01 PM","","(21.309308506, -157.844758545)",2018-11-19 17:31:01,NA,"Trash"
"197",609922,"Pothole","Referred To Dept","massive potholes, need repave small section","11/19/2018 02:58:06 PM","","(21.395828208, -158.161178633)",2018-11-19 14:58:06,NA,"RoadSafety"
"198",609451,"Trash","Referred To Dept","Random rubbish, pile continues to grow","11/18/2018 04:17:23 PM","","(21.391660136, -158.156210499)",2018-11-18 16:17:23,NA,"Trash"
"199",609421,"Tree","Referred To Dept","Time for a tree trim?","11/18/2018 01:24:01 PM","","(21.400253762, -158.01155844)",2018-11-18 13:24:01,NA,"Tree"
"200",609378,"Tree","Referred To Dept","Dead tree","11/18/2018 10:12:03 AM","","(21.26602982, -157.815082433)",2018-11-18 10:12:03,NA,"Tree"
"201",609352,"Tree","Referred To Dept","Plant overgrowth on shoulder Makai side approaching 7-11 store Kahekili highway at Kamehameha. This makes it very difficult to walk safely along the road","11/18/2018 08:55:08 AM","","(21.457092399, -157.83791866)",2018-11-18 08:55:08,NA,"Tree"
"202",609290,"Broken / Vandalized signs","Referred To Dept","Mayors office complaint RISR 2018-3285.  Dead end sign at corner of mauna place and Mott smith drive base needs to be reinforced or replaced.  Sign was leaning forward and on ground upon arrival.  Sign pushed back up and temporarily reinforced with lava","11/18/2018 12:14:52 AM","","(21.312309993, -157.835470649)",2018-11-18 00:14:52,NA,"RoadSafety"
"203",609250,"Flooding","Referred To Dept","Appears to be a broken water line. Area has been flooded for months.","11/17/2018 01:12:38 PM","","(21.284838144, -157.71847019)",2018-11-17 13:12:38,NA,"Water"
"204",609051,"Broken / Vandalized signs","Referred To Dept","no parking sign knocked down on corner of 91-1026 Uouoa St, Ewa Beach, HI 96706","11/16/2018 11:59:48 AM","","(21.368868727, -158.021496442)",2018-11-16 11:59:48,NA,"RoadSafety"
"205",608733,"Trash","Referred To Dept","Bulky items being stacked","11/15/2018 02:48:59 PM","","(21.3600765, -158.0276065)",2018-11-15 14:48:59,NA,"Trash"
"206",608597,"Homeless","Closed","Note the debris collecting around the wheels.","11/15/2018 10:08:37 AM","11/15/2018 10:44:40 AM","(21.424008245, -158.004289941)",2018-11-15 10:08:37,2018-11-15 10:44:40,"Homeless"
"207",608468,"Tree","Referred To Dept","Overgrown weeds and bushes on the sidewalk on the makai side from Saint Timothybs church down to the stream before Safeway","11/15/2018 06:56:18 AM","","(21.38914439, -157.946192846)",2018-11-15 06:56:18,NA,"Tree"
"208",608299,"Trash","Referred To Dept","The dumping along the Navy fence line of Lualualei Homestead road is getting out of control. Huge piles of debris have been there since January. Whenever itIs windy or flooding, cars have to constantly dodge debris that gets moved onto the road.","11/14/2018 11:06:17 PM","","(21.436885538, -158.160348433)",2018-11-14 23:06:17,NA,"Trash"
"209",608279,"Light","Referred To Dept","light fixture strapped to pole.","11/14/2018 04:53:23 PM","","(21.299603662, -157.840809068)",2018-11-14 16:53:23,NA,"RoadSafety"
"210",608254,"Trash","Referred To Dept","Huge piles of trash and building supplies in unimproved sidewalk. People living in un permitted  house","11/14/2018 02:30:56 PM","","(21.4050221, -157.7974005)",2018-11-14 14:30:56,NA,"Trash"
"211",608011,"Trash","Closed","3 Stored broken down vehicles in the public right of way. Been there for months, safety hazard","11/14/2018 07:38:38 AM","11/14/2018 08:30:50 AM","(21.406092, -157.7941286)",2018-11-14 07:38:38,2018-11-14 08:30:50,"Trash"
"212",608010,"Trash","Closed","3 Stored broken down vehicles in the public right of way. Been there for months, safety hazard","11/14/2018 07:37:49 AM","11/14/2018 08:30:30 AM","(21.406092, -157.7941286)",2018-11-14 07:37:49,2018-11-14 08:30:30,"Trash"
"213",608009,"Pothole","Closed","Large pothole prior to stoplight heading South.","11/14/2018 07:37:09 AM","11/14/2018 08:18:42 AM","(21.393177051, -157.960430044)",2018-11-14 07:37:09,2018-11-14 08:18:42,"RoadSafety"
"214",608004,"Tree","Referred To Dept","30ft x 100ft weed patch at this backyard of this property. Growing for the past 2 years. Weeds trees are about 10ft tall.","11/14/2018 07:27:56 AM","","(21.3570695, -157.8889693)",2018-11-14 07:27:56,NA,"Tree"
"215",607863,"Light","Referred To Dept","Light poles #2, 3, 4, 5, and 7 are not working from Punahou street off ramp to Beretania street.","11/14/2018 03:14:56 AM","","(21.300465929, -157.834208566)",2018-11-14 03:14:56,NA,"RoadSafety"
"216",607855,"Trash","Referred To Dept","Bulky items left out early and encroaching on narrow road.","11/14/2018 12:13:47 AM","","(21.333332271, -157.840403735)",2018-11-14 00:13:47,NA,"Trash"
"217",607834,"Stormwater","Referred To Dept","Water meter leaking water supply","11/13/2018 05:26:51 PM","","(21.298049754, -157.711735106)",2018-11-13 17:26:51,NA,"Water"
"218",607828,"Trash","Referred To Dept","Road hazard.","11/13/2018 04:52:29 PM","","(21.396189631, -157.94070875)",2018-11-13 16:52:29,NA,"Trash"
"219",607579,"Homeless","Referred To Dept","Bed mattress along railing next to bathroom.","11/13/2018 07:20:34 AM","","(21.38231505, -157.928969805)",2018-11-13 07:20:34,NA,"Homeless"
"220",607549,"Broken / Vandalized signs","Referred To Dept","Street sign at maluniu and Uluniu missing","11/13/2018 06:53:15 AM","","(21.396916412, -157.73889133)",2018-11-13 06:53:15,NA,"RoadSafety"
"221",607387,"Light","Referred To Dept","Light doesn't work","11/13/2018 12:14:17 AM","","(21.294614819, -157.78154036)",2018-11-13 00:14:17,NA,"RoadSafety"
"222",607377,"Tree","Referred To Dept","Overgrown grass hasnnt been cut for a very long time. From Kam Hwy all along Kulena Road","11/12/2018 07:21:49 PM","","(21.391021817, -157.9557979)",2018-11-12 19:21:49,NA,"Tree"
"223",607355,"Stormwater","Referred To Dept","Plants  growing around barrier at basin","11/12/2018 06:03:44 PM","","(21.302805015, -157.856984914)",2018-11-12 18:03:44,NA,"Water"
"224",607343,"Trash","Referred To Dept","Tons and tons of rubbish all over the mountain on the Farrington side. New tents being put up daily making it unsafe to walk through. Loose dogs everywhere","11/12/2018 05:29:34 PM","","(21.460802911, -158.211846365)",2018-11-12 17:29:34,NA,"Trash"
"225",607247,"Trash","Closed","Illegal dump","11/12/2018 12:07:34 PM","11/13/2018 11:30:18 AM","(21.3117446, -157.8617989)",2018-11-12 12:07:34,2018-11-13 11:30:18,"Trash"
"226",607158,"Trash","Closed","Someone, probably HECO, HawTel, or Spectrum, cane through and trimmed the trees at the back of our property. However, instead of hauling away the rubbish they dumped it in our yard. It has now been placed on the sidewalk for them to retrieve and dispose","11/12/2018 08:25:34 AM","11/13/2018 12:00:45 PM","(21.3016097, -157.8023718)",2018-11-12 08:25:34,2018-11-13 12:00:45,"Trash"
"227",606979,"Trash","Referred To Dept","Someone just dumped al this trash here. It wasnht here an hour ago. Itgs terrible. Someone should investigate who it is","11/11/2018 06:01:27 PM","","(21.311980709, -157.861698485)",2018-11-11 18:01:27,NA,"Trash"
"228",606929,"Trash","Referred To Dept","Two water heaters, large Matress and box spring has been illegally dumped. No need to call me back to follow up","11/11/2018 11:42:52 AM","","(21.313896911, -157.806694469)",2018-11-11 11:42:52,NA,"Trash"
"229",606910,"Trash","Referred To Dept","Three bike wheels locked to the no parking sign","11/11/2018 10:49:15 AM","","(21.309271373, -157.807375244)",2018-11-11 10:49:15,NA,"Trash"
"230",606664,"Light","Referred To Dept","Intermittent light","11/09/2018 10:19:18 PM","","(21.280691, -157.81328)",2018-11-09 22:19:18,NA,"RoadSafety"
"231",606548,"Light","Referred To Dept","Burnt out light","11/09/2018 10:19:23 AM","","(21.403920495, -157.950659752)",2018-11-09 10:19:23,NA,"RoadSafety"
"232",606541,"Broken / Vandalized signs","Referred To Dept","Vandalized","11/09/2018 10:15:51 AM","","(21.40469813, -157.950424367)",2018-11-09 10:15:51,NA,"RoadSafety"
"233",606224,"Broken / Vandalized signs","Referred To Dept","Westloch shoreline park was changed to Kapapapuhi Point Park by City Council resolution 17- 230. The sign has not been changed. please  replace sign with a sign indicating the offical name","11/08/2018 04:08:34 PM","","(21.36986595, -158.023576754)",2018-11-08 16:08:34,NA,"RoadSafety"
"234",606133,"Tree","Referred To Dept","The grass in the spectator area at the RC model park hasndt been mowed in a long time. The field is fine. Thank you!","11/08/2018 12:02:12 PM","","(21.400088271, -157.765058204)",2018-11-08 12:02:12,NA,"Tree"
"235",605962,"Homeless","Referred To Dept","Owners or residents continuously park their vehicles perpendicular to roadway, in the unimproved sidewalk area limiting access to children and families trying to access the school by walking or biking.","11/08/2018 08:18:30 AM","","(21.393915, -157.7238099)",2018-11-08 08:18:30,NA,"Homeless"
"236",605960,"Homeless","Referred To Dept","Residents continuously store vehicles in unimproved sidewalk area limiting access for children and families to safely walk or bike in the full unimproved sidewalk area -  note in the picture that there is room in the driveway for the truck,  but they con","11/08/2018 08:16:14 AM","","(21.394157703, -157.723506946)",2018-11-08 08:16:14,NA,"Homeless"
"237",605955,"Homeless","Referred To Dept","Owner habitually stores vehicles  in front of house or as in the case of yesterday afternoon and this morning,  parks partially in driveway and partially in unimproved sidewalk area.  This is an obstruction to safe passage for children and families walki","11/08/2018 08:12:28 AM","","(21.3936889, -157.723982)",2018-11-08 08:12:28,NA,"Homeless"
"238",605745,"Light","Referred To Dept","Street lamp out on Koa Avenue fronting employee entrance to Hyatt Regency Waikiki.","11/08/2018 03:01:16 AM","","(21.275997497, -157.824588976)",2018-11-08 03:01:16,NA,"RoadSafety"
"239",605699,"Light","Referred To Dept","Near Robert Louis Stevenson School. Street light is out.","11/07/2018 06:54:00 PM","","(21.310170259, -157.841950683)",2018-11-07 18:54:00,NA,"RoadSafety"
"240",605697,"Trash","Referred To Dept","Multiple Garbage bags and other trash.","11/07/2018 06:36:51 PM","","(21.309301326, -157.844884481)",2018-11-07 18:36:51,NA,"Trash"
"241",605696,"Trash","Referred To Dept","Sliding door has moved from its original location to in front of another house. Please pick it up. It has been over a Month!","11/07/2018 06:29:43 PM","","(21.307613777, -157.845110565)",2018-11-07 18:29:43,NA,"Trash"
"242",605689,"Broken / Vandalized signs","Referred To Dept","Yield to pedestrians panel has been run over by a car. People drive too fast and there are lots of children walking to the school and park. Please protect our keiki-too many pedestrian injuries/deaths this year!","11/07/2018 05:41:17 PM","","(21.317700199, -157.808456566)",2018-11-07 17:41:17,NA,"RoadSafety"
"243",605648,"Flooding","Closed","Where we park is literally flooded every time we have a down pour. Storm drain are not working because no one ever took care of it.","11/07/2018 01:39:10 PM","11/08/2018 10:52:12 AM","(21.322891864, -157.909671033)",2018-11-07 13:39:10,2018-11-08 10:52:12,"Water"
"244",605297,"Light","Referred To Dept","Intermittent street light from dim to off. Next to another previously reported broken street light.","11/06/2018 11:13:49 PM","","(21.402428103, -157.808962778)",2018-11-06 23:13:49,NA,"RoadSafety"
"245",605296,"Light","Referred To Dept","Intermittent light, dim to off","11/06/2018 11:11:49 PM","","(21.40240921, -157.808924698)",2018-11-06 23:11:49,NA,"RoadSafety"
"246",605175,"Homeless","Referred To Dept","Personal property stored on cart-daily behind restroom","11/06/2018 12:10:45 PM","","(21.382515344, -157.929099343)",2018-11-06 12:10:45,NA,"Homeless"
"247",605140,"Broken / Vandalized signs","Referred To Dept","Warning sign for the Auwaiolimu and Honokui intersection is missing the top portion","","","",NA,NA,"RoadSafety"
"248",605112,"Flooding","Referred To Dept","there is water seeping out of the ground causing a growing pot/sink hole.  pavement was good 5 days ago, pothole now 6"" deep.","11/06/2018 10:18:06 AM","","(21.340074016, -157.875030035)",2018-11-06 10:18:06,NA,"Water"
"249",605095,"Stormwater","Closed","construction runoff","11/06/2018 09:53:36 AM","11/09/2018 09:41:22 AM","(21.323860875, -157.881576538)",2018-11-06 09:53:36,2018-11-09 09:41:22,"Water"
"250",605037,"Broken / Vandalized signs","Referred To Dept","Sign missing at Queen Emma  & Kukui","11/06/2018 08:31:39 AM","","(21.310648689, -157.857146777)",2018-11-06 08:31:39,NA,"RoadSafety"
"251",604813,"Pothole","Referred To Dept","potholes","11/05/2018 10:12:44 PM","","(21.423751239, -157.746021256)",2018-11-05 22:12:44,NA,"RoadSafety"
"252",604788,"Broken / Vandalized signs","Referred To Dept","No parking sign faded","11/05/2018 04:53:39 PM","","(21.321701556, -157.846152075)",2018-11-05 16:53:39,NA,"RoadSafety"
"253",604666,"Tree","Referred To Dept","the west loch multiuse path is overgrown with weeds and tal grass from asing park to the point park.","11/05/2018 11:16:12 AM","","(21.364017876, -158.023099024)",2018-11-05 11:16:12,NA,"Tree"
"254",604628,"Tree","Closed","Trees resting on power lines. There have been many outages due to fallen trees. One resulted in insurance claims from most of the residents due to a power surge when power was restored","11/05/2018 10:22:20 AM","11/05/2018 03:58:34 PM","(21.256807617, -157.814729443)",2018-11-05 10:22:20,2018-11-05 15:58:34,"Tree"
"255",604597,"Light","Referred To Dept","The pedestrian count down jumps from 65 to donet walk in a couple seconds, crossing Beretania at Alakea on the ewa side going makai.","11/05/2018 09:42:45 AM","","(21.309913749, -157.858285181)",2018-11-05 09:42:45,NA,"RoadSafety"
"256",604590,"Trash","Referred To Dept","Dumping to early in week","11/05/2018 09:29:24 AM","","(21.282021546, -157.827430349)",2018-11-05 09:29:24,NA,"Trash"
"257",604135,"Homeless","Referred To Dept","PERSONAL PROPERTY BLOCKING METERED STALL ACCESS/egress","11/04/2018 10:38:01 AM","","(21.303002935, -157.848219894)",2018-11-04 10:38:01,NA,"Homeless"
"258",604124,"Broken / Vandalized signs","Referred To Dept","No parking sign is faded and police officer commented unenforceable as is","11/04/2018 09:44:37 AM","","(21.481402228, -157.998074428)",2018-11-04 09:44:37,NA,"RoadSafety"
"259",604122,"Light","Referred To Dept","No parking sign is leaning and ready to fall","11/04/2018 09:41:48 AM","","(21.481100531, -157.998002283)",2018-11-04 09:41:48,NA,"RoadSafety"
"260",604048,"Pothole","Referred To Dept","This pothole has been present for at least three days in its current condition. It is dangerous to cars. I ran into it this evening with both front and rear right wheels. I will be arranging for examination, alignment & service at my first opportunity. I","11/03/2018 08:31:57 PM","","(21.422353124, -157.748776184)",2018-11-03 20:31:57,NA,"RoadSafety"
"261",604044,"Homeless","Referred To Dept","Itfs been 6 days since I reported these two illegal parking cars. Nothing seems to happen. On this rainy Tuesday, it was blocking the side walk when the road got slippery from the rain, which was very dangerous for people going around.","","","",NA,NA,"Homeless"
"262",603937,"Light","Referred To Dept","This street light and the light that is directly mauka is also out.","11/03/2018 08:07:13 AM","","(21.270195613, -157.815072988)",2018-11-03 08:07:13,NA,"RoadSafety"
"263",603754,"Tree","Closed","Liho Liho Elementary School. Grass has not been cut for over three weeks. Concerned Individuals: Public, Parents, Children, Principal, School Maintenance. City and County has been asked by school custodian and repeatedly told  Weere coming.","11/02/2018 10:57:08 AM","11/02/2018 04:24:55 PM","(21.278607658, -157.80638278)",2018-11-02 10:57:08,2018-11-02 16:24:55,"Tree"
"264",603640,"Tree","Referred To Dept","Coming from either direction, Kam. Hwy., Waialua Beach Rd. or Kaukonahua, the visibility around corners or stop signs are hazardous due to tall grasses.","11/02/2018 07:38:35 AM","","(21.575565045, -158.105491982)",2018-11-02 07:38:35,NA,"Tree"
"265",603470,"Light","Referred To Dept","light is not working","11/01/2018 06:31:40 PM","","(21.355008032, -158.025598552)",2018-11-01 18:31:40,NA,"RoadSafety"
"266",603422,"Pothole","Referred To Dept","Eroded and rutted shoulder of roadway","11/01/2018 01:32:39 PM","","(21.325433912, -157.840005224)",2018-11-01 13:32:39,NA,"RoadSafety"
"267",603420,"Trash","Referred To Dept","Black couch located across 91-1157 Koka Street on the left side entrance to Palm Villas.","11/01/2018 01:31:24 PM","","(21.342691354, -158.029682048)",2018-11-01 13:31:24,NA,"Trash"
"268",603331,"Homeless","Referred To Dept","""Sharee"" dockless bike illegally abandoned on sidewalk. not at private rack, not at public rack with convenience fee paid","11/01/2018 10:07:28 AM","","(21.297898664, -157.821001627)",2018-11-01 10:07:28,NA,"Homeless"
"269",603304,"Homeless","Referred To Dept","Homeless people have moved in and begun placing their property along the sidewalk behind Burger King (Kaiaulu and Coyne).  At first it was not much belongings but it has grown quite significantly - blocking sidewalks, leaving messes, and an eyesore. The","11/01/2018 09:25:17 AM","","(21.2934957, -157.82305)",2018-11-01 09:25:17,NA,"Homeless"
"270",603088,"Light","Referred To Dept","light bulb is out","11/01/2018 03:45:40 AM","","(21.354983014, -158.02567114)",2018-11-01 03:45:40,NA,"RoadSafety"
"271",603038,"Stormwater","Referred To Dept","The storm water catchment grate located in the East turnaround of Manaopaa St. is clogged with debris.","10/31/2018 10:01:36 PM","","(21.341660413, -158.018395143)",2018-10-31 22:01:36,NA,"Water"
"272",603037,"Stormwater","Referred To Dept","The storm water catchment grate in East turnaround of Hoohilu St. is clogged with debris.","10/31/2018 09:59:24 PM","","(21.342224134, -158.018763637)",2018-10-31 21:59:24,NA,"Water"
"273",603036,"Tree","Referred To Dept","A tree is encroaching over a streetlight, pole number (20-3771X.) affecting the illumination of the street. The streetlight is located on Hekuawa St. adjacent to 91-1196 Kuanoo St. by the community mailboxes.","10/31/2018 08:30:23 PM","","(21.330840083, -158.012877948)",2018-10-31 20:30:23,NA,"Tree"
"274",602881,"Trash","Referred To Dept","Bulky items placed out on curb.","10/31/2018 10:00:04 AM","","(21.298474566, -157.831786962)",2018-10-31 10:00:04,NA,"Trash"
"275",602827,"Homeless","Referred To Dept","There is tall grasses in the park of MILILANI park & ride . Do you know who is responsible.","10/31/2018 08:25:13 AM","","(21.468716413, -158.003262714)",2018-10-31 08:25:13,NA,"Homeless"
"276",602482,"Broken / Vandalized signs","Closed","A fallen street sign is blocking my car port.","10/30/2018 11:31:01 AM","10/30/2018 11:51:03 AM","(21.280979699, -157.803223787)",2018-10-30 11:31:01,2018-10-30 11:51:03,"RoadSafety"
"277",602423,"Stormwater","Closed","Drain has been clogged for weeks and with this heavy rain the pedestrian traffic is diverted into middle of the street. Lots of handicapped in the area.","10/30/2018 10:21:19 AM","10/30/2018 10:25:34 AM","(21.315208795, -157.865203527)",2018-10-30 10:21:19,2018-10-30 10:25:34,"Water"
"278",602417,"Trash","Referred To Dept","bunch of car parts , propane tanks other crap","10/30/2018 10:13:45 AM","","(21.374694087, -158.024816265)",2018-10-30 10:13:45,NA,"Trash"
"279",602316,"Stormwater","Referred To Dept","Clogged drain culvert. Homeless keep sleeping in there and it0s full of stuff and garbage is pouring out","10/30/2018 07:56:38 AM","","(21.461770079, -158.210263458)",2018-10-30 07:56:38,NA,"Water"
"280",597164,"Pothole","Closed","Big Pot Hole","10/16/2018 07:01:32 PM","","(21.3968294, -157.7404318)",2018-10-16 19:01:32,NA,"RoadSafety"
"281",602205,"Light","Referred To Dept","Crossing signal count down malfunction.  Displays count down every other crossing.  Goes from white man to red hand without count down.","10/30/2018 06:12:31 AM","","(21.293270489, -157.84257774)",2018-10-30 06:12:31,NA,"RoadSafety"
"282",602035,"Light","Referred To Dept","Light goes on and off","10/29/2018 08:15:12 PM","","(21.3551908, -158.0254174)",2018-10-29 20:15:12,NA,"RoadSafety"
"283",601789,"Light","Referred To Dept","Never worked since led upgrades done","10/29/2018 07:39:09 AM","","(21.36212699, -157.734674901)",2018-10-29 07:39:09,NA,"RoadSafety"
"284",601532,"Homeless","Closed","huge pile of rubbish ,20 by 20","","","",NA,NA,"Homeless"
"285",601529,"Light","Referred To Dept","Street light not working","10/28/2018 10:11:19 PM","","(21.292251866, -157.787533358)",2018-10-28 22:11:19,NA,"RoadSafety"
"286",601521,"Trash","Referred To Dept","There is a shopping cart dumped in the canal at the Ala Moana Beach Park. It is located close to the pedestrian bridge. No need to call me back to follow up","10/28/2018 05:18:35 PM","","(21.290589402, -157.84756377)",2018-10-28 17:18:35,NA,"Trash"
"287",601480,"Tree","Referred To Dept","Cut weeds at bus stop on Sierra dr next to 7-11","10/28/2018 01:02:42 PM","","(21.283478839, -157.800009578)",2018-10-28 13:02:42,NA,"Tree"
"288",601455,"Trash","Referred To Dept","Lumber and microwave blocking the sidewalk","10/28/2018 10:41:25 AM","","(21.307101624, -157.846509662)",2018-10-28 10:41:25,NA,"Trash"
"289",601453,"Trash","Referred To Dept","Crate with oil containers","10/28/2018 10:35:45 AM","","(21.295674329, -157.847887862)",2018-10-28 10:35:45,NA,"Trash"
"290",601443,"Flooding","Referred To Dept","Crosswalk not accessible due to chronic water not draining.","10/28/2018 09:47:55 AM","","(21.271395598, -157.822740819)",2018-10-28 09:47:55,NA,"Water"
"291",601353,"Homeless","Referred To Dept","These two cars park on the sidewalk diagonally pretty much every day which blocks the side walk. I have to roll my baby stroller onto the little slope to avoid them. One time the baby stroller almost fell on its side and hit by an oncoming car on the roa","10/27/2018 04:44:17 PM","","(21.2838354, -157.795258)",2018-10-27 16:44:17,NA,"Homeless"
"292",601207,"Broken / Vandalized signs","Referred To Dept","Another vehicle ran over the yield to pedestrians paddle sign. It needs to be fixed and the other needs to be replaced. It really does help and is important since it is a school crossing. People drive TOO fast. Consider other measures such as channelized","10/26/2018 03:10:53 PM","","(21.317676753, -157.808475974)",2018-10-26 15:10:53,NA,"RoadSafety"
"293",601189,"Light","Referred To Dept","Blinks on and off","10/26/2018 01:52:16 PM","","(21.3547498, -158.0254174)",2018-10-26 13:52:16,NA,"RoadSafety"
"294",601187,"Tree","Referred To Dept","Tree in front of house next to mailbox is a problem:","","","",NA,NA,"Tree"
"295",601112,"Broken / Vandalized signs","Referred To Dept","The sign placement was 300o Northwest on Ft. Weaver/keaunui Dr.  The sign was stored at Gentry Builder 91-1795 Keaunui Dr.","10/26/2018 10:13:47 AM","","(21.330426463, -158.021420088)",2018-10-26 10:13:47,NA,"RoadSafety"
"296",600802,"Tree","Referred To Dept","Trees overgrown and many branches over electrical and cable lines.","10/25/2018 02:45:16 PM","","(21.276655582, -157.824192822)",2018-10-25 14:45:16,NA,"Tree"
"297",600772,"Trash","Closed","Abandoned flat bed plus piles and piles of various types of garbage. This has been growing for months.","10/25/2018 01:01:33 PM","10/25/2018 02:16:29 PM","(21.324921802, -157.865855685)",2018-10-25 13:01:33,2018-10-25 14:16:29,"Trash"
"298",600573,"Tree","Referred To Dept","The whole street from houghtaing towards town","10/25/2018 07:10:36 AM","","(21.3287041, -157.869926)",2018-10-25 07:10:36,NA,"Tree"
"299",600372,"Light","Closed","The light goes off and on all night","10/24/2018 06:05:16 PM","10/25/2018 08:03:56 AM","(21.33091, -157.695952)",2018-10-24 18:05:16,2018-10-25 08:03:56,"RoadSafety"
"300",600352,"Light","Referred To Dept","Visor missing","10/24/2018 02:59:11 PM","","(21.31170745, -157.859645483)",2018-10-24 14:59:11,NA,"RoadSafety"
"301",600173,"Tree","Referred To Dept","Trees overhanging over half the road causing large vehicles to swerve into oncoming traffic.","10/24/2018 08:44:04 AM","","(21.409400479, -157.751169886)",2018-10-24 08:44:04,NA,"Tree"
"302",600126,"Light","Referred To Dept","Street light opposite look out at diamond head park","10/24/2018 07:47:39 AM","","(21.256578825, -157.804129593)",2018-10-24 07:47:39,NA,"RoadSafety"
"303",600080,"Pothole","Referred To Dept","2 potholes fronting 2938 Ualena Street.","10/24/2018 06:58:32 AM","","(21.333324783, -157.906067343)",2018-10-24 06:58:32,NA,"RoadSafety"
"304",600033,"Light","Referred To Dept","Light is out","10/24/2018 05:54:44 AM","","(21.398384607, -158.024385615)",2018-10-24 05:54:44,NA,"RoadSafety"
"305",599744,"Light","Referred To Dept","light out","10/23/2018 10:37:44 AM","","(21.360444005, -158.028685462)",2018-10-23 10:37:44,NA,"RoadSafety"
"306",599641,"Pothole","Closed","multiple cracks and potholes the entire length of kunia rd some of which are getting quite large","10/23/2018 08:16:38 AM","10/23/2018 08:32:00 AM","(21.4256439, -158.0538968)",2018-10-23 08:16:38,2018-10-23 08:32:00,"RoadSafety"
"307",599377,"Homeless","Referred To Dept","Homeless building tent city on beach garbage and dog feces everywhere","10/22/2018 09:05:03 PM","","(21.461055764, -158.209484624)",2018-10-22 21:05:03,NA,"Homeless"
"308",599285,"Pothole","Referred To Dept","Our office received complaints from residents on Halawa Hts Rd regarding a deep gouge at the very top of Halawa Hts Rd by the culdesacs (in front of specified address). It may have been caused by a water installation done by the Board of Water Supply. If","10/22/2018 12:56:42 PM","","(21.389542, -157.9057648)",2018-10-22 12:56:42,NA,"RoadSafety"
"309",599188,"Broken / Vandalized signs","Referred To Dept","Pakela Street/Alelo Street sign fell down","10/22/2018 10:04:57 AM","","(21.404553802, -158.011064993)",2018-10-22 10:04:57,NA,"RoadSafety"
"310",598720,"Trash","Referred To Dept","Dumped grocery cart filled with items right next to the bus stop. This is right across from the cemetery. No need to follow up with a call.","10/21/2018 04:57:48 PM","","(21.307390241, -157.841622667)",2018-10-21 16:57:48,NA,"Trash"
"311",598684,"Broken / Vandalized signs","Referred To Dept","Stop is upside down and hazardous coz itis loose and hanging and might fall on some residents head","10/21/2018 01:51:11 PM","","(21.395714276, -157.997297118)",2018-10-21 13:51:11,NA,"RoadSafety"
"312",598653,"Trash","Closed","Sun Oct 21, 2018. 2 adults and 14 students volunteering for 808 Cleanups cleaned up this area and bagged the garbage. Please have it picked up as soon as possible to help prevent people from tearing into the bags. Mahalo","10/21/2018 11:55:45 AM","10/22/2018 10:26:06 AM","(21.320678739, -157.861110522)",2018-10-21 11:55:45,2018-10-22 10:26:06,"Trash"
"313",598567,"Light","Referred To Dept","Many street lights out on Elm street too many to list very dark street","10/21/2018 05:25:44 AM","","(21.297623183, -157.841753961)",2018-10-21 05:25:44,NA,"RoadSafety"
"314",598514,"Trash","Referred To Dept","At the dead end of Cedar Street, there is an illegal dumping of chairs and furniture right next to the no parking sign and fire hydrant. No need to call and follow up.","10/20/2018 03:40:21 PM","","(21.296385822, -157.84304999)",2018-10-20 15:40:21,NA,"Trash"
"315",598512,"Trash","Referred To Dept","Furniture and shelves dumped right next to the bus stop. The bus stop is near Keeaumoku and Wilder on the Diamond Head side of the street. No need to call and follow up.","10/20/2018 03:36:07 PM","","(21.304808593, -157.836201403)",2018-10-20 15:36:07,NA,"Trash"
"316",598443,"Trash","Closed","Decomposing moped has been at this site for at least a year. Clearly has been abandoned along with other bulky items.","10/20/2018 09:43:34 AM","10/22/2018 08:15:29 AM","(21.307053021, -157.845385062)",2018-10-20 09:43:34,2018-10-22 08:15:29,"Trash"
"317",598421,"Trash","Referred To Dept","Furniture appliances and other bulky items","10/20/2018 08:01:01 AM","","(21.308129525, -157.845062554)",2018-10-20 08:01:01,NA,"Trash"
"318",598420,"Trash","Referred To Dept","Vacuum refrigerator door and other bulky items not picked up","10/20/2018 07:58:09 AM","","(21.309287445, -157.845007883)",2018-10-20 07:58:09,NA,"Trash"
"319",598417,"Trash","Referred To Dept","Pile of furniture and garbage blocking the sidewalk by 958 Prospect.","10/20/2018 07:54:12 AM","","(21.308641036, -157.8461797)",2018-10-20 07:54:12,NA,"Trash"
"320",598413,"Tree","Referred To Dept","The actual location is in the back of the residential homes on Kuala St. the vegetation is growing into the residents home. please have the weeds dug up next to the fences as the weeds are going into their yards. also, maintenance workers will need a key","10/20/2018 07:29:59 AM","","(21.402720372, -157.968883611)",2018-10-20 07:29:59,NA,"Tree"
"321",598398,"Light","Referred To Dept","2 street lights next to each other with pedestrian walk in between don't work.","","","",NA,NA,"RoadSafety"
"322",598358,"Tree","Closed","Merging safely is very difficult because the median grass is so tall. You cannt see the cars that are also trying to merge onto Farrington.","10/19/2018 05:50:38 PM","10/22/2018 08:01:01 AM","(21.392523826, -157.991263512)",2018-10-19 17:50:38,2018-10-22 08:01:01,"Tree"
"323",598357,"Tree","Closed","Merging safely is very difficult because the median grass is so tall. You canat see the cars that are also trying to merge onto Farrington.","10/19/2018 05:50:20 PM","10/22/2018 08:00:51 AM","(21.392523826, -157.991263512)",2018-10-19 17:50:20,2018-10-22 08:00:51,"Tree"
"324",598356,"Tree","Closed","Merging safely is very difficult because the median grass is so tall. You canat see the cars that are also trying to merge onto Farrington.","10/19/2018 05:50:10 PM","10/22/2018 08:00:44 AM","(21.392523826, -157.991263512)",2018-10-19 17:50:10,2018-10-22 08:00:44,"Tree"
"325",598355,"Tree","Closed","Merging safely is very difficult because the median grass is so tall. You canat see the cars that are also trying to merge onto Farrington.","10/19/2018 05:49:51 PM","10/22/2018 08:00:35 AM","(21.392523826, -157.991263512)",2018-10-19 17:49:51,2018-10-22 08:00:35,"Tree"
"326",598354,"Tree","Closed","Merging safely is very difficult because the median grass is so that you cantt see the other vehicles trying to get onto Farrington.","10/19/2018 05:47:45 PM","10/22/2018 08:00:27 AM","(21.39256164, -157.991215828)",2018-10-19 17:47:45,2018-10-22 08:00:27,"Tree"
"327",598353,"Tree","Closed","Merging safely is very difficult because the median grass is so that you cantt see the other vehicles trying to get onto Farrington.","10/19/2018 05:47:35 PM","10/22/2018 08:00:09 AM","(21.39256164, -157.991215828)",2018-10-19 17:47:35,2018-10-22 08:00:09,"Tree"
"328",598234,"Homeless","Referred To Dept","Stored vehicle in unimproved sidewalk area.  Not acceptable to park on driveway apron in public property.  Car parked perpendicular to roadway at edge of pavement does not leave room for bike or pedestrian to travel in unimproved sidewalk area if vehicle","10/19/2018 10:42:16 AM","","(21.397378343, -157.736472808)",2018-10-19 10:42:16,NA,"Homeless"
"329",598233,"Homeless","Referred To Dept","Black Jeep is parked perpendicular to roadway in unimproved sidewalk area.  Vehicle is being stored.  Return surface to acceptable unimproved sidewalk material.  Owner previously had gravel and removed under previous complaint but has not restored the ar","10/19/2018 10:40:22 AM","","(21.397004027, -157.737095563)",2018-10-19 10:40:22,NA,"Homeless"
"330",598229,"Homeless","Referred To Dept","Boat being stored in the unimproved sidewalk area instead of on private property","10/19/2018 10:36:41 AM","","(21.39718861, -157.732633812)",2018-10-19 10:36:41,NA,"Homeless"
"331",598225,"Homeless","Referred To Dept","Two vehicles have been stored here on Alala Road near the intersection of Kawailoa Road since Tuesday .  White truck and gold SUV. -  I called it in the HPD 911 but no action is taken .  This is a violation of section 29 of ROH misappropriation of public","10/19/2018 10:32:20 AM","","(21.394117432, -157.723491756)",2018-10-19 10:32:20,NA,"Homeless"
"332",598202,"Trash","Closed","Dumped grocery cart left at the pedestrian island near the crosswalk. No need to call me to follow up","10/19/2018 09:23:47 AM","10/19/2018 09:45:04 AM","(21.301917734, -157.863257012)",2018-10-19 09:23:47,2018-10-19 09:45:04,"Trash"
"333",598195,"Pothole","Closed","Potholes all along this stretch of Hwy 72 and the grass along the edge of the street is out of control causing a major safety issue. The sidewalk/bike lane is overgrown causing a safety issue because pedestrians are now walking along the hwy and not on t","10/19/2018 09:06:34 AM","10/19/2018 09:17:20 AM","(21.3422417, -157.7064051)",2018-10-19 09:06:34,2018-10-19 09:17:20,"RoadSafety"
"334",597992,"Pothole","Referred To Dept","Potholes in right lane heading towards lookout right after hairpin turn","10/19/2018 12:31:18 AM","","(21.314768536, -157.825148497)",2018-10-19 00:31:18,NA,"RoadSafety"
"335",597930,"Pothole","Referred To Dept","Pothole in front of driveway","10/18/2018 01:58:29 PM","","(21.313214727, -157.862400203)",2018-10-18 13:58:29,NA,"RoadSafety"
"336",597742,"Trash","Referred To Dept","For so many times, they have put bulky items blocking the side walk, which made it hard/unwalkable for baby strollers or pedestrians. I even had to roll my baby stroller onto the road in to the fast going off ramp traffic. Their selfish behavior put othe","10/18/2018 06:49:46 AM","","(21.2880702, -157.8226774)",2018-10-18 06:49:46,NA,"Trash"
"337",597600,"Homeless","Referred To Dept","Storage container located within front and side setback area of property.  The container has not moved in over a year.  Building code violation needs to be addressed as owner constantly parks in public right of way because parking area is being used as a","10/17/2018 08:50:50 PM","","(21.3978795, -157.7296182)",2018-10-17 20:50:50,NA,"Homeless"
"338",597531,"Trash","Referred To Dept","On Makakilo Drive at Palehua Hillside (The address may be 92-1260 Makakilo Drive, but don t hold me to that) there is a pile of stuff that Iom guessing has been left out for bulky pickup. But our collection date is the first Monday of the month. Today is","10/17/2018 12:38:39 PM","","(21.366852206, -158.085420362)",2018-10-17 12:38:39,NA,"Trash"
"339",597382,"Homeless","Referred To Dept","Big white work truck without plates is habitually parked in the public right of way and needs to be removed by the city.  Vehicles must move more than 50 feet every 24 hours per the ROH. Sergeant Kendall called me Monday to say that this truck had been m","10/17/2018 07:57:52 AM","","(21.3926365, -157.7332366)",2018-10-17 07:57:52,NA,"Homeless"
"340",597378,"Homeless","Referred To Dept","Trash cans are being stored outside of property line in the unimproved sidewalk area.  Needs to keep their garbage on their own property.","10/17/2018 07:49:21 AM","","(21.4031018, -157.7421549)",2018-10-17 07:49:21,NA,"Homeless"
"341",597372,"Pothole","Referred To Dept","Many potholes at the intersection, right at the dip. This entire Gulick Ave needs road work done.","10/17/2018 07:40:09 AM","","(21.3323165, -157.8808468)",2018-10-17 07:40:09,NA,"RoadSafety"
"342",597167,"Light","Referred To Dept","Street light is out and has been for a few weeks. It is right in front of a construction site making it dangerous for people walking after dusk.","10/16/2018 07:44:27 PM","","(21.279468709, -157.763944909)",2018-10-16 19:44:27,NA,"RoadSafety"
"343",597142,"Broken / Vandalized signs","Referred To Dept","Faded unreadable parking regulations sign. Across from 1404 Kalaepohaku Street, and in front of 1443 Kalaepohaku, and 1471 Kalaepohaku","10/16/2018 04:19:47 PM","","(21.292968808, -157.807941077)",2018-10-16 16:19:47,NA,"RoadSafety"
"344",597098,"Stormwater","Referred To Dept","Catch basin located in front of 91-1531 Waimahui place.","10/16/2018 01:37:37 PM","","(21.337996048, -158.022633229)",2018-10-16 13:37:37,NA,"Water"
"345",597049,"Homeless","Referred To Dept","storage of junk 1 moth","","","",NA,NA,"Homeless"
"346",596684,"Light","Referred To Dept","light pole directly infront of the court house and above crosswalk is out. hard to see pedestrians in crosswalk","10/15/2018 07:51:18 PM","","(21.5878465, -158.1034273)",2018-10-15 19:51:18,NA,"RoadSafety"
"347",596587,"Broken / Vandalized signs","Referred To Dept","Missing no parking here to crosswalk sign","10/15/2018 11:39:47 AM","","(21.394920299, -157.719416714)",2018-10-15 11:39:47,NA,"RoadSafety"
"348",596584,"Tree","Referred To Dept","short side tree hanging so low it scratches my roof","10/15/2018 11:34:12 AM","","(21.368949541, -158.023974177)",2018-10-15 11:34:12,NA,"Tree"
"349",596582,"Tree","Referred To Dept","tree hanging low at the end of pa street ( short side )","10/15/2018 11:32:49 AM","","(21.368294408, -158.023913705)",2018-10-15 11:32:49,NA,"Tree"
"350",596579,"Tree","Closed","tree hanging low at the end of pa street ( short side )","10/15/2018 11:30:44 AM","10/15/2018 11:39:56 AM","(21.368294408, -158.023913705)",2018-10-15 11:30:44,2018-10-15 11:39:56,"Tree"
"351",596575,"Tree","Referred To Dept","tree way overgrown almost hitting my truck","10/15/2018 11:27:51 AM","","(21.367853159, -158.023585049)",2018-10-15 11:27:51,NA,"Tree"
"352",596569,"Tree","Referred To Dept","tree overgrown st the end of 91-1000 Okupe St, Ewa Beach, HI 96706","10/15/2018 11:25:07 AM","","(21.366668944, -158.0228257)",2018-10-15 11:25:07,NA,"Tree"
"353",596567,"Tree","Referred To Dept","tree way over grown at the end of 91-1033 Pa St, Ewa Beach, HI 96706","10/15/2018 11:20:50 AM","","(21.368093092, -158.024804064)",2018-10-15 11:20:50,NA,"Tree"
"354",596535,"Tree","Referred To Dept","Disposition of most recent request was that tree would be trimmed August 2018. It4s now October and tree still not trimmed.  All the while, tree branches continue to encroach on our property and fall in our yard. I am concerned that tree with fall and da","10/15/2018 10:40:25 AM","","(21.403195497, -157.786306436)",2018-10-15 10:40:25,NA,"Tree"
"355",596082,"Light","Referred To Dept","Sits atop stop light in traffic island.  Dangerous for pedestrians when cars turning right onto Kapiolani.  Very dark at that crosswalk.  There is also another street light fronting 2488 The Iolani apt building that appears to be hidden by trees.  But it","10/14/2018 09:46:21 PM","","(21.287566897, -157.823798216)",2018-10-14 21:46:21,NA,"RoadSafety"
"356",596081,"Pothole","Closed","On Kunia Road in South bound lane about 200 feet before Traffic light entrance to NSA Kunia Regional Security Operations Center.  Hazardous 50 llong section of several Deep and Wide Ruts in roadway (both in lane and shoulder).  The ruts run in same direc","10/14/2018 09:23:25 PM","10/15/2018 10:36:41 AM","(21.476910828, -158.050433851)",2018-10-14 21:23:25,2018-10-15 10:36:41,"RoadSafety"
"357",596078,"Light","Referred To Dept","Light is out","10/14/2018 08:11:03 PM","","(21.388520761, -158.02318403)",2018-10-14 20:11:03,NA,"RoadSafety"
"358",596074,"Trash","Referred To Dept","Dryer dumped on the Ewa side of Magazine Street. No need to follow up and call.","10/14/2018 07:17:45 PM","","(21.30835051, -157.845135425)",2018-10-14 19:17:45,NA,"Trash"
"359",596073,"Trash","Referred To Dept","Extra large white refrigerator and vacuum on Prospect and Magazine, close to bus stop. No need to call to follow up","10/14/2018 07:13:52 PM","","(21.309238135, -157.845036694)",2018-10-14 19:13:52,NA,"Trash"
"360",596072,"Trash","Referred To Dept","7 garbage bags and cardboard right next to bus stop. No need to call to follow up. Bus stop on Prospect and Magazine Street","10/14/2018 07:12:11 PM","","(21.309326072, -157.844832251)",2018-10-14 19:12:11,NA,"Trash"
"361",596071,"Trash","Referred To Dept","Dumped grocery cart on Wilder and Pensacola. Right next to cemetery on the Ewa side of street. No need to call to follow up","10/14/2018 06:56:32 PM","","(21.307341223, -157.841340576)",2018-10-14 18:56:32,NA,"Trash"
"362",596070,"Trash","Referred To Dept","Microwave on sidewalk. Located on Pensacola and Wilder, mauka Diamond Head side. No need to call to follow up.","10/14/2018 06:54:11 PM","","(21.307363211, -157.841173096)",2018-10-14 18:54:11,NA,"Trash"
"363",596066,"Trash","Referred To Dept","Dumped toilet on the Diamond Head side of street. No need to call and follow up","10/14/2018 06:31:59 PM","","(21.306417767, -157.84213606)",2018-10-14 18:31:59,NA,"Trash"
"364",596065,"Trash","Referred To Dept","Metal screen door on mauka side of street. No need to call and follow up.","10/14/2018 06:18:44 PM","","(21.307691578, -157.844699341)",2018-10-14 18:18:44,NA,"Trash"
"365",596060,"Broken / Vandalized signs","Referred To Dept","broken street sign","10/14/2018 05:27:28 PM","","(21.303010459, -157.799946644)",2018-10-14 17:27:28,NA,"RoadSafety"
"366",596056,"Broken / Vandalized signs","Referred To Dept","broken and dangling street crossing button. light will not actuate without button press, please fix before i become stranded here","10/14/2018 04:46:15 PM","","(21.290668921, -157.837352157)",2018-10-14 16:46:15,NA,"RoadSafety"
"367",595972,"Trash","Referred To Dept","Large household appliances and wood and other items have been dumped on the makai side of the street. Photo included. No need to call me to follow up.","10/14/2018 09:26:42 AM","","(21.299845465, -157.841034839)",2018-10-14 09:26:42,NA,"Trash"
"368",595949,"Broken / Vandalized signs","Closed","dangling street crossing button","10/14/2018 08:20:22 AM","10/15/2018 08:08:30 AM","(21.290695217, -157.837434181)",2018-10-14 08:20:22,2018-10-15 08:08:30,"RoadSafety"
"369",595944,"Broken / Vandalized signs","Closed","dangling crossing button","10/14/2018 08:07:15 AM","10/15/2018 08:08:24 AM","(21.290715141, -157.837339022)",2018-10-14 08:07:15,2018-10-15 08:08:24,"RoadSafety"
"370",595943,"Broken / Vandalized signs","Closed","dangling crossing button","10/14/2018 08:04:54 AM","10/15/2018 08:09:58 AM","(21.290715141, -157.837339022)",2018-10-14 08:04:54,2018-10-15 08:09:58,"RoadSafety"
"371",595820,"Tree","Closed","There are two large branches broken and hanging from a tree located in Puaina St. turnaround located by 91-1236 Puaina St.","10/13/2018 10:36:26 AM","10/15/2018 09:34:07 AM","(21.343382991, -158.026137388)",2018-10-13 10:36:26,2018-10-15 09:34:07,"Tree"
"372",595818,"Trash","Referred To Dept","Dump site","10/13/2018 10:12:23 AM","","(21.3969009, -157.7652963)",2018-10-13 10:12:23,NA,"Trash"
"373",595797,"Homeless","Referred To Dept","Rusted wheel chair, lawn chairs and miscellaneous junk","10/13/2018 08:59:40 AM","","(21.33919003, -157.697787183)",2018-10-13 08:59:40,NA,"Homeless"
"374",595716,"Light","Closed","Light flashes rapidly","10/12/2018 07:13:27 PM","10/15/2018 08:12:41 AM","(21.379901998, -158.028785488)",2018-10-12 19:13:27,2018-10-15 08:12:41,"RoadSafety"
"375",595676,"Tree","Referred To Dept","overgrown grass causing a rodent infestation! at the end of 91-1372 Kaihuopalaai St, Ewa Beach, HI 96706","","","",NA,NA,"Tree"
"376",595233,"Tree","Referred To Dept","High weeds and vines along both sides of Nuuanu Pali Drive need to be trimmed as they are causing visual impairment to drivers on this road. Vines need to be trimmed / removed on traffic signs .","","","",NA,NA,"Tree"
"377",595211,"Pothole","Referred To Dept","On Waipahu depot on the TOYOTA Waipahu Close to the intersection","10/11/2018 12:08:25 PM","","(21.3833892, -158.006278733)",2018-10-11 12:08:25,NA,"RoadSafety"
"378",595210,"Pothole","Closed","On Waipahu depot on the TOYOTA Waipahu Close to the intersection","10/11/2018 12:06:37 PM","10/11/2018 12:15:49 PM","(21.3833892, -158.006278733)",2018-10-11 12:06:37,2018-10-11 12:15:49,"RoadSafety"
"379",595096,"Broken / Vandalized signs","Referred To Dept","No parking sign broken by garage entrance to Salt at Our Kakaako","10/11/2018 09:39:18 AM","","(21.298597943, -157.861777889)",2018-10-11 09:39:18,NA,"RoadSafety"
"380",594806,"Light","Referred To Dept","There are about 17 street lights out from the intersection of Kolowaka and Kapolei Parkway to just past the entrance to Palm Villas 2.  Eight lights out on the north (Palm Court) side.  Nine lights out on the south (Palm Villas 2) side.  Very dark with t","10/10/2018 05:52:40 PM","","(21.337502245, -158.032151085)",2018-10-10 17:52:40,NA,"RoadSafety"
"381",594778,"Tree","Referred To Dept","this grass is now 3 feet tall and had not been cut for months by the city. now there are rats/mice living in there who regularly come into my adjacent yard. my association mgmt company says this is the Honolulu's responsibility, not theirs. please cut as","10/10/2018 03:09:29 PM","","(21.294158999, -157.674369088)",2018-10-10 15:09:29,NA,"Tree"
"382",594743,"Tree","Referred To Dept","tree and plant material in area maintained by c&c overgrown. have not seen anyone since July.","10/10/2018 01:32:09 PM","","(21.2942194, -157.6745512)",2018-10-10 13:32:09,NA,"Tree"
"383",594738,"Tree","Referred To Dept","Re 2524 Oahu Ave, distance from shrubs near corner are about 8 feet from curb. But two issues: shrubs are blocking sight distance for drivers turning right into E. Manoa going mauka. Also, I believe setback is 11 feet between property line and curb. See","10/10/2018 01:08:26 PM","","(21.30798794, -157.816448314)",2018-10-10 13:08:26,NA,"Tree"
"384",594714,"Light","Referred To Dept","Broken","10/10/2018 12:02:45 PM","","(21.328150641, -158.088627625)",2018-10-10 12:02:45,NA,"RoadSafety"
"385",594221,"Trash","Closed","Ewa, mauka corner of Varsity Pl. and Kalo Pl.  Intersection being used as moped dumping ground. People strip mopeds and leave parts, dump fluids, etc in area.","10/09/2018 05:39:25 PM","10/10/2018 08:02:44 AM","(21.292271067, -157.8196101)",2018-10-09 17:39:25,2018-10-10 08:02:44,"Trash"
"386",594220,"Homeless","Referred To Dept","Homeless have moved into Kalo Place Mini Park.  Violating park closing hours and erecting shelters and a flag within the park.","10/09/2018 05:34:28 PM","","(21.291783658, -157.819105518)",2018-10-09 17:34:28,NA,"Homeless"
"387",593703,"Pothole","Referred To Dept","temporary pothole patch is shrinking","10/08/2018 09:15:24 PM","","(21.386293738, -157.941578438)",2018-10-08 21:15:24,NA,"RoadSafety"
"388",593701,"Light","Referred To Dept","Intersection of Kuhio and Launiu","10/08/2018 08:22:51 PM","","(21.2825707, -157.8297335)",2018-10-08 20:22:51,NA,"RoadSafety"
"389",593624,"Light","Closed","Almost all of the lights in and around the Kakaako Beach Park are not turned on. Honolulu Marathongs Lanikai Juice Run Club meets at this beach park every Thursday and it has become increasingly more dangerous for participating runners and coaches becaus","10/08/2018 01:21:25 PM","10/08/2018 01:47:32 PM","(21.2937729, -157.8642225)",2018-10-08 13:21:25,2018-10-08 13:47:32,"RoadSafety"
"390",593609,"Tree","Referred To Dept","tree blocking sidewalk","10/08/2018 12:43:25 PM","","(21.2974424, -157.8405173)",2018-10-08 12:43:25,NA,"Tree"
"391",593607,"Tree","Closed","Overgrown weed patch about 30ft x 100ft. There are some halekoa weed trees over 10ft tall growing for the past 2 yrs.","10/08/2018 12:42:21 PM","","(21.357107296, -157.888965408)",2018-10-08 12:42:21,NA,"Tree"
"392",587985,"Tree","Closed","Why is the side of the road and the median not mowed on a regular basis. It look like third world country","09/25/2018 01:41:06 PM","09/26/2018 12:53:19 PM","(21.3640728, -157.7369476)",2018-09-25 13:41:06,2018-09-26 12:53:19,"Tree"
"393",593581,"Tree","Closed","The grass along the highway is at least 3 feet high along the sidewalk / bike lane on the makai side of the street.  The mauka side looks as though it has been mowed recently, maybe by the owners of the polo fields? The high grass/weeds is becoming a saf","10/08/2018 12:08:07 PM","10/08/2018 12:58:41 PM","(21.3422417, -157.7064051)",2018-10-08 12:08:07,2018-10-08 12:58:41,"Tree"
"394",593057,"Light","Referred To Dept","Walkway light cycles on and off","10/07/2018 06:56:31 PM","","(21.386559257, -158.021992209)",2018-10-07 18:56:31,NA,"RoadSafety"
"395",593036,"Trash","Referred To Dept","It's ugly!","10/07/2018 03:20:47 PM","","(21.319511007, -157.830618851)",2018-10-07 15:20:47,NA,"Trash"
"396",593030,"Tree","Referred To Dept","Overgrown lot.","10/07/2018 02:53:41 PM","","(21.36977729, -157.734114136)",2018-10-07 14:53:41,NA,"Tree"
"397",593023,"Trash","Closed","On the drive up Tantalus someone dumped a mattress.  It now is covered with spray paint.","10/07/2018 02:25:52 PM","10/08/2018 08:19:44 AM","(21.327763708, -157.8261217)",2018-10-07 14:25:52,2018-10-08 08:19:44,"Trash"
"398",592947,"Light","Referred To Dept","Light cycles on and off at night","10/07/2018 07:50:55 AM","","(21.385968555, -158.020703808)",2018-10-07 07:50:55,NA,"RoadSafety"
"399",592788,"Broken / Vandalized signs","Referred To Dept","There is a parking sign laying on the sidewalk right in front of a telephone pole. The telephone pole is right in front of the Honolulu Academy of Arts.No need to follow up with this report.","10/06/2018 08:25:39 AM","","(21.303693837, -157.848949151)",2018-10-06 08:25:39,NA,"RoadSafety"
"400",592695,"Trash","Referred To Dept","Two queen or king sized matresses on the Ewa side of the Street. This is located right next to a yellow fire hydrant across from Ala Moana Shopping Center. No need to call me back","10/05/2018 09:45:13 PM","","(21.291509933, -157.847663429)",2018-10-05 21:45:13,NA,"Trash"
"401",592694,"Trash","Referred To Dept","There are boxes and other items hiding behind the guard rail located at the on ramp by Ward and Kinalau Street. These items are on the grass. No need to contact me to follow up.","10/05/2018 09:36:13 PM","","(21.305422691, -157.848763159)",2018-10-05 21:36:13,NA,"Trash"
"402",592649,"Light","Referred To Dept","The street light does not come on at night","10/05/2018 01:35:13 PM","","(21.3678511, -157.7394538)",2018-10-05 13:35:13,NA,"RoadSafety"
"403",592592,"Stormwater","Referred To Dept","White/greenish substance coating the curb and gutter from the source to drain inlet. Looks as if the residents stripped their painted carport floor","10/05/2018 10:42:32 AM","","(21.307632521, -158.018530928)",2018-10-05 10:42:32,NA,"Water"
"404",592462,"Homeless","Referred To Dept","Misappropriation of public property for private use , homeowners are storing vehicles in the unimproved sidewalk area,  narrow access for students to get to school and police will not cite as cars are not parked on the asphalt despite the narrow passage,","10/05/2018 07:22:42 AM","","(21.39406148, -157.723558986)",2018-10-05 07:22:42,NA,"Homeless"
"405",592278,"Light","Referred To Dept","Light is completely out on Puuomao St.","10/04/2018 07:38:43 PM","","(21.308545605, -157.709322284)",2018-10-04 19:38:43,NA,"RoadSafety"
"406",592277,"Light","Referred To Dept","This is the 4th of four street light in a row that don/t work on Puuomao Place. Please help.  Thank you.","10/04/2018 07:36:41 PM","","(21.308844081, -157.709478876)",2018-10-04 19:36:41,NA,"RoadSafety"
"407",592276,"Light","Referred To Dept","This is one of 4 lights in a row that are not working. Please help.","10/04/2018 07:34:14 PM","","(21.30920606, -157.709599617)",2018-10-04 19:34:14,NA,"RoadSafety"
"408",592275,"Homeless","Closed","Abandoned van taking up street parking","10/04/2018 07:23:41 PM","10/05/2018 08:29:08 AM","(21.296900468, -157.859325881)",2018-10-04 19:23:41,2018-10-05 08:29:08,"Homeless"
"409",592272,"Light","Referred To Dept","Street light out for one week","10/04/2018 07:00:39 PM","","(21.3927275, -158.0041809)",2018-10-04 19:00:39,NA,"RoadSafety"
"410",592265,"Pothole","Referred To Dept","Very deep pothole in left lane going makai towards Waikiki on Mccully bridge going over three Ala Wai","10/04/2018 06:03:53 PM","","(21.289102832, -157.832474108)",2018-10-04 18:03:53,NA,"RoadSafety"
"411",592080,"Trash","Referred To Dept","Bulky items dumped from Lahilahi sweep, blocking sidewalk, unsafe","10/04/2018 09:54:24 AM","","(21.458617716, -158.203170347)",2018-10-04 09:54:24,NA,"Trash"
"412",591993,"Tree","Referred To Dept","Grass growing over sidewalk","10/04/2018 07:58:31 AM","","(21.369686633, -157.734277996)",2018-10-04 07:58:31,NA,"Tree"
"413",591902,"Homeless","Referred To Dept","Two separate issues at one location.","","","",NA,NA,"Homeless"
"414",591897,"Flooding","Referred To Dept","Homeowner is irrigating unimproved sidewalk area - likely broken pipe on automated timer as we see this condition every afternoon when riding my kids home from school","10/04/2018 05:58:13 AM","","(21.398898431, -157.734128789)",2018-10-04 05:58:13,NA,"Water"
"415",591888,"Broken / Vandalized signs","Referred To Dept","No parking signs between 2700 and 3300 tantalus require replacement.  Need to enforce parking/camping at night.  Difficult to cite without proper signage.  Mahalo!","10/04/2018 05:49:09 AM","","(21.317068644, -157.830642402)",2018-10-04 05:49:09,NA,"RoadSafety"
"416",591721,"Tree","Referred To Dept","Hi guys! I was wondering if you could cut or spray the weeds and over growth along the fence of the Koanakoa school and side walk. Its kind like walking in a mini jungle! ??Lol! Thank you so much!??","10/03/2018 06:06:04 PM","","(21.318597428, -157.852662665)",2018-10-03 18:06:04,NA,"Tree"
