"","id","ReportType","CurrentStatus","Description","DateCreate_Converted","DateClosed_Converted","location","crecondate","clocondate","HLReportType","timespan","WeeksToClose"
"1",636867,"Broken / Vandalized signs","Closed","Looks like someone hit the signs down. On Paiwa heading toward the east bound on ramp.","01/27/2019 10:23:25 PM","02/01/2019 08:16:54 AM","(21.396820276, -158.009726946)",2019-01-27 22:23:25,2019-02-01 08:16:54,"RoadSafety",381209s (~4.41 days),0.630305886243386
"2",635709,"Trash","Closed","illegal dump site and abandoned red and white boat","01/24/2019 01:29:04 PM","01/24/2019 02:25:01 PM","(21.324708421, -157.681087532)",2019-01-24 13:29:04,2019-01-24 14:25:01,"Trash",3357s (~55.95 minutes),0.00555059523809524
"3",633960,"Trash","Closed","There are abt 4 damaged/abandoned cars parked on Bingham Street close to the Church of the Crossroad.","01/21/2019 06:34:00 PM","01/22/2019 09:03:17 AM","(21.2941362, -157.8225843)",2019-01-21 18:34:00,2019-01-22 09:03:17,"Trash",52157s (~14.49 hours),0.0862384259259259
"4",632956,"Homeless","Closed","is this one of the private street parking areas in Kaka'ako? if not, how are they allowed to set up a 3 story house and business in a public street parking stalls?","01/18/2019 08:58:24 AM","01/18/2019 09:23:12 AM","(21.2959865, -157.859981)",2019-01-18 08:58:24,2019-01-18 09:23:12,"Homeless",1488s (~24.8 minutes),0.00246031746031746
"5",631519,"Tree","Closed","Looks like a broken irrigation pipe, lots of water flowing.","01/15/2019 12:05:10 PM","01/16/2019 08:02:21 AM","(21.370179349, -157.926698705)",2019-01-15 12:05:10,2019-01-16 08:02:21,"Tree",71831s (~19.95 hours),0.118768187830688
"6",630261,"Homeless","Closed","Storing property on public roads","01/12/2019 03:56:56 PM","01/14/2019 09:02:13 AM","(21.289425734, -157.706973171)",2019-01-12 15:56:56,2019-01-14 09:02:13,"Homeless",147917s (~1.71 days),0.244571759259259
"7",629120,"Trash","Closed","Under the pedestrian overpass on the mauka side of H1","01/09/2019 05:05:15 PM","01/10/2019 08:08:14 AM","(21.296316461, -157.823964103)",2019-01-09 17:05:15,2019-01-10 08:08:14,"Trash",54179s (~15.05 hours),0.0895816798941799
"8",628574,"Tree","Closed","Trees are growing into the power lines","01/08/2019 09:51:01 PM","01/09/2019 07:54:02 AM","(21.45467, -157.8276516)",2019-01-08 21:51:01,2019-01-09 07:54:02,"Tree",36181s (~10.05 hours),0.059823082010582
"9",626600,"Homeless","Closed","This car is always blocking the sidewalk and when I pass I9m forced to go on the roadway.","01/04/2019 10:10:42 AM","01/04/2019 10:26:06 AM","(21.3758771, -157.7376376)",2019-01-04 10:10:42,2019-01-04 10:26:06,"Homeless",924s (~15.4 minutes),0.00152777777777778
"10",624953,"Broken / Vandalized signs","Closed","Pole no sign","12/31/2018 12:30:03 PM","12/31/2018 01:44:28 PM","(21.315409212, -157.865392285)",2018-12-31 12:30:03,2018-12-31 13:44:28,"RoadSafety",4465s (~1.24 hours),0.00738260582010582
"11",623884,"Flooding","Closed","Spilling water pipe is flooding the trail and potentially causing a landslide.","12/27/2018 10:18:55 PM","12/28/2018 08:21:47 AM","(21.316984872, -157.776954601)",2018-12-27 22:18:55,2018-12-28 08:21:47,"Water",36172s (~10.05 hours),0.0598082010582011
"12",623821,"Tree","Closed","Tree has fallen over past few weeks and is blocking the sidewalk causing a safety hazard. This tree has been leaning more and more when there is rain and may fall if not cut at base. Many students use the walkway to travel to and from nearby Lehua Elemen","12/27/2018 01:09:25 PM","12/27/2018 01:17:54 PM","(21.388484022, -157.972544855)",2018-12-27 13:09:25,2018-12-27 13:17:54,"Tree",509s (~8.48 minutes),0.000841600529100529
"13",619800,"Light","Closed","Street light","12/13/2018 11:03:54 PM","12/14/2018 08:30:10 AM","(21.442829479, -158.018615626)",2018-12-13 23:03:54,2018-12-14 08:30:10,"RoadSafety",33976s (~9.44 hours),0.0561772486772487
"14",619615,"Tree","Closed","Plants need to be off the exit ramp. Fence need to be repaired. Behind the stage needs to be cleaned","12/13/2018 09:20:15 AM","12/13/2018 09:33:29 AM","(21.309002872, -157.861510459)",2018-12-13 09:20:15,2018-12-13 09:33:29,"Tree",794s (~13.23 minutes),0.00131283068783069
"15",618347,"Tree","Closed","large cactus has fallen into the bike lane north bound before the bridge","12/10/2018 02:47:56 PM","12/10/2018 02:58:44 PM","(21.423840232, -158.007738042)",2018-12-10 14:47:56,2018-12-10 14:58:44,"Tree",648s (~10.8 minutes),0.00107142857142857
"16",617639,"Light","Closed","on traffic island at Kona intersection","12/08/2018 06:43:29 PM","12/10/2018 08:37:16 AM","(21.290105872, -157.838497759)",2018-12-08 18:43:29,2018-12-10 08:37:16,"RoadSafety",136427s (~1.58 days),0.225573743386243
"17",616659,"Light","Closed","At intersection of Ulupii St. and Uluamahi Pl. Very dark corner now.","12/06/2018 06:59:14 AM","12/06/2018 08:27:42 AM","(21.37542901, -157.756160058)",2018-12-06 06:59:14,2018-12-06 08:27:42,"RoadSafety",5308s (~1.47 hours),0.00877645502645503
"18",615873,"Trash","Closed","items piled up","12/04/2018 01:16:40 PM","12/05/2018 07:54:05 AM","(21.3600765, -158.0276065)",2018-12-04 13:16:40,2018-12-05 07:54:05,"Trash",67045s (~18.62 hours),0.110854828042328
"19",615481,"Homeless","Closed","South-bound side of the bridge, the homeless are really starting to take over the sidewalk. They already have their lean-to tents taking half of the side walk, and ""fishermen"" taking over the half, but now they are starting to park mopeds in the little","12/04/2018 05:39:23 AM","12/04/2018 08:29:28 AM","(21.314567894, -157.888184896)",2018-12-04 05:39:23,2018-12-04 08:29:28,"Homeless",10205s (~2.83 hours),0.0168733465608466
"20",615048,"Tree","Closed","multiple trees on the corner of 91-1015 Olepekupe St, Ewa Beach, HI 96706 that are low hanging , have dead branches. these trees are a saftey concern as while I was taking the photo of the trees a branch fell and just about hit me. something needs to be","12/03/2018 09:46:26 AM","12/04/2018 12:49:06 PM","(21.369634543, -158.024848216)",2018-12-03 09:46:26,2018-12-04 12:49:06,"Tree",97360s (~1.13 days),0.160978835978836
"21",611116,"Tree","Closed","Broken branch","11/24/2018 02:35:37 PM","11/26/2018 09:07:28 AM","(21.283011326, -157.799630315)",2018-11-24 14:35:37,2018-11-26 09:07:28,"Tree",153111s (~1.77 days),0.253159722222222
"22",610392,"Trash","Closed","several mattresses had been dumped at the stop sign a few days ago","11/20/2018 05:30:24 PM","11/21/2018 07:58:30 AM","(21.335855703, -157.877754559)",2018-11-20 17:30:24,2018-11-21 07:58:30,"Trash",52086s (~14.47 hours),0.0861210317460318
"23",608597,"Homeless","Closed","Note the debris collecting around the wheels.","11/15/2018 10:08:37 AM","11/15/2018 10:44:40 AM","(21.424008245, -158.004289941)",2018-11-15 10:08:37,2018-11-15 10:44:40,"Homeless",2163s (~36.05 minutes),0.00357638888888889
"24",608011,"Trash","Closed","3 Stored broken down vehicles in the public right of way. Been there for months, safety hazard","11/14/2018 07:38:38 AM","11/14/2018 08:30:50 AM","(21.406092, -157.7941286)",2018-11-14 07:38:38,2018-11-14 08:30:50,"Trash",3132s (~52.2 minutes),0.00517857142857143
"25",608010,"Trash","Closed","3 Stored broken down vehicles in the public right of way. Been there for months, safety hazard","11/14/2018 07:37:49 AM","11/14/2018 08:30:30 AM","(21.406092, -157.7941286)",2018-11-14 07:37:49,2018-11-14 08:30:30,"Trash",3161s (~52.68 minutes),0.00522652116402116
"26",608009,"Pothole","Closed","Large pothole prior to stoplight heading South.","11/14/2018 07:37:09 AM","11/14/2018 08:18:42 AM","(21.393177051, -157.960430044)",2018-11-14 07:37:09,2018-11-14 08:18:42,"RoadSafety",2493s (~41.55 minutes),0.00412202380952381
"27",607247,"Trash","Closed","Illegal dump","11/12/2018 12:07:34 PM","11/13/2018 11:30:18 AM","(21.3117446, -157.8617989)",2018-11-12 12:07:34,2018-11-13 11:30:18,"Trash",84164s (~23.38 hours),0.139160052910053
"28",607158,"Trash","Closed","Someone, probably HECO, HawTel, or Spectrum, cane through and trimmed the trees at the back of our property. However, instead of hauling away the rubbish they dumped it in our yard. It has now been placed on the sidewalk for them to retrieve and dispose","11/12/2018 08:25:34 AM","11/13/2018 12:00:45 PM","(21.3016097, -157.8023718)",2018-11-12 08:25:34,2018-11-13 12:00:45,"Trash",99311s (~1.15 days),0.164204695767196
"29",605648,"Flooding","Closed","Where we park is literally flooded every time we have a down pour. Storm drain are not working because no one ever took care of it.","11/07/2018 01:39:10 PM","11/08/2018 10:52:12 AM","(21.322891864, -157.909671033)",2018-11-07 13:39:10,2018-11-08 10:52:12,"Water",76382s (~21.22 hours),0.126292989417989
"30",605095,"Stormwater","Closed","construction runoff","11/06/2018 09:53:36 AM","11/09/2018 09:41:22 AM","(21.323860875, -157.881576538)",2018-11-06 09:53:36,2018-11-09 09:41:22,"Water",258466s (~2.99 days),0.427357804232804
"31",604628,"Tree","Closed","Trees resting on power lines. There have been many outages due to fallen trees. One resulted in insurance claims from most of the residents due to a power surge when power was restored","11/05/2018 10:22:20 AM","11/05/2018 03:58:34 PM","(21.256807617, -157.814729443)",2018-11-05 10:22:20,2018-11-05 15:58:34,"Tree",20174s (~5.6 hours),0.0333564814814815
"32",603754,"Tree","Closed","Liho Liho Elementary School. Grass has not been cut for over three weeks. Concerned Individuals: Public, Parents, Children, Principal, School Maintenance. City and County has been asked by school custodian and repeatedly told  Weere coming.","11/02/2018 10:57:08 AM","11/02/2018 04:24:55 PM","(21.278607658, -157.80638278)",2018-11-02 10:57:08,2018-11-02 16:24:55,"Tree",19667s (~5.46 hours),0.0325181878306878
"33",602482,"Broken / Vandalized signs","Closed","A fallen street sign is blocking my car port.","10/30/2018 11:31:01 AM","10/30/2018 11:51:03 AM","(21.280979699, -157.803223787)",2018-10-30 11:31:01,2018-10-30 11:51:03,"RoadSafety",1202s (~20.03 minutes),0.00198743386243386
"34",602423,"Stormwater","Closed","Drain has been clogged for weeks and with this heavy rain the pedestrian traffic is diverted into middle of the street. Lots of handicapped in the area.","10/30/2018 10:21:19 AM","10/30/2018 10:25:34 AM","(21.315208795, -157.865203527)",2018-10-30 10:21:19,2018-10-30 10:25:34,"Water",255s (~4.25 minutes),0.000421626984126984
"35",600772,"Trash","Closed","Abandoned flat bed plus piles and piles of various types of garbage. This has been growing for months.","10/25/2018 01:01:33 PM","10/25/2018 02:16:29 PM","(21.324921802, -157.865855685)",2018-10-25 13:01:33,2018-10-25 14:16:29,"Trash",4496s (~1.25 hours),0.00743386243386243
"36",600372,"Light","Closed","The light goes off and on all night","10/24/2018 06:05:16 PM","10/25/2018 08:03:56 AM","(21.33091, -157.695952)",2018-10-24 18:05:16,2018-10-25 08:03:56,"RoadSafety",50320s (~13.98 hours),0.0832010582010582
"37",599641,"Pothole","Closed","multiple cracks and potholes the entire length of kunia rd some of which are getting quite large","10/23/2018 08:16:38 AM","10/23/2018 08:32:00 AM","(21.4256439, -158.0538968)",2018-10-23 08:16:38,2018-10-23 08:32:00,"RoadSafety",922s (~15.37 minutes),0.0015244708994709
"38",598653,"Trash","Closed","Sun Oct 21, 2018. 2 adults and 14 students volunteering for 808 Cleanups cleaned up this area and bagged the garbage. Please have it picked up as soon as possible to help prevent people from tearing into the bags. Mahalo","10/21/2018 11:55:45 AM","10/22/2018 10:26:06 AM","(21.320678739, -157.861110522)",2018-10-21 11:55:45,2018-10-22 10:26:06,"Trash",81021s (~22.51 hours),0.133963293650794
"39",598443,"Trash","Closed","Decomposing moped has been at this site for at least a year. Clearly has been abandoned along with other bulky items.","10/20/2018 09:43:34 AM","10/22/2018 08:15:29 AM","(21.307053021, -157.845385062)",2018-10-20 09:43:34,2018-10-22 08:15:29,"Trash",167515s (~1.94 days),0.27697585978836
"40",598358,"Tree","Closed","Merging safely is very difficult because the median grass is so tall. You cannt see the cars that are also trying to merge onto Farrington.","10/19/2018 05:50:38 PM","10/22/2018 08:01:01 AM","(21.392523826, -157.991263512)",2018-10-19 17:50:38,2018-10-22 08:01:01,"Tree",223823s (~2.59 days),0.370077711640212
"41",598357,"Tree","Closed","Merging safely is very difficult because the median grass is so tall. You canat see the cars that are also trying to merge onto Farrington.","10/19/2018 05:50:20 PM","10/22/2018 08:00:51 AM","(21.392523826, -157.991263512)",2018-10-19 17:50:20,2018-10-22 08:00:51,"Tree",223831s (~2.59 days),0.370090939153439
"42",598356,"Tree","Closed","Merging safely is very difficult because the median grass is so tall. You canat see the cars that are also trying to merge onto Farrington.","10/19/2018 05:50:10 PM","10/22/2018 08:00:44 AM","(21.392523826, -157.991263512)",2018-10-19 17:50:10,2018-10-22 08:00:44,"Tree",223834s (~2.59 days),0.370095899470899
"43",598355,"Tree","Closed","Merging safely is very difficult because the median grass is so tall. You canat see the cars that are also trying to merge onto Farrington.","10/19/2018 05:49:51 PM","10/22/2018 08:00:35 AM","(21.392523826, -157.991263512)",2018-10-19 17:49:51,2018-10-22 08:00:35,"Tree",223844s (~2.59 days),0.370112433862434
"44",598354,"Tree","Closed","Merging safely is very difficult because the median grass is so that you cantt see the other vehicles trying to get onto Farrington.","10/19/2018 05:47:45 PM","10/22/2018 08:00:27 AM","(21.39256164, -157.991215828)",2018-10-19 17:47:45,2018-10-22 08:00:27,"Tree",223962s (~2.59 days),0.37030753968254
"45",598353,"Tree","Closed","Merging safely is very difficult because the median grass is so that you cantt see the other vehicles trying to get onto Farrington.","10/19/2018 05:47:35 PM","10/22/2018 08:00:09 AM","(21.39256164, -157.991215828)",2018-10-19 17:47:35,2018-10-22 08:00:09,"Tree",223954s (~2.59 days),0.370294312169312
"46",598202,"Trash","Closed","Dumped grocery cart left at the pedestrian island near the crosswalk. No need to call me to follow up","10/19/2018 09:23:47 AM","10/19/2018 09:45:04 AM","(21.301917734, -157.863257012)",2018-10-19 09:23:47,2018-10-19 09:45:04,"Trash",1277s (~21.28 minutes),0.0021114417989418
"47",598195,"Pothole","Closed","Potholes all along this stretch of Hwy 72 and the grass along the edge of the street is out of control causing a major safety issue. The sidewalk/bike lane is overgrown causing a safety issue because pedestrians are now walking along the hwy and not on t","10/19/2018 09:06:34 AM","10/19/2018 09:17:20 AM","(21.3422417, -157.7064051)",2018-10-19 09:06:34,2018-10-19 09:17:20,"RoadSafety",646s (~10.77 minutes),0.00106812169312169
"48",596579,"Tree","Closed","tree hanging low at the end of pa street ( short side )","10/15/2018 11:30:44 AM","10/15/2018 11:39:56 AM","(21.368294408, -158.023913705)",2018-10-15 11:30:44,2018-10-15 11:39:56,"Tree",552s (~9.2 minutes),0.000912698412698413
"49",596081,"Pothole","Closed","On Kunia Road in South bound lane about 200 feet before Traffic light entrance to NSA Kunia Regional Security Operations Center.  Hazardous 50 llong section of several Deep and Wide Ruts in roadway (both in lane and shoulder).  The ruts run in same direc","10/14/2018 09:23:25 PM","10/15/2018 10:36:41 AM","(21.476910828, -158.050433851)",2018-10-14 21:23:25,2018-10-15 10:36:41,"RoadSafety",47596s (~13.22 hours),0.0786970899470899
"50",595949,"Broken / Vandalized signs","Closed","dangling street crossing button","10/14/2018 08:20:22 AM","10/15/2018 08:08:30 AM","(21.290695217, -157.837434181)",2018-10-14 08:20:22,2018-10-15 08:08:30,"RoadSafety",85688s (~23.8 hours),0.141679894179894
"51",595944,"Broken / Vandalized signs","Closed","dangling crossing button","10/14/2018 08:07:15 AM","10/15/2018 08:08:24 AM","(21.290715141, -157.837339022)",2018-10-14 08:07:15,2018-10-15 08:08:24,"RoadSafety",86469s (~1 days),0.14297123015873
"52",595943,"Broken / Vandalized signs","Closed","dangling crossing button","10/14/2018 08:04:54 AM","10/15/2018 08:09:58 AM","(21.290715141, -157.837339022)",2018-10-14 08:04:54,2018-10-15 08:09:58,"RoadSafety",86704s (~1 days),0.143359788359788
"53",595820,"Tree","Closed","There are two large branches broken and hanging from a tree located in Puaina St. turnaround located by 91-1236 Puaina St.","10/13/2018 10:36:26 AM","10/15/2018 09:34:07 AM","(21.343382991, -158.026137388)",2018-10-13 10:36:26,2018-10-15 09:34:07,"Tree",169061s (~1.96 days),0.279532076719577
"54",595716,"Light","Closed","Light flashes rapidly","10/12/2018 07:13:27 PM","10/15/2018 08:12:41 AM","(21.379901998, -158.028785488)",2018-10-12 19:13:27,2018-10-15 08:12:41,"RoadSafety",219554s (~2.54 days),0.36301917989418
"55",595210,"Pothole","Closed","On Waipahu depot on the TOYOTA Waipahu Close to the intersection","10/11/2018 12:06:37 PM","10/11/2018 12:15:49 PM","(21.3833892, -158.006278733)",2018-10-11 12:06:37,2018-10-11 12:15:49,"RoadSafety",552s (~9.2 minutes),0.000912698412698413
"56",594221,"Trash","Closed","Ewa, mauka corner of Varsity Pl. and Kalo Pl.  Intersection being used as moped dumping ground. People strip mopeds and leave parts, dump fluids, etc in area.","10/09/2018 05:39:25 PM","10/10/2018 08:02:44 AM","(21.292271067, -157.8196101)",2018-10-09 17:39:25,2018-10-10 08:02:44,"Trash",51799s (~14.39 hours),0.0856464947089947
"57",593624,"Light","Closed","Almost all of the lights in and around the Kakaako Beach Park are not turned on. Honolulu Marathongs Lanikai Juice Run Club meets at this beach park every Thursday and it has become increasingly more dangerous for participating runners and coaches becaus","10/08/2018 01:21:25 PM","10/08/2018 01:47:32 PM","(21.2937729, -157.8642225)",2018-10-08 13:21:25,2018-10-08 13:47:32,"RoadSafety",1567s (~26.12 minutes),0.00259093915343915
"58",587985,"Tree","Closed","Why is the side of the road and the median not mowed on a regular basis. It look like third world country","09/25/2018 01:41:06 PM","09/26/2018 12:53:19 PM","(21.3640728, -157.7369476)",2018-09-25 13:41:06,2018-09-26 12:53:19,"Tree",83533s (~23.2 hours),0.138116732804233
"59",593581,"Tree","Closed","The grass along the highway is at least 3 feet high along the sidewalk / bike lane on the makai side of the street.  The mauka side looks as though it has been mowed recently, maybe by the owners of the polo fields? The high grass/weeds is becoming a saf","10/08/2018 12:08:07 PM","10/08/2018 12:58:41 PM","(21.3422417, -157.7064051)",2018-10-08 12:08:07,2018-10-08 12:58:41,"Tree",3034s (~50.57 minutes),0.00501653439153439
"60",593023,"Trash","Closed","On the drive up Tantalus someone dumped a mattress.  It now is covered with spray paint.","10/07/2018 02:25:52 PM","10/08/2018 08:19:44 AM","(21.327763708, -157.8261217)",2018-10-07 14:25:52,2018-10-08 08:19:44,"Trash",64432s (~17.9 hours),0.106534391534392
"61",592275,"Homeless","Closed","Abandoned van taking up street parking","10/04/2018 07:23:41 PM","10/05/2018 08:29:08 AM","(21.296900468, -157.859325881)",2018-10-04 19:23:41,2018-10-05 08:29:08,"Homeless",47127s (~13.09 hours),0.077921626984127
"62",591050,"Broken / Vandalized signs","Closed","Kailua bound sign before entrance to Uluhala st is bent to 30 degrees from ground. The map dot is a little off because I didnot know how to move it.","10/02/2018 12:17:10 PM","10/02/2018 12:50:03 PM","(21.379965061, -157.757114801)",2018-10-02 12:17:10,2018-10-02 12:50:03,"RoadSafety",1973s (~32.88 minutes),0.00326223544973545
"63",590487,"Broken / Vandalized signs","Closed","3 minute passenger pickup end sign fell down.","10/01/2018 10:27:43 PM","10/02/2018 07:38:36 AM","(21.303767721, -157.84893855)",2018-10-01 22:27:43,2018-10-02 07:38:36,"RoadSafety",33053s (~9.18 hours),0.0546511243386243
"64",589879,"Trash","Closed","Trash is littered all around the bus stop on Prospect Street","09/30/2018 06:24:54 PM","10/01/2018 09:05:20 AM","(21.309318628, -157.844722471)",2018-09-30 18:24:54,2018-10-01 09:05:20,"Trash",52826s (~14.67 hours),0.0873445767195767
"65",589762,"Light","Closed","Light  stays on","09/30/2018 09:41:53 AM","10/01/2018 09:20:25 AM","(21.296706019, -157.860976348)",2018-09-30 09:41:53,2018-10-01 09:20:25,"RoadSafety",85112s (~23.64 hours),0.140727513227513
"66",588596,"Broken / Vandalized signs","Closed","Driving on Kam hwy ewa bound, right before the stadium, the overhead sign is damaged and missing. Needs to be replaced.","09/26/2018 10:29:29 PM","09/27/2018 09:09:55 AM","(21.371967599, -157.933627278)",2018-09-26 22:29:29,2018-09-27 09:09:55,"RoadSafety",38426s (~10.67 hours),0.0635350529100529
"67",586519,"Trash","Closed","Dumping of mattresses, treadmills, trash, appliances throughout the month","09/22/2018 03:28:52 PM","09/24/2018 08:19:39 AM","(21.391795118, -158.155945864)",2018-09-22 15:28:52,2018-09-24 08:19:39,"Trash",147047s (~1.7 days),0.243133267195767
"68",584623,"Homeless","Closed","Boat parked for YEARS on pololia st this is crazy","09/18/2018 01:59:23 PM","09/18/2018 02:42:20 PM","(21.367375913, -158.020765315)",2018-09-18 13:59:23,2018-09-18 14:42:20,"Homeless",2577s (~42.95 minutes),0.0042609126984127
"69",582250,"Tree","Closed","tree damage during Olivia. obstruction on the sidewalk.","09/13/2018 04:48:28 PM","09/14/2018 09:23:54 AM","(21.289660549, -157.830405733)",2018-09-13 16:48:28,2018-09-14 09:23:54,"Tree",59726s (~16.59 hours),0.0987533068783069
"70",582220,"Tree","Closed","Tree growing into power lines","09/13/2018 02:39:56 PM","09/13/2018 02:46:16 PM","(21.276467, -157.789321)",2018-09-13 14:39:56,2018-09-13 14:46:16,"Tree",380s (~6.33 minutes),0.000628306878306878
"71",581321,"Homeless","Closed","Red Jeep is parked in the public unimproved sidewalk permanently .  The front bumper is such that it may cause serious injury to a cyclist or pedestrian that comes in contact with it.  If a cyclist is looking over their shoulder for traffic behind and ve","09/12/2018 08:27:17 AM","09/12/2018 08:32:41 AM","(21.397913571, -157.729638114)",2018-09-12 08:27:17,2018-09-12 08:32:41,"Homeless",324s (~5.4 minutes),0.000535714285714286
"72",565629,"Light","Closed","Lights been broken for 3 years now","08/10/2018 01:03:13 PM","08/10/2018 02:11:36 PM","(21.3956635, -157.9973784)",2018-08-10 13:03:13,2018-08-10 14:11:36,"RoadSafety",4103s (~1.14 hours),0.00678406084656085
"73",573156,"Trash","Closed","Multiple couches and various large pieces of furniture have been left on the Diamond Head side of the street. Two trucks may be needed to move all of the furniture","08/25/2018 01:15:34 PM","08/27/2018 11:46:35 AM","(21.283858505, -157.778279087)",2018-08-25 13:15:34,2018-08-27 11:46:35,"Trash",167461s (~1.94 days),0.276886574074074
"74",572941,"Tree","Closed","tree branch broken but hanging by bark could fall on pedestrian or passing car","08/24/2018 02:00:28 PM","08/27/2018 11:59:47 AM","(21.442195018, -158.017757778)",2018-08-24 14:00:28,2018-08-27 11:59:47,"Tree",251959s (~2.92 days),0.416598875661376
"75",572783,"Tree","Closed","tree down in electric area","08/24/2018 08:33:22 AM","08/27/2018 11:53:51 AM","(21.2803803, -157.7810373)",2018-08-24 08:33:22,2018-08-27 11:53:51,"Tree",271229s (~3.14 days),0.448460648148148
"76",570977,"Trash","Closed","lots of trash and bulky items, looks like an abandoned homeless camp","08/21/2018 11:36:22 AM","08/21/2018 03:41:22 PM","(21.348262575, -157.722857044)",2018-08-21 11:36:22,2018-08-21 15:41:22,"Trash",14700s (~4.08 hours),0.0243055555555556
"77",567965,"Trash","Closed","Thereds a huge amount of trash on the Diamond Head shoulder of WB H1 extending from the Joint base on ramp to almost the Aiea exit.  Itts been growing in volume.  Looks horrible.","08/15/2018 11:08:31 AM","08/15/2018 11:31:17 AM","(21.350041703, -157.932693958)",2018-08-15 11:08:31,2018-08-15 11:31:17,"Trash",1366s (~22.77 minutes),0.00225859788359788
"78",570215,"Homeless","Closed","This pile continues to grow and is in violation of stored property pickup schedule.","08/20/2018 11:08:57 AM","08/20/2018 11:19:29 AM","(21.289408644, -157.831080709)",2018-08-20 11:08:57,2018-08-20 11:19:29,"Homeless",632s (~10.53 minutes),0.00104497354497355
"79",570143,"Broken / Vandalized signs","Closed","Faded /damaged traffic signal sign on wyllie/Nuuanu street off ramp TOWNBOUND Pali hwy.","08/20/2018 09:49:11 AM","08/20/2018 10:31:48 AM","(21.328265748, -157.845752222)",2018-08-20 09:49:11,2018-08-20 10:31:48,"RoadSafety",2557s (~42.62 minutes),0.00422784391534392
"80",569506,"Light","Closed","off for months","08/19/2018 05:40:40 AM","08/20/2018 10:05:52 AM","(21.301401843, -157.863158878)",2018-08-19 05:40:40,2018-08-20 10:05:52,"RoadSafety",102312s (~1.18 days),0.169166666666667
"81",567964,"Trash","Closed","Thereds a huge amount of trash on the Diamond Head shoulder of WB H1 extending from the Joint base on ramp to almost the Aiea exit.  Ites been growing in volume.  Looks horrible.","08/15/2018 11:08:27 AM","08/15/2018 11:36:16 AM","(21.350041703, -157.932693958)",2018-08-15 11:08:27,2018-08-15 11:36:16,"Trash",1669s (~27.82 minutes),0.00275958994708995
"82",567963,"Trash","Closed","Thereds a huge amount of trash on the Diamond Head shoulder of WB H1 extending from the Joint base on ramp to almost the Aiea exit.  Ites been growing in volume.  Looks horrible.","08/15/2018 11:08:26 AM","08/15/2018 11:33:09 AM","(21.350041703, -157.932693958)",2018-08-15 11:08:26,2018-08-15 11:33:09,"Trash",1483s (~24.72 minutes),0.00245205026455026
"83",565440,"Homeless","Closed","Plant pot and rock stored outside of property line -  tripping hazard for children walking and biking to school","08/10/2018 07:49:27 AM","08/10/2018 08:02:31 AM","(21.393706213, -157.723813028)",2018-08-10 07:49:27,2018-08-10 08:02:31,"Homeless",784s (~13.07 minutes),0.0012962962962963
"84",565437,"Homeless","Closed","Boat/ boat trailer are stored partially on private property and partially beyond the property line-  not stored wholly on private property.","08/10/2018 07:47:55 AM","08/10/2018 08:02:21 AM","(21.394023711, -157.723569611)",2018-08-10 07:47:55,2018-08-10 08:02:21,"Homeless",866s (~14.43 minutes),0.00143187830687831
"85",563817,"Tree","Closed","broken tree branch","08/07/2018 10:53:58 AM","08/07/2018 11:04:50 AM","(21.3560743, -158.0263955)",2018-08-07 10:53:58,2018-08-07 11:04:50,"Tree",652s (~10.87 minutes),0.00107804232804233
"86",563030,"Taxi","Closed","they park on the causing a potential danger to pedestrians, other vehicles driving on the Avenue. The owner of 739 Gulick should be held accountable for his tenants. All taxi drivers that are tenants that rent from them park their taxis all over this Ave","08/06/2018 08:10:49 AM","08/06/2018 08:31:38 AM","(21.3319028, -157.8812318)",2018-08-06 08:10:49,2018-08-06 08:31:38,"Vehicle",1249s (~20.82 minutes),0.0020651455026455
"87",562562,"Trash","Closed","Two brown sofa sectionals and a futon","08/05/2018 10:47:28 AM","08/06/2018 08:23:26 AM","(21.284112222, -157.839319434)",2018-08-05 10:47:28,2018-08-06 08:23:26,"Trash",77758s (~21.6 hours),0.128568121693122
"88",558844,"Trash","Closed","Queen size mattress on the Ewa side of the street on the sidewalk","07/28/2018 03:14:23 PM","07/30/2018 08:56:59 AM","(21.304562095, -157.841308515)",2018-07-28 15:14:23,2018-07-30 08:56:59,"Trash",150156s (~1.74 days),0.24827380952381
"89",558166,"Trash","Closed","Large glass mirror broken on the side walk -dangerous","07/26/2018 08:34:34 PM","07/27/2018 08:12:17 AM","(21.308617326, -157.848945475)",2018-07-26 20:34:34,2018-07-27 08:12:17,"Trash",41863s (~11.63 hours),0.0692179232804233
"90",558164,"Trash","Closed","Desk and bed frame pieces dumped on the makai side of the road","07/26/2018 08:33:09 PM","07/27/2018 08:12:05 AM","(21.308918697, -157.849242295)",2018-07-26 20:33:09,2018-07-27 08:12:05,"Trash",41936s (~11.65 hours),0.0693386243386243
"91",558163,"Trash","Closed","Blankets, wood planks, rubbish on the side walk on the mauka side of the street","07/26/2018 08:30:56 PM","07/27/2018 08:11:55 AM","(21.308403683, -157.847634181)",2018-07-26 20:30:56,2018-07-27 08:11:55,"Trash",42059s (~11.68 hours),0.0695419973544974
"92",557563,"Trash","Closed","Multiple large appliances dumped on the corner by the telephone pole. It looks like there is a lot of safety glass shattered on the side walk. I think I reported this previously but it has not been picked up","07/25/2018 10:17:05 PM","07/26/2018 08:39:38 AM","(21.307372897, -157.847860403)",2018-07-25 22:17:05,2018-07-26 08:39:38,"Trash",37353s (~10.38 hours),0.0617609126984127
"93",557538,"Trash","Closed","Same guy been dumping his abandon vehicles along the front of the public housing. Thereis no clear walk way for people to walk to the bus stop.  Theywre walking on the middle of the road. Putting themselves in danger of drivers passing through in the nig","07/25/2018 05:44:19 PM","07/26/2018 07:49:32 AM","(21.448245875, -157.834059693)",2018-07-25 17:44:19,2018-07-26 07:49:32,"Trash",50713s (~14.09 hours),0.0838508597883598
"94",556703,"Tree","Closed","Palm trees growing into electric wires and also some blocking street light","07/24/2018 08:58:11 AM","07/24/2018 09:50:54 AM","(21.3057906, -157.8182181)",2018-07-24 08:58:11,2018-07-24 09:50:54,"Tree",3163s (~52.72 minutes),0.00522982804232804
"95",552711,"Tree","Closed","To whom this may concern, I've made a complaint before about the tree in front of our residence. I did get a call back from one of your employees and said tree was fine. I'm okay with that. What I'm not okay with is the bird droppings from the tree. It i","07/16/2018 06:18:21 PM","07/17/2018 08:23:50 AM","(21.363480877, -158.078057176)",2018-07-16 18:18:21,2018-07-17 08:23:50,"Tree",50729s (~14.09 hours),0.0838773148148148
"96",551900,"Pothole","Closed","pot hole","07/15/2018 02:32:16 PM","07/16/2018 09:50:13 AM","(21.398088061, -157.983299229)",2018-07-15 14:32:16,2018-07-16 09:50:13,"RoadSafety",69477s (~19.3 hours),0.114875992063492
"97",551614,"Trash","Closed","Matress","07/14/2018 12:46:23 PM","07/16/2018 08:49:42 AM","(21.291673166, -157.83064397)",2018-07-14 12:46:23,2018-07-16 08:49:42,"Trash",158599s (~1.84 days),0.262233796296296
"98",551612,"Trash","Closed","Mattress","07/14/2018 12:37:21 PM","07/16/2018 08:49:11 AM","(21.292360402, -157.830330713)",2018-07-14 12:37:21,2018-07-16 08:49:11,"Trash",159110s (~1.84 days),0.263078703703704
"99",551611,"Trash","Closed","Wood, toilet, refrigerator","07/14/2018 12:35:47 PM","07/16/2018 08:48:25 AM","(21.291833512, -157.830037353)",2018-07-14 12:35:47,2018-07-16 08:48:25,"Trash",159158s (~1.84 days),0.263158068783069
"100",551329,"Homeless","Closed","Blue tent. Outside of lowes. Blocking sidewalk","07/13/2018 05:23:46 PM","07/16/2018 08:56:40 AM","(21.314831348, -157.873972035)",2018-07-13 17:23:46,2018-07-16 08:56:40,"Homeless",228774s (~2.65 days),0.378263888888889
"101",550142,"Tree","Closed","Grass around the Waimanalo signage is getting high.  Is this city responsiblity by any chance? also the signage itself is started to rot, how does it get replaced?  Some community members and I would like to help, just looking for the proper resource per","07/11/2018 10:31:22 PM","07/12/2018 08:46:09 AM","(21.357697842, -157.732793872)",2018-07-11 22:31:22,2018-07-12 08:46:09,"Tree",36887s (~10.25 hours),0.0609904100529101
"102",549443,"Light","Closed","there are a few poles around this bend near the stream where lights are not working","07/10/2018 09:53:53 PM","07/11/2018 08:25:53 AM","(21.346091044, -157.711297824)",2018-07-10 21:53:53,2018-07-11 08:25:53,"RoadSafety",37920s (~10.53 hours),0.0626984126984127
"103",549439,"Trash","Closed","Mattress","07/10/2018 08:49:30 PM","07/11/2018 08:11:27 AM","(21.30944474, -157.844410181)",2018-07-10 20:49:30,2018-07-11 08:11:27,"Trash",40917s (~11.37 hours),0.0676537698412698
"104",544068,"Homeless","Closed","Vehicle towed and left. Owner claims being donated. Vehicle leaks fluid and has left multiple spots.","06/30/2018 12:54:22 PM","07/02/2018 07:55:32 AM","(21.3608036, -158.0910785)",2018-06-30 12:54:22,2018-07-02 07:55:32,"Homeless",154870s (~1.79 days),0.256068121693122
"105",547867,"Light","Closed","Light to turn left or right on Kamehameha doesn't seem to turn green v waited while the surrounding lights all cycled properly multiple times. Since a media attachment is required to submit, be advised that the attached picture is from Pearlridge side (w","07/08/2018 09:21:57 PM","07/09/2018 11:39:43 AM","(21.382663, -157.944740937)",2018-07-08 21:21:57,2018-07-09 11:39:43,"RoadSafety",51466s (~14.3 hours),0.0850958994708995
"106",547552,"Broken / Vandalized signs","Closed","Downed sign","07/07/2018 04:41:48 PM","07/09/2018 02:57:12 PM","(21.329878434, -157.869308324)",2018-07-07 16:41:48,2018-07-09 14:57:12,"RoadSafety",166524s (~1.93 days),0.275337301587302
"107",547534,"Trash","Closed","Brown couch and other furniture on side walk","07/07/2018 03:28:48 PM","07/09/2018 08:32:25 AM","(21.3088279, -157.8490466)",2018-07-07 15:28:48,2018-07-09 08:32:25,"Trash",147817s (~1.71 days),0.244406415343915
"108",547478,"Homeless","Closed","Black BMW with flat tire and broken tail lights parked on side of this street for at least 3 weeks.","07/07/2018 12:03:03 PM","07/09/2018 08:49:19 AM","(21.300299658, -157.859699552)",2018-07-07 12:03:03,2018-07-09 08:49:19,"Homeless",161176s (~1.87 days),0.266494708994709
"109",547471,"Trash","Closed","Across from the parking lot for the Honolulu Academy of Arts, there is furniture dumped by a parking sign","07/07/2018 11:39:16 AM","07/09/2018 08:32:45 AM","(21.303851081, -157.846570041)",2018-07-07 11:39:16,2018-07-09 08:32:45,"Trash",161609s (~1.87 days),0.267210648148148
"110",547466,"Trash","Closed","Single mattress on my the corner","07/07/2018 11:18:26 AM","07/09/2018 08:32:34 AM","(21.304301715, -157.847739355)",2018-07-07 11:18:26,2018-07-09 08:32:34,"Trash",162848s (~1.88 days),0.269259259259259
"111",547464,"Trash","Closed","Bulk pickup missed","07/07/2018 11:08:09 AM","07/09/2018 08:52:23 AM","(21.355815976, -158.09217348)",2018-07-07 11:08:09,2018-07-09 08:52:23,"Trash",164654s (~1.91 days),0.27224537037037
"112",547461,"Trash","Closed","I drove past Thurston Street and saw two locations with dumped mattresses. Sorry I donbt have the exact locations. One was on the mauka side of the street against a condo building. The other was on the makai side of the street against a fence","07/07/2018 10:56:10 AM","07/09/2018 08:33:15 AM","(21.307441557, -157.842586798)",2018-07-07 10:56:10,2018-07-09 08:33:15,"Trash",164225s (~1.9 days),0.271536044973545
"113",547455,"Trash","Closed","Couch, mattress, boxes","07/07/2018 10:35:21 AM","07/09/2018 08:34:11 AM","(21.307744425, -157.844133467)",2018-07-07 10:35:21,2018-07-09 08:34:11,"Trash",165530s (~1.92 days),0.273693783068783
"114",547448,"Trash","Closed","Couch and other furniture , it right next to a parking sign","07/07/2018 09:50:51 AM","07/09/2018 08:57:53 AM","(21.304378403, -157.836684985)",2018-07-07 09:50:51,2018-07-09 08:57:53,"Trash",169622s (~1.96 days),0.280459656084656
"115",547443,"Trash","Closed","On the makai side of the road , behind the parked cars, there are boxes, concrete blocks that were dumped. It looks like someone dumped construction materials . Also there is a really large cardboard box behind one of the parked cars on the mauka side of","07/07/2018 09:26:53 AM","07/09/2018 08:33:05 AM","(21.307964402, -157.843452477)",2018-07-07 09:26:53,2018-07-09 08:33:05,"Trash",169572s (~1.96 days),0.280376984126984
"116",547441,"Trash","Closed","Furniture, bedding , mattresses dumped right by a sign where it implies no dumping. This is on the makai side of the road","07/07/2018 09:23:13 AM","07/09/2018 08:32:54 AM","(21.307051388, -157.847161586)",2018-07-07 09:23:13,2018-07-09 08:32:54,"Trash",169781s (~1.97 days),0.280722552910053
"117",547432,"Light","Closed","Light is always on","07/07/2018 08:49:26 AM","07/09/2018 08:39:33 AM","(21.473896279, -158.010301023)",2018-07-07 08:49:26,2018-07-09 08:39:33,"RoadSafety",172207s (~1.99 days),0.284733796296296
"118",547424,"Trash","Closed","Rusted water heater in cardboard box","07/07/2018 08:07:24 AM","07/09/2018 08:33:59 AM","(21.307310813, -157.846116895)",2018-07-07 08:07:24,2018-07-09 08:33:59,"Trash",174395s (~2.02 days),0.288351521164021
"119",546740,"Trash","Closed","Bulky item pick up just leaves it there. This is the third time","07/05/2018 08:37:11 PM","07/06/2018 08:59:01 AM","(21.288422477, -157.818188189)",2018-07-05 20:37:11,2018-07-06 08:59:01,"Trash",44510s (~12.36 hours),0.0735945767195767
"120",546734,"Homeless","Closed","South bound side of the bridge, the homeless are starting to take over the sidewalk again with tents, belongings. They also tie up their fishing poles on the railings so the handle part of the pole is sticking about a foot into the sidewalk pathway while","07/05/2018 07:11:33 PM","07/06/2018 08:23:00 AM","(21.314207213, -157.887987126)",2018-07-05 19:11:33,2018-07-06 08:23:00,"Homeless",47487s (~13.19 hours),0.0785168650793651
"121",545921,"Trash","Closed","Mountain of trash dumped on the sidewalk behind the gray 1Aloha Contract Servicesb truck.","07/04/2018 10:06:43 AM","07/05/2018 08:03:07 AM","(21.321210419, -157.885317162)",2018-07-04 10:06:43,2018-07-05 08:03:07,"Trash",78984s (~21.94 hours),0.130595238095238
"122",545920,"Trash","Closed","Dumped furniture and trash","07/04/2018 09:43:15 AM","07/05/2018 08:02:57 AM","(21.321384614, -157.886299788)",2018-07-04 09:43:15,2018-07-05 08:02:57,"Trash",80382s (~22.33 hours),0.132906746031746
"123",545901,"Trash","Closed","Metal pieces","07/04/2018 08:56:35 AM","07/05/2018 08:02:49 AM","(21.321726613, -157.887847602)",2018-07-04 08:56:35,2018-07-05 08:02:49,"Trash",83174s (~23.1 hours),0.137523148148148
"124",545899,"Trash","Closed","Dumped trash bag","07/04/2018 08:49:22 AM","07/05/2018 08:02:41 AM","(21.321822278, -157.88826922)",2018-07-04 08:49:22,2018-07-05 08:02:41,"Trash",83599s (~23.22 hours),0.13822585978836
"125",545897,"Trash","Closed","Busted toilet","07/04/2018 08:44:57 AM","07/05/2018 08:02:32 AM","(21.321934161, -157.888511727)",2018-07-04 08:44:57,2018-07-05 08:02:32,"Trash",83855s (~23.29 hours),0.13864914021164
"126",545896,"Trash","Closed","Busted toilet","07/04/2018 08:44:05 AM","07/05/2018 08:02:20 AM","(21.321934161, -157.888511727)",2018-07-04 08:44:05,2018-07-05 08:02:20,"Trash",83895s (~23.3 hours),0.138715277777778
"127",545895,"Trash","Closed","Scrap car parts","07/04/2018 08:41:50 AM","07/05/2018 08:02:11 AM","(21.32195087, -157.888650834)",2018-07-04 08:41:50,2018-07-05 08:02:11,"Trash",84021s (~23.34 hours),0.138923611111111
"128",545891,"Trash","Closed","Scrap car parts and other trash","07/04/2018 08:34:32 AM","07/05/2018 08:02:02 AM","(21.322057579, -157.889156303)",2018-07-04 08:34:32,2018-07-05 08:02:02,"Trash",84450s (~23.46 hours),0.139632936507937
"129",545645,"Flooding","Closed","This is a re-request order about flooding on corner property of Mokuahi st and awanei st  ..I believe maybe a broken pipe underground due to continuously flowing..see pictures pls","07/03/2018 12:03:03 PM","07/03/2018 12:26:19 PM","(21.382908855, -158.001353538)",2018-07-03 12:03:03,2018-07-03 12:26:19,"Water",1396s (~23.27 minutes),0.00230820105820106
"130",544070,"Homeless","Closed","Vehicle abandoned for over a month.","06/30/2018 12:57:47 PM","07/02/2018 07:55:48 AM","(21.360454781, -158.0912361)",2018-06-30 12:57:47,2018-07-02 07:55:48,"Homeless",154681s (~1.79 days),0.255755621693122
"131",544069,"Homeless","Closed","Vehicle abandoned for over a month.","06/30/2018 12:56:15 PM","07/02/2018 07:55:40 AM","(21.360471832, -158.091239967)",2018-06-30 12:56:15,2018-07-02 07:55:40,"Homeless",154765s (~1.79 days),0.255894510582011
"132",543209,"Trash","Closed","illegally dumped items on both sides of street at the top of Mahailua","06/28/2018 10:43:32 AM","06/28/2018 10:54:30 AM","(21.332069479, -157.736348695)",2018-06-28 10:43:32,2018-06-28 10:54:30,"Trash",658s (~10.97 minutes),0.00108796296296296
"133",540937,"Trash","Closed","White chevy s10 truck","06/24/2018 06:37:44 PM","06/25/2018 09:04:16 AM","(21.392680809, -158.00705697)",2018-06-24 18:37:44,2018-06-25 09:04:16,"Trash",51992s (~14.44 hours),0.0859656084656085
"134",540845,"Broken / Vandalized signs","Closed","letters on street sign is coming off","06/24/2018 01:08:00 PM","06/25/2018 09:00:30 AM","(21.284625954, -157.83734636)",2018-06-24 13:08:00,2018-06-25 09:00:30,"RoadSafety",71550s (~19.88 hours),0.118303571428571
"135",538804,"Light","Closed","several light poles are out along the right side of the road as you yield from Kalanianaole onto Kamehameha","06/19/2018 09:39:42 PM","06/20/2018 07:54:26 AM","(21.375406443, -157.780779345)",2018-06-19 21:39:42,2018-06-20 07:54:26,"RoadSafety",36884s (~10.25 hours),0.0609854497354497
"136",538803,"Light","Closed","several light poles are out along the right side of the road as you yield from Kalanianaole onto Kamehameha","06/19/2018 09:39:32 PM","06/20/2018 07:54:19 AM","(21.375406443, -157.780779345)",2018-06-19 21:39:32,2018-06-20 07:54:19,"RoadSafety",36887s (~10.25 hours),0.0609904100529101
"137",538802,"Light","Closed","several light poles are out along the right side of the road as you yield from Kalanianaole onto Kamehameha","06/19/2018 09:39:15 PM","06/20/2018 07:54:00 AM","(21.375406443, -157.780779345)",2018-06-19 21:39:15,2018-06-20 07:54:00,"RoadSafety",36885s (~10.25 hours),0.0609871031746032
"138",538785,"Light","Closed","Light is very dim","06/19/2018 06:10:54 PM","06/20/2018 08:00:01 AM","(21.289958803, -157.800532074)",2018-06-19 18:10:54,2018-06-20 08:00:01,"RoadSafety",49747s (~13.82 hours),0.0822536375661376
"139",536991,"Pothole","Closed","Overpass from School street to Liliha Street","06/15/2018 12:25:52 PM","06/15/2018 12:35:59 PM","(21.32219216, -157.860652993)",2018-06-15 12:25:52,2018-06-15 12:35:59,"RoadSafety",607s (~10.12 minutes),0.00100363756613757
"140",536452,"Trash","Closed","Broken appliances left in front.  Witnessed tenant in back building dumping.   Name is John I believe.  Asian man balding wears baseball cap","06/14/2018 10:53:20 AM","06/14/2018 11:25:26 AM","(21.2814485, -157.8154032)",2018-06-14 10:53:20,2018-06-14 11:25:26,"Trash",1926s (~32.1 minutes),0.00318452380952381
"141",535876,"Light","Closed","test","06/13/2018 10:06:08 AM","06/13/2018 10:19:53 AM","(21.3045367, -157.8564895)",2018-06-13 10:06:08,2018-06-13 10:19:53,"RoadSafety",825s (~13.75 minutes),0.0013640873015873
"142",535455,"Trash","Closed","Both sides of the street littered with trash and tent cities.  Unable to walk using sidewalks","06/12/2018 05:26:43 PM","06/13/2018 10:30:40 AM","(21.3016311, -157.8576977)",2018-06-12 17:26:43,2018-06-13 10:30:40,"Trash",61437s (~17.07 hours),0.101582341269841
"143",535453,"Trash","Closed","Both sides of the street littered with trash and tent cities.  Unable to walk using sidewalks","06/12/2018 05:25:14 PM","06/13/2018 10:30:33 AM","(21.3016311, -157.8576977)",2018-06-12 17:25:14,2018-06-13 10:30:33,"Trash",61519s (~17.09 hours),0.101717923280423
"144",535392,"Tree","Closed","Overgrown weeds and grass along whole street. Fire hazard.","06/12/2018 02:21:24 PM","06/12/2018 02:33:06 PM","(21.306072882, -157.850446666)",2018-06-12 14:21:24,2018-06-12 14:33:06,"Tree",702s (~11.7 minutes),0.00116071428571429
"145",535390,"Tree","Closed","Overgrown weeds and grass along whole street. Fire hazard.","06/12/2018 02:13:09 PM","06/12/2018 02:32:40 PM","(21.306041976, -157.850387573)",2018-06-12 14:13:09,2018-06-12 14:32:40,"Tree",1171s (~19.52 minutes),0.00193617724867725
"146",535387,"Tree","Closed","Street parking along the whole Kinalau Street, overgrown weeds and grass was poisoned but now itgs dead and a fire hazard.","06/12/2018 02:11:55 PM","06/12/2018 02:30:54 PM","(21.306041976, -157.850387573)",2018-06-12 14:11:55,2018-06-12 14:30:54,"Tree",1139s (~18.98 minutes),0.0018832671957672
"147",535386,"Tree","Closed","Street parking along the whole Kinalau Street, overgrown weeds and grass was poisoned but now itds dead and a fire hazard.","06/12/2018 02:11:47 PM","06/12/2018 02:30:21 PM","(21.306041976, -157.850387573)",2018-06-12 14:11:47,2018-06-12 14:30:21,"Tree",1114s (~18.57 minutes),0.00184193121693122
"148",535385,"Tree","Closed","Street parking along the whole Kinalau Street, overgrown weeds and grass was poisoned but now itds dead and a fire hazard.","06/12/2018 02:11:22 PM","06/12/2018 02:29:59 PM","(21.306106561, -157.850381541)",2018-06-12 14:11:22,2018-06-12 14:29:59,"Tree",1117s (~18.62 minutes),0.00184689153439153
"149",535384,"Tree","Closed","Street parking along the whole Kinalau Street, overgrown weeds and grass was poisoned but now itds dead and a fire hazard.","06/12/2018 02:11:06 PM","06/12/2018 02:29:37 PM","(21.306106561, -157.850381541)",2018-06-12 14:11:06,2018-06-12 14:29:37,"Tree",1111s (~18.52 minutes),0.0018369708994709
"150",533906,"Light","Closed","Broken Street Light","06/10/2018 02:37:29 AM","06/12/2018 08:05:54 AM","(21.674332434, -157.956926364)",2018-06-10 02:37:29,2018-06-12 08:05:54,"RoadSafety",192505s (~2.23 days),0.318295304232804
"151",533905,"Light","Closed","Light does not turn on, need bulb replacement.","06/10/2018 02:33:37 AM","06/12/2018 08:05:48 AM","(21.674337025, -157.956944903)",2018-06-10 02:33:37,2018-06-12 08:05:48,"RoadSafety",192731s (~2.23 days),0.318668981481481
"152",533904,"Light","Closed","Light does not turn on, need bulb replacement.","06/10/2018 02:33:07 AM","06/12/2018 08:05:41 AM","(21.674337025, -157.956944903)",2018-06-10 02:33:07,2018-06-12 08:05:41,"RoadSafety",192754s (~2.23 days),0.318707010582011
"153",533901,"Light","Closed","Pole on Huehu Street, intersection Huehu Street and Leleuli street.","06/10/2018 02:17:21 AM","06/12/2018 08:05:35 AM","(21.674339298, -157.956935846)",2018-06-10 02:17:21,2018-06-12 08:05:35,"RoadSafety",193694s (~2.24 days),0.320261243386243
"154",533899,"Light","Closed","Pole on Huehu Street, intersection Huehu Street and Leleuli street.","06/10/2018 02:16:05 AM","06/12/2018 08:05:28 AM","(21.674339298, -157.956935846)",2018-06-10 02:16:05,2018-06-12 08:05:28,"RoadSafety",193763s (~2.24 days),0.320375330687831
"155",533897,"Light","Closed","Pole on Huehu Street, intersection Huehu Street and Leleuli street.","06/10/2018 02:15:16 AM","06/12/2018 08:05:22 AM","(21.674339298, -157.956935846)",2018-06-10 02:15:16,2018-06-12 08:05:22,"RoadSafety",193806s (~2.24 days),0.320446428571429
"156",533851,"Light","Closed","Light is out","06/09/2018 03:55:49 PM","06/12/2018 08:00:29 AM","(21.437641151, -158.026257046)",2018-06-09 15:55:49,2018-06-12 08:00:29,"RoadSafety",230680s (~2.67 days),0.381415343915344
"157",533850,"Light","Closed","Light is out","06/09/2018 03:55:41 PM","06/12/2018 08:00:18 AM","(21.437641151, -158.026257046)",2018-06-09 15:55:41,2018-06-12 08:00:18,"RoadSafety",230677s (~2.67 days),0.381410383597884
"158",533849,"Light","Closed","Light is out","06/09/2018 03:54:42 PM","06/12/2018 08:00:10 AM","(21.437648707, -158.026253704)",2018-06-09 15:54:42,2018-06-12 08:00:10,"RoadSafety",230728s (~2.67 days),0.381494708994709
"159",533729,"Homeless","Closed","Cover tent and homeless person(s) inside. He has been here for a wk. it is black tent blends with bushes.","06/09/2018 07:13:32 AM","06/12/2018 08:10:25 AM","(21.592497067, -158.109604478)",2018-06-09 07:13:32,2018-06-12 08:10:25,"Homeless",262613s (~3.04 days),0.434214616402116
"160",533728,"Homeless","Closed","Cover tent and homeless person(s) inside. He has been here for a wk. it is black tent blends with bushes.","06/09/2018 07:13:15 AM","06/12/2018 08:10:17 AM","(21.592497067, -158.109604478)",2018-06-09 07:13:15,2018-06-12 08:10:17,"Homeless",262622s (~3.04 days),0.434229497354497
"161",533032,"Trash","Closed","Mauka side of Waimano home road street is littered with illegal dumping most notably abandoned vehicles (see attached photos)","06/07/2018 01:13:05 PM","06/07/2018 02:56:03 PM","(21.415776015, -157.958399561)",2018-06-07 13:13:05,2018-06-07 14:56:03,"Trash",6178s (~1.72 hours),0.0102149470899471
"162",530359,"Trash","Closed","Several abandoned cars & parts & refrigerators are dumped as you enter the gates. It is so bad.","06/02/2018 09:46:39 PM","06/04/2018 08:58:43 AM","(21.679748587, -157.955749665)",2018-06-02 21:46:39,2018-06-04 08:58:43,"Trash",126724s (~1.47 days),0.209530423280423
"163",529461,"Tree","Closed","Overgrown hedges blocking pedestrians.","05/31/2018 03:21:20 PM","05/31/2018 03:25:31 PM","(21.310622765, -157.809012272)",2018-05-31 15:21:20,2018-05-31 15:25:31,"Tree",251s (~4.18 minutes),0.000415013227513227
"164",529459,"Tree","Closed","Overgrown hedges blocking pedestrians.","05/31/2018 03:21:00 PM","05/31/2018 03:25:24 PM","(21.310622765, -157.809012272)",2018-05-31 15:21:00,2018-05-31 15:25:24,"Tree",264s (~4.4 minutes),0.000436507936507937
"165",529456,"Tree","Closed","Overgrown hedges blocking pedestrians.","05/31/2018 03:20:11 PM","05/31/2018 03:25:13 PM","(21.310622765, -157.809012272)",2018-05-31 15:20:11,2018-05-31 15:25:13,"Tree",302s (~5.03 minutes),0.000499338624338624
"166",529451,"Tree","Closed","2454 and 3458 E. Manoa RD. Mock orange hedges overgrown extending halfway over sidewalk. Needs trimming to property line.","05/31/2018 03:18:20 PM","05/31/2018 03:26:13 PM","(21.310595151, -157.809050483)",2018-05-31 15:18:20,2018-05-31 15:26:13,"Tree",473s (~7.88 minutes),0.00078207671957672
"167",529450,"Tree","Closed","2454 and 3458 E. Manoa RD. Mock orange hedges overgrown extending halfway over sidewalk. Needs trimming to property line.","05/31/2018 03:18:04 PM","05/31/2018 03:24:56 PM","(21.310595151, -157.809050483)",2018-05-31 15:18:04,2018-05-31 15:24:56,"Tree",412s (~6.87 minutes),0.000681216931216931
"168",529439,"Tree","Closed","2454 and 3458 E. Manoa RD. Mock orange hedges overgrown extending halfway over sidewalk. Needs trimming to property line.","05/31/2018 02:52:43 PM","05/31/2018 03:04:55 PM","(21.310595151, -157.809050483)",2018-05-31 14:52:43,2018-05-31 15:04:55,"Tree",732s (~12.2 minutes),0.00121031746031746
"169",529437,"Tree","Closed","2454 and 3458 E. Manoa RD. Mock orange hedges overgrown extending halfway over sidewalk. Needs trimming to property line.","05/31/2018 02:52:16 PM","05/31/2018 03:04:48 PM","(21.310595151, -157.809050483)",2018-05-31 14:52:16,2018-05-31 15:04:48,"Tree",752s (~12.53 minutes),0.00124338624338624
"170",529436,"Tree","Closed","2454 and 3458 E. Manoa RD. Mock orange hedges overgrown extending halfway over sidewalk. Needs trimming to property line.","05/31/2018 02:52:03 PM","05/31/2018 03:04:44 PM","(21.310595151, -157.809050483)",2018-05-31 14:52:03,2018-05-31 15:04:44,"Tree",761s (~12.68 minutes),0.0012582671957672
"171",529435,"Tree","Closed","2454 and 3458 E. Manoa RD. Mock orange hedges overgrown extending halfway over sidewalk. Needs trimming to property line.","05/31/2018 02:51:51 PM","05/31/2018 03:04:39 PM","(21.310595151, -157.809050483)",2018-05-31 14:51:51,2018-05-31 15:04:39,"Tree",768s (~12.8 minutes),0.00126984126984127
"172",528230,"Broken / Vandalized signs","Closed","the speed limit sign is falling off its pole. with the wind conditions lately, it creates a dangerous situation","05/29/2018 05:38:34 PM","05/30/2018 08:20:33 AM","(21.335433623, -157.878097)",2018-05-29 17:38:34,2018-05-30 08:20:33,"RoadSafety",52919s (~14.7 hours),0.0874983465608466
"173",526926,"Pothole","Closed","west of intersection.","05/26/2018 03:31:25 PM","05/29/2018 09:03:27 AM","(21.360969216, -158.05641118)",2018-05-26 15:31:25,2018-05-29 09:03:27,"RoadSafety",235922s (~2.73 days),0.390082671957672
"174",526611,"Homeless","Closed","Abandon Nissan Ultima","05/25/2018 02:19:11 PM","05/25/2018 02:29:25 PM","(21.299178253, -157.80360708)",2018-05-25 14:19:11,2018-05-25 14:29:25,"Homeless",614s (~10.23 minutes),0.00101521164021164
"175",525044,"Trash","Closed","Massive pile of illegal dump. The pile has grown in size over the past couple of days.","05/23/2018 07:54:10 AM","05/23/2018 09:47:50 AM","(21.293230185, -157.828055522)",2018-05-23 07:54:10,2018-05-23 09:47:50,"Trash",6820s (~1.89 hours),0.011276455026455
"176",524621,"Pothole","Closed","numerous deep holes in right hand lane","05/22/2018 04:45:55 PM","05/23/2018 10:08:49 AM","(21.384196354, -157.790081381)",2018-05-22 16:45:55,2018-05-23 10:08:49,"RoadSafety",62574s (~17.38 hours),0.103462301587302
"177",522696,"Stormwater","Closed","Request street sweeping throughout Waikelehespecially on Paiwa, Lumiauau, and Lumiaina Streets. Lots of monkeypod debris and vegetation starting to grow in the street/curb gutter.","05/20/2018 10:38:24 AM","05/21/2018 08:02:02 AM","(21.404168587, -158.009313097)",2018-05-20 10:38:24,2018-05-21 08:02:02,"Water",77018s (~21.39 hours),0.127344576719577
"178",520974,"Trash","Closed","Illegal cars again parked in road  in driveways and fronting hydrants","05/16/2018 11:59:24 AM","05/16/2018 02:51:56 PM","(21.373882293, -158.022757077)",2018-05-16 11:59:24,2018-05-16 14:51:56,"Trash",10352s (~2.88 hours),0.0171164021164021
"179",519484,"Tree","Closed","Tree down blocking bike path - kids rely on bike path to get to school","05/14/2018 07:47:16 AM","05/14/2018 08:24:23 AM","(21.652955, -158.060959)",2018-05-14 07:47:16,2018-05-14 08:24:23,"Tree",2227s (~37.12 minutes),0.00368220899470899
"180",519098,"Broken / Vandalized signs","Closed","Broken Hyde/hunnewell street sign across 4146 Kaimuki ave","05/13/2018 04:51:50 PM","05/14/2018 08:04:21 AM","(21.272578355, -157.791079923)",2018-05-13 16:51:50,2018-05-14 08:04:21,"RoadSafety",54751s (~15.21 hours),0.0905274470899471
"181",518895,"Pothole","Closed","Pothole in right lane Kaneohe bound on Kam Hwy","05/12/2018 08:00:53 PM","05/14/2018 07:58:57 AM","(21.385694045, -157.791455977)",2018-05-12 20:00:53,2018-05-14 07:58:57,"RoadSafety",129484s (~1.5 days),0.214093915343915
"182",518793,"Pothole","Closed","Large pothole in lane of travel. Dangerous location due to proximity to hairpin turn.","05/12/2018 07:53:36 AM","05/14/2018 07:56:56 AM","(21.365146553, -157.782154052)",2018-05-12 07:53:36,2018-05-14 07:56:56,"RoadSafety",173000s (~2 days),0.286044973544974
"183",518678,"Trash","Closed","Couch in canal water. Corner of Ala Wai and Liliuokalani.","05/11/2018 05:39:21 PM","05/14/2018 07:55:01 AM","(21.27731369, -157.820451129)",2018-05-11 17:39:21,2018-05-14 07:55:01,"Trash",224140s (~2.59 days),0.370601851851852
"184",517548,"Tree","Closed","Dead tree, some smaller branches broke and fell days ago. Today, C&County came to reach a fallen small branch still hanging on another branch. This concern was reported a month ago, the crew made their assessment today and said they will notify HECO firs","05/09/2018 03:22:08 PM","05/09/2018 04:18:54 PM","(21.343490885, -158.083082326)",2018-05-09 15:22:08,2018-05-09 16:18:54,"Tree",3406s (~56.77 minutes),0.00563161375661376
"185",517530,"Tree","Closed","Dead tree, some smaller branches broke and fell days ago. Today, C&County came to reach a fallen small branch still hanging on another branch. This concern was reported a month ago, the crew made their assessment today and said they will notify HECO firs","05/09/2018 02:40:08 PM","05/09/2018 04:18:43 PM","(21.343490885, -158.083082326)",2018-05-09 14:40:08,2018-05-09 16:18:43,"Tree",5915s (~1.64 hours),0.00978009259259259
"186",517515,"Tree","Closed","Dead tree, some smaller branches broke and fell days ago. Today, C&County came to reach a fallen small branch still hanging on another branch. This concern was reported a month ago, the crew made their assessment today and said they will notify HECO firs","05/09/2018 01:52:09 PM","05/09/2018 04:18:37 PM","(21.343490885, -158.083082326)",2018-05-09 13:52:09,2018-05-09 16:18:37,"Tree",8788s (~2.44 hours),0.0145304232804233
"187",517514,"Tree","Closed","Dead tree, some smaller branches broke and fell days ago. Today, C&County came to reach a fallen small branch still hanging on another branch. This concern was reported a month ago, the crew made their assessment today and said they will notify HECO firs","05/09/2018 01:51:07 PM","05/10/2018 08:20:37 AM","(21.343490885, -158.083082326)",2018-05-09 13:51:07,2018-05-10 08:20:37,"Tree",66570s (~18.49 hours),0.110069444444444
"188",516992,"Light","Closed","light out.","05/08/2018 09:32:19 PM","05/09/2018 08:06:45 AM","(21.402454968, -157.966442527)",2018-05-08 21:32:19,2018-05-09 08:06:45,"RoadSafety",38066s (~10.57 hours),0.0629398148148148
"189",516988,"Light","Closed","Two adjacent pole lights out","05/08/2018 08:04:14 PM","05/09/2018 08:01:58 AM","(21.2567191, -157.8030535)",2018-05-08 20:04:14,2018-05-09 08:01:58,"RoadSafety",43064s (~11.96 hours),0.0712037037037037
"190",516987,"Light","Closed","Two adjacent pole lights out","05/08/2018 08:03:49 PM","05/09/2018 08:01:49 AM","(21.2567191, -157.8030535)",2018-05-08 20:03:49,2018-05-09 08:01:49,"RoadSafety",43080s (~11.97 hours),0.0712301587301587
"191",516986,"Light","Closed","Two adjacent pole lights out","05/08/2018 08:03:32 PM","05/09/2018 08:01:24 AM","(21.2567191, -157.8030535)",2018-05-08 20:03:32,2018-05-09 08:01:24,"RoadSafety",43072s (~11.96 hours),0.0712169312169312
"192",516984,"Light","Closed","Two adjacent lights out","05/08/2018 08:00:11 PM","05/09/2018 08:01:16 AM","(21.25696646, -157.803023698)",2018-05-08 20:00:11,2018-05-09 08:01:16,"RoadSafety",43265s (~12.02 hours),0.071536044973545
"193",516983,"Light","Closed","Two adjacent lights out","05/08/2018 07:59:52 PM","05/09/2018 08:01:06 AM","(21.25696646, -157.803023698)",2018-05-08 19:59:52,2018-05-09 08:01:06,"RoadSafety",43274s (~12.02 hours),0.0715509259259259
"194",516982,"Light","Closed","Two adjacent lights out","05/08/2018 07:59:42 PM","05/09/2018 08:00:56 AM","(21.25696646, -157.803023698)",2018-05-08 19:59:42,2018-05-09 08:00:56,"RoadSafety",43274s (~12.02 hours),0.0715509259259259
"195",516981,"Light","Closed","Two adjacent lights out","05/08/2018 07:59:08 PM","05/09/2018 08:00:48 AM","(21.25696646, -157.803023698)",2018-05-08 19:59:08,2018-05-09 08:00:48,"RoadSafety",43300s (~12.03 hours),0.0715939153439153
"196",516980,"Light","Closed","Two adjacent poles lights out or failing","05/08/2018 07:57:41 PM","05/09/2018 08:00:38 AM","(21.2567191, -157.8030535)",2018-05-08 19:57:41,2018-05-09 08:00:38,"RoadSafety",43377s (~12.05 hours),0.0717212301587302
"197",516312,"Tree","Closed","Grass over growing sidewalk (for several months) forcing people closer to street.","05/07/2018 01:30:05 PM","05/07/2018 02:13:58 PM","(21.281519382, -157.800636662)",2018-05-07 13:30:05,2018-05-07 14:13:58,"Tree",2633s (~43.88 minutes),0.00435350529100529
"198",516130,"Tree","Closed","Albezia tree growing on cliff side of Kamehameha inside rockslide mitigation fence.","05/07/2018 09:18:15 AM","05/07/2018 09:49:08 AM","(21.428574287, -158.010552863)",2018-05-07 09:18:15,2018-05-07 09:49:08,"Tree",1853s (~30.88 minutes),0.00306382275132275
"199",514994,"Trash","Closed","Continued dumping of regular trash, household items and bulky items any time during the week and month.","05/04/2018 08:03:03 AM","05/04/2018 08:13:42 AM","(21.338464158, -157.87268903)",2018-05-04 08:03:03,2018-05-04 08:13:42,"Trash",639s (~10.65 minutes),0.00105654761904762
"200",514781,"Trash","Closed","Someone either living or storing their belongings under the Mccully overpass.","05/03/2018 03:53:47 PM","05/04/2018 07:59:09 AM","(21.297724838, -157.829098827)",2018-05-03 15:53:47,2018-05-04 07:59:09,"Trash",57922s (~16.09 hours),0.0957705026455026
"201",514639,"Tree","Closed","Tree branch broke off and tree is dangerous","05/03/2018 10:26:00 AM","05/03/2018 10:32:47 AM","(21.305725131, -157.850158473)",2018-05-03 10:26:00,2018-05-03 10:32:47,"Tree",407s (~6.78 minutes),0.000672949735449735
"202",514637,"Tree","Closed","Tree branch broke off and tree is dangerous","05/03/2018 10:24:50 AM","05/03/2018 10:32:38 AM","(21.305725131, -157.850158473)",2018-05-03 10:24:50,2018-05-03 10:32:38,"Tree",468s (~7.8 minutes),0.000773809523809524
"203",514635,"Tree","Closed","Tree branch broke off and tree is dangerous","05/03/2018 10:24:17 AM","05/03/2018 10:32:30 AM","(21.305725131, -157.850158473)",2018-05-03 10:24:17,2018-05-03 10:32:30,"Tree",493s (~8.22 minutes),0.000815145502645503
"204",514634,"Tree","Closed","Tree branch broke off and tree is dangerous","05/03/2018 10:23:57 AM","05/03/2018 10:32:23 AM","(21.305725131, -157.850158473)",2018-05-03 10:23:57,2018-05-03 10:32:23,"Tree",506s (~8.43 minutes),0.000836640211640212
"205",514633,"Tree","Closed","Tree branch broke off and tree is dangerous","05/03/2018 10:23:43 AM","05/03/2018 10:32:14 AM","(21.305725131, -157.850158473)",2018-05-03 10:23:43,2018-05-03 10:32:14,"Tree",511s (~8.52 minutes),0.000844907407407407
"206",514632,"Tree","Closed","Tree branch broke off and tree is dangerous","05/03/2018 10:23:26 AM","05/03/2018 10:32:06 AM","(21.305725131, -157.850158473)",2018-05-03 10:23:26,2018-05-03 10:32:06,"Tree",520s (~8.67 minutes),0.00085978835978836
"207",513773,"Homeless","Closed","Tarp and garbage on beach","05/01/2018 04:58:24 PM","05/02/2018 07:50:25 AM","(21.460906547, -158.209842871)",2018-05-01 16:58:24,2018-05-02 07:50:25,"Homeless",53521s (~14.87 hours),0.0884937169312169
"208",513771,"Trash","Closed","A tarp and garbage on public beach","05/01/2018 04:57:42 PM","05/02/2018 07:50:13 AM","(21.46082784, -158.209698409)",2018-05-01 16:57:42,2018-05-02 07:50:13,"Trash",53551s (~14.88 hours),0.0885433201058201
"209",513770,"Trash","Closed","A tarp and garbage on public beach","05/01/2018 04:57:35 PM","05/02/2018 07:50:06 AM","(21.46082784, -158.209698409)",2018-05-01 16:57:35,2018-05-02 07:50:06,"Trash",53551s (~14.88 hours),0.0885433201058201
"210",513288,"Light","Closed","Street light out fronting Hyatt Regency Waikiki main entrance on Uluniu avenue","05/01/2018 03:19:59 AM","05/01/2018 07:49:26 AM","(21.275538668, -157.824647598)",2018-05-01 03:19:59,2018-05-01 07:49:26,"RoadSafety",16167s (~4.49 hours),0.0267311507936508
"211",513286,"Light","Closed","Street light out fronting Hyatt Regency Waikiki main entrance on Uluniu avenue","05/01/2018 03:19:22 AM","05/01/2018 07:49:20 AM","(21.275538668, -157.824647598)",2018-05-01 03:19:22,2018-05-01 07:49:20,"RoadSafety",16198s (~4.5 hours),0.0267824074074074
"212",513285,"Light","Closed","Street light out fronting Hyatt Regency Waikiki main entrance on Uluniu avenue","05/01/2018 03:19:08 AM","05/01/2018 07:49:14 AM","(21.275538668, -157.824647598)",2018-05-01 03:19:08,2018-05-01 07:49:14,"RoadSafety",16206s (~4.5 hours),0.0267956349206349
"213",513243,"Pothole","Closed","Ho brah one massive pothole","04/30/2018 09:19:44 PM","05/01/2018 08:15:31 AM","(21.368049751, -157.739977841)",2018-04-30 21:19:44,2018-05-01 08:15:31,"RoadSafety",39347s (~10.93 hours),0.0650578703703704
"214",511339,"Trash","Closed","More garbage accumulating daily","04/25/2018 04:58:55 PM","04/26/2018 08:36:53 AM","(21.601181034, -158.104451301)",2018-04-25 16:58:55,2018-04-26 08:36:53,"Trash",56278s (~15.63 hours),0.0930522486772487
"215",509547,"Homeless","Closed","Bicycles and misc property on sidewalk and alder street unable to safely walk on street","04/22/2018 05:11:48 PM","04/23/2018 08:04:31 AM","(21.2988083, -157.843814003)",2018-04-22 17:11:48,2018-04-23 08:04:31,"Homeless",53563s (~14.88 hours),0.0885631613756614
"216",509546,"Homeless","Closed","Bicycles and misc property on sidewalk and alder street unable to safely walk on street","04/22/2018 05:11:40 PM","04/23/2018 08:04:24 AM","(21.2988083, -157.843814003)",2018-04-22 17:11:40,2018-04-23 08:04:24,"Homeless",53564s (~14.88 hours),0.0885648148148148
"217",509545,"Homeless","Closed","Bicycles and misc property on sidewalk and alder street unable to safely walk on street","04/22/2018 05:11:31 PM","04/23/2018 08:04:14 AM","(21.2988083, -157.843814003)",2018-04-22 17:11:31,2018-04-23 08:04:14,"Homeless",53563s (~14.88 hours),0.0885631613756614
"218",509188,"Broken / Vandalized signs","Closed","Sign spelling wrong for PED crossing. Sign says: STOP HEPE FOR PEDESTRIANS. Isnbt it supposed to read : STOP HERE FOR PEDESTRIANS?","04/21/2018 07:46:09 AM","04/23/2018 09:29:51 AM","(21.314130912, -157.867367056)",2018-04-21 07:46:09,2018-04-23 09:29:51,"RoadSafety",179022s (~2.07 days),0.296001984126984
"219",507392,"Pothole","Closed","Large pothole, almost three feet wide","04/17/2018 09:18:28 AM","04/17/2018 09:46:46 AM","(21.310804029, -157.858695907)",2018-04-17 09:18:28,2018-04-17 09:46:46,"RoadSafety",1698s (~28.3 minutes),0.00280753968253968
"220",507391,"Pothole","Closed","Large pothole, almost three feet wide","04/17/2018 09:18:11 AM","04/17/2018 09:46:27 AM","(21.310804029, -157.858695907)",2018-04-17 09:18:11,2018-04-17 09:46:27,"RoadSafety",1696s (~28.27 minutes),0.0028042328042328
"221",507389,"Pothole","Closed","Large pothole, almost three feet wide","04/17/2018 09:17:57 AM","04/17/2018 09:46:18 AM","(21.310804029, -157.858695907)",2018-04-17 09:17:57,2018-04-17 09:46:18,"RoadSafety",1701s (~28.35 minutes),0.0028125
"222",507387,"Pothole","Closed","Large pothole, almost three feet wide","04/17/2018 09:17:45 AM","04/17/2018 09:46:10 AM","(21.310804029, -157.858695907)",2018-04-17 09:17:45,2018-04-17 09:46:10,"RoadSafety",1705s (~28.42 minutes),0.00281911375661376
"223",507339,"Tree","Closed","overgrown bushes and trees next to sidewalk on hihimanu street between kakaina to district park.  very unsafe conditions for people, especially children trying to walk or ride bicycles.  people.must go into road in order to pass other people walkibg on s","04/17/2018 08:09:09 AM","04/17/2018 10:27:47 AM","(21.343685211, -157.721725058)",2018-04-17 08:09:09,2018-04-17 10:27:47,"Tree",8318s (~2.31 hours),0.0137533068783069
"224",507000,"Stormwater","Closed","Bad flooding with thick MUD from a site up the road. We suspect unpermitted grading and grubbing without proper safeguards - property is located next to address provided as site in question appears to be owned by State of Hawaii. 8 inches of Mud Flowed d","04/16/2018 03:18:49 PM","04/16/2018 04:01:06 PM","(21.334573, -157.740114)",2018-04-16 15:18:49,2018-04-16 16:01:06,"Water",2537s (~42.28 minutes),0.00419477513227513
"225",506964,"Stormwater","Closed","This vehicle that parks in that spot on Lanai Street has been leaking large amounts of engine oil for a few months.","04/16/2018 02:14:03 PM","04/16/2018 02:24:18 PM","(21.331667501, -157.848898982)",2018-04-16 14:14:03,2018-04-16 14:24:18,"Water",615s (~10.25 minutes),0.00101686507936508
"226",506963,"Stormwater","Closed","This vehicle that parks in that spot on Lanai Street has been leaking large amounts of engine oil for a few months.","04/16/2018 02:13:08 PM","04/16/2018 03:35:37 PM","(21.331667501, -157.848898982)",2018-04-16 14:13:08,2018-04-16 15:35:37,"Water",4949s (~1.37 hours),0.00818287037037037
"227",506439,"Trash","Closed","Van dumped with all sorts of stuff around it. License plate RZB483 Ford van econoline","04/15/2018 02:43:06 PM","04/16/2018 09:52:54 AM","(21.291519, -157.662628)",2018-04-15 14:43:06,2018-04-16 09:52:54,"Trash",68988s (~19.16 hours),0.11406746031746
"228",506407,"Pothole","Closed","Few holes 8 to 12 inches deep up and down this street","04/15/2018 12:06:37 PM","04/16/2018 08:26:58 AM","(21.362969058, -157.734045228)",2018-04-15 12:06:37,2018-04-16 08:26:58,"RoadSafety",73221s (~20.34 hours),0.121066468253968
"229",506404,"Pothole","Closed","Very dangerous conditions.","04/15/2018 11:36:17 AM","04/16/2018 08:26:50 AM","(21.363307, -157.7347804)",2018-04-15 11:36:17,2018-04-16 08:26:50,"RoadSafety",75033s (~20.84 hours),0.1240625
"230",506226,"Stormwater","Closed","Lots of debris on walkway from flooding","04/14/2018 04:10:37 PM","04/16/2018 12:56:11 PM","(21.270181786, -157.77745003)",2018-04-14 16:10:37,2018-04-16 12:56:11,"Water",161134s (~1.86 days),0.266425264550265
"231",506225,"Stormwater","Closed","Lots of debris on walkway from flooding","04/14/2018 04:10:05 PM","04/16/2018 12:56:02 PM","(21.270181786, -157.77745003)",2018-04-14 16:10:05,2018-04-16 12:56:02,"Water",161157s (~1.87 days),0.266463293650794
"232",506175,"Stormwater","Closed","4/13/18 storm seems to have damaged the drain. Large slabs of concrete appear to have washed down to the bottom of the drainage ditch.","04/14/2018 11:05:09 AM","04/16/2018 11:34:56 AM","(21.293754182, -157.708364137)",2018-04-14 11:05:09,2018-04-16 11:34:56,"Water",174587s (~2.02 days),0.288668981481481
"233",506028,"Pothole","Closed","Left lane, drivers side... Big pothole for weeks.","04/13/2018 08:31:21 PM","04/16/2018 08:30:34 AM","(21.397655971, -157.986190884)",2018-04-13 20:31:21,2018-04-16 08:30:34,"RoadSafety",215953s (~2.5 days),0.357065145502646
"234",505599,"Pothole","Closed","Get one big pothole","04/12/2018 05:53:14 PM","04/13/2018 09:10:01 AM","(21.368030086, -157.740041171)",2018-04-12 17:53:14,2018-04-13 09:10:01,"RoadSafety",55007s (~15.28 hours),0.0909507275132275
"235",505567,"Tree","Closed","trashed and unkept park area","04/12/2018 03:30:53 PM","04/13/2018 09:21:21 AM","(21.298634005, -157.839828058)",2018-04-12 15:30:53,2018-04-13 09:21:21,"Tree",64228s (~17.84 hours),0.10619708994709
"236",505017,"Broken / Vandalized signs","Closed","No parking sign falling down.","04/11/2018 10:33:55 AM","04/11/2018 12:01:41 PM","(21.391880554, -157.718403296)",2018-04-11 10:33:55,2018-04-11 12:01:41,"RoadSafety",5266s (~1.46 hours),0.00870701058201058
"237",504954,"Broken / Vandalized signs","Closed","No parking sign falling down","04/11/2018 08:57:26 AM","04/11/2018 12:07:22 PM","(21.391879873, -157.718407129)",2018-04-11 08:57:26,2018-04-11 12:07:22,"RoadSafety",11396s (~3.17 hours),0.0188425925925926
"238",504941,"Broken / Vandalized signs","Closed","No parking sign falling fown","04/11/2018 08:35:40 AM","04/11/2018 12:01:28 PM","(21.391887307, -157.718360254)",2018-04-11 08:35:40,2018-04-11 12:01:28,"RoadSafety",12348s (~3.43 hours),0.0204166666666667
"239",504939,"Broken / Vandalized signs","Closed","No parking sign falling fown","04/11/2018 08:35:11 AM","04/11/2018 12:01:16 PM","(21.391887307, -157.718360254)",2018-04-11 08:35:11,2018-04-11 12:01:16,"RoadSafety",12365s (~3.43 hours),0.0204447751322751
"240",504588,"Pothole","Closed","Potholes on far-right lane in northbound direction","04/10/2018 02:17:56 PM","04/10/2018 03:18:13 PM","(21.394673143, -158.008763429)",2018-04-10 14:17:56,2018-04-10 15:18:13,"RoadSafety",3617s (~1 hours),0.00598048941798942
"241",504587,"Pothole","Closed","Potholes on far-right lane in northbound direction","04/10/2018 02:17:41 PM","04/10/2018 03:19:35 PM","(21.394673143, -158.008763429)",2018-04-10 14:17:41,2018-04-10 15:19:35,"RoadSafety",3714s (~1.03 hours),0.00614087301587302
"242",503901,"Broken / Vandalized signs","Closed","No U Turn sign is falling off the pole ites attached to at the corner of Makakilo Drive / Fort Barrette Road and Farrington Highway.","04/09/2018 09:17:08 AM","04/09/2018 03:01:16 PM","(21.340116841, -158.07600966)",2018-04-09 09:17:08,2018-04-09 15:01:16,"RoadSafety",20648s (~5.74 hours),0.0341402116402116
"243",503560,"Broken / Vandalized signs","Closed","Both signs in turn around need repair","04/08/2018 04:35:59 PM","04/09/2018 09:10:05 AM","(21.3688739, -157.8942609)",2018-04-08 16:35:59,2018-04-09 09:10:05,"RoadSafety",59646s (~16.57 hours),0.0986210317460317
"244",503270,"Trash","Closed","Garbage piles all along Farrington. Dangerous and causing liability issues for the city","04/07/2018 09:55:03 AM","04/09/2018 09:06:29 AM","(21.459304423, -158.205342877)",2018-04-07 09:55:03,2018-04-09 09:06:29,"Trash",169886s (~1.97 days),0.280896164021164
"245",502921,"Light","Closed","On my way to work this morning and discovered some Street Lights out in the vicinity of Waipahu.  Hiwahiwa Place Hiwahiwa Street, Hinuhinu Way, Hoaeae Street, Honowai Street by Honowai School. Please repair due to safety concern & prevent illegal activit","04/06/2018 09:16:37 AM","04/06/2018 01:40:06 PM","(21.587360441, -158.112842593)",2018-04-06 09:16:37,2018-04-06 13:40:06,"RoadSafety",15809s (~4.39 hours),0.0261392195767196
"246",502920,"Light","Closed","On my way to work this morning and discovered some Street Lights out in the vicinity of Waipahu.  Hiwahiwa Place Hiwahiwa Street, Hinuhinu Way, Hoaeae Street, Honowai Street by Honowai School. Please repair due to safety concern & prevent illegal activit","04/06/2018 09:16:09 AM","04/06/2018 01:39:52 PM","(21.587360441, -158.112842593)",2018-04-06 09:16:09,2018-04-06 13:39:52,"RoadSafety",15823s (~4.4 hours),0.0261623677248677
"247",502919,"Light","Closed","On my way to work this morning and discovered some Street Lights out in the vicinity of Waipahu.  Hiwahiwa Place Hiwahiwa Street, Hinuhinu Way, Hoaeae Street, Honowai Street by Honowai School. Please repair due to safety concern & prevent illegal activit","04/06/2018 09:15:35 AM","04/06/2018 01:39:46 PM","(21.587360441, -158.112842593)",2018-04-06 09:15:35,2018-04-06 13:39:46,"RoadSafety",15851s (~4.4 hours),0.026208664021164
"248",502894,"Light","Closed","On my way to work this morning and discovered some Street Lights out in the vicinity of Waipahu.  Hiwahiwa Place Hiwahiwa Street, Hinuhinu Way, Hoaeae Street, Honowai Street by Honowai School. Please repair due to safety concern & prevent illegal activit","04/06/2018 08:18:07 AM","04/06/2018 08:22:00 AM","(21.587360441, -158.112842593)",2018-04-06 08:18:07,2018-04-06 08:22:00,"RoadSafety",233s (~3.88 minutes),0.000385251322751323
"249",502891,"Light","Closed","On my way to work this morning and discovered some Street Lights out in the vicinity of Waipahu.  Hiwahiwa Place Hiwahiwa Street, Hinuhinu Way, Hoaeae Street, Honowai Street by Honowai School. Please repair due to safety concern & prevent illegal activit","04/06/2018 08:17:28 AM","04/06/2018 08:21:44 AM","(21.587360441, -158.112842593)",2018-04-06 08:17:28,2018-04-06 08:21:44,"RoadSafety",256s (~4.27 minutes),0.000423280423280423
"250",502890,"Light","Closed","On my way to work this morning and discovered some Street Lights out in the vicinity of Waipahu.  Hiwahiwa Place Hiwahiwa Street, Hinuhinu Way, Hoaeae Street, Honowai Street by Honowai School. Please repair due to safety concern & prevent illegal activit","04/06/2018 08:16:17 AM","04/06/2018 08:21:36 AM","(21.587360441, -158.112842593)",2018-04-06 08:16:17,2018-04-06 08:21:36,"RoadSafety",319s (~5.32 minutes),0.00052744708994709
"251",502817,"Pothole","Closed","Large Pothole","04/06/2018 06:28:30 AM","04/06/2018 08:33:25 AM","(21.48868589, -158.03942236)",2018-04-06 06:28:30,2018-04-06 08:33:25,"RoadSafety",7495s (~2.08 hours),0.0123925264550265
"252",502558,"Trash","Closed","Bulky items on street","04/05/2018 12:22:49 PM","04/05/2018 12:33:44 PM","(21.3227318, -157.8584259)",2018-04-05 12:22:49,2018-04-05 12:33:44,"Trash",655s (~10.92 minutes),0.00108300264550265
"253",502523,"Trash","Closed","Items on street","04/05/2018 10:50:18 AM","04/05/2018 10:59:37 AM","(21.322787864, -157.85849195)",2018-04-05 10:50:18,2018-04-05 10:59:37,"Trash",559s (~9.32 minutes),0.000924272486772487
"254",502498,"Trash","Closed","Items on street","04/05/2018 10:07:15 AM","04/05/2018 10:25:28 AM","(21.322787864, -157.85849195)",2018-04-05 10:07:15,2018-04-05 10:25:28,"Trash",1093s (~18.22 minutes),0.00180720899470899
"255",502497,"Trash","Closed","Items on street","04/05/2018 10:07:04 AM","04/05/2018 10:25:21 AM","(21.322787864, -157.85849195)",2018-04-05 10:07:04,2018-04-05 10:25:21,"Trash",1097s (~18.28 minutes),0.00181382275132275
"256",502496,"Trash","Closed","Items on street","04/05/2018 10:06:49 AM","04/05/2018 10:25:14 AM","(21.322787864, -157.85849195)",2018-04-05 10:06:49,2018-04-05 10:25:14,"Trash",1105s (~18.42 minutes),0.00182705026455026
"257",502495,"Trash","Closed","Large items on the street","04/05/2018 10:05:00 AM","04/05/2018 10:25:06 AM","(21.322480248, -157.858846805)",2018-04-05 10:05:00,2018-04-05 10:25:06,"Trash",1206s (~20.1 minutes),0.00199404761904762
"258",502494,"Trash","Closed","Large items on the street","04/05/2018 10:04:45 AM","04/05/2018 10:24:58 AM","(21.322480248, -157.858846805)",2018-04-05 10:04:45,2018-04-05 10:24:58,"Trash",1213s (~20.22 minutes),0.00200562169312169
"259",502493,"Trash","Closed","Large items on the street","04/05/2018 10:04:20 AM","04/05/2018 10:24:53 AM","(21.322480248, -157.858846805)",2018-04-05 10:04:20,2018-04-05 10:24:53,"Trash",1233s (~20.55 minutes),0.00203869047619048
"260",502198,"Trash","Closed","People have been coming by and stripping parts from vehicles left on this corner","04/04/2018 10:26:44 PM","04/05/2018 08:26:52 AM","(21.373783839, -158.023114212)",2018-04-04 22:26:44,2018-04-05 08:26:52,"Trash",36008s (~10 hours),0.059537037037037
"261",502196,"Trash","Closed","Multiple cars Being  stripped for parts for cars Beijing worked on. People from Aloha motor have been going back n forth","04/04/2018 08:48:52 PM","04/05/2018 08:26:42 AM","(21.373774771, -158.023088145)",2018-04-04 20:48:52,2018-04-05 08:26:42,"Trash",41870s (~11.63 hours),0.0692294973544973
"262",502195,"Trash","Closed","People from Aloha motor are leaving cars around the area and taking parts during the night and sometimes during the day. Mazda Miata bmw and now a celica which one of the guys now goes back n forth taking out stuff","04/04/2018 08:45:33 PM","04/05/2018 08:26:33 AM","(21.373796666, -158.023101394)",2018-04-04 20:45:33,2018-04-05 08:26:33,"Trash",42060s (~11.68 hours),0.0695436507936508
"263",502193,"Trash","Closed","People from Aloha motor are leaving cars around the area and taking parts during the night and sometimes during the day. Mazda Miata bmw and now a celica which one of the guys now goes back n forth taking out stuff","04/04/2018 08:44:32 PM","04/05/2018 08:26:25 AM","(21.373796666, -158.023101394)",2018-04-04 20:44:32,2018-04-05 08:26:25,"Trash",42113s (~11.7 hours),0.0696312830687831
"264",502192,"Trash","Closed","People from Aloha motor are leaving cars around the area and taking parts during the night and sometimes during the day. Mazda Miata bmw and now a celica which one of the guys now goes back n forth taking out stuff","04/04/2018 08:44:19 PM","04/05/2018 08:26:18 AM","(21.373796666, -158.023101394)",2018-04-04 20:44:19,2018-04-05 08:26:18,"Trash",42119s (~11.7 hours),0.0696412037037037
"265",502191,"Trash","Closed","People from Aloha motor are leaving cars around the area and taking parts during the night and sometimes during the day. Mazda Miata bmw and now a celica which one of the guys now goes back n forth taking out stuff","04/04/2018 08:44:00 PM","04/05/2018 08:26:11 AM","(21.373796666, -158.023101394)",2018-04-04 20:44:00,2018-04-05 08:26:11,"Trash",42131s (~11.7 hours),0.069661044973545
"266",502190,"Trash","Closed","People from Aloha motor are leaving cars around the area and taking parts during the night and sometimes during the day. Mazda Miata bmw and now a celica which one of the guys now goes back n forth taking out stuff","04/04/2018 08:43:44 PM","04/05/2018 08:26:02 AM","(21.373796666, -158.023101394)",2018-04-04 20:43:44,2018-04-05 08:26:02,"Trash",42138s (~11.7 hours),0.0696726190476191
"267",502189,"Trash","Closed","People from Aloha motor are leaving cars around the area and taking parts during the night and sometimes during the day. Mazda Miata bmw and now a celica which one of the guys now goes back n forth taking out stuff","04/04/2018 08:43:29 PM","04/05/2018 08:25:56 AM","(21.373796666, -158.023101394)",2018-04-04 20:43:29,2018-04-05 08:25:56,"Trash",42147s (~11.71 hours),0.0696875
"268",502188,"Trash","Closed","People from Aloha motor are leaving cars around the area and taking parts during the night and sometimes during the day. Mazda Miata bmw and now a celica which one of the guys now goes back n forth taking out stuff","04/04/2018 08:43:18 PM","04/05/2018 08:25:33 AM","(21.373796666, -158.023101394)",2018-04-04 20:43:18,2018-04-05 08:25:33,"Trash",42135s (~11.7 hours),0.0696676587301587
"269",501718,"Broken / Vandalized signs","Closed","Sign completely gone","04/03/2018 09:42:51 PM","04/04/2018 09:06:50 AM","(21.64518392, -158.040728629)",2018-04-03 21:42:51,2018-04-04 09:06:50,"RoadSafety",41039s (~11.4 hours),0.0678554894179894
"270",501509,"Broken / Vandalized signs","Closed","Graffiti on a utility box on Makakilo Drive directly across the street to the entrance for St Jude and the Easter Seals. Two sides of the box have been tagged. Please paint over.","04/03/2018 09:23:37 AM","04/03/2018 04:20:16 PM","(21.343298066, -158.079067637)",2018-04-03 09:23:37,2018-04-03 16:20:16,"RoadSafety",24999s (~6.94 hours),0.0413343253968254
"271",501496,"Trash","Closed","Abandoned pick up truck on jacks on front axle.","04/03/2018 08:59:18 AM","04/03/2018 01:00:42 PM","(21.269904744, -157.815203773)",2018-04-03 08:59:18,2018-04-03 13:00:42,"Trash",14484s (~4.02 hours),0.0239484126984127
"272",500350,"Light","Closed","New electric pole. Street light not reinstalled","03/31/2018 05:34:10 PM","04/02/2018 09:08:28 AM","(21.260485088, -157.791058596)",2018-03-31 17:34:10,2018-04-02 09:08:28,"RoadSafety",142458s (~1.65 days),0.235545634920635
"273",500346,"Light","Closed","New electric pole. Street light not reinstalled","03/31/2018 04:53:59 PM","04/02/2018 09:09:09 AM","(21.260485088, -157.791058596)",2018-03-31 16:53:59,2018-04-02 09:09:09,"RoadSafety",144910s (~1.68 days),0.239599867724868
"274",500345,"Light","Closed","New electric pole. Street light not reinstalled","03/31/2018 04:53:22 PM","04/02/2018 09:09:34 AM","(21.260485088, -157.791058596)",2018-03-31 16:53:22,2018-04-02 09:09:34,"RoadSafety",144972s (~1.68 days),0.239702380952381
"275",500302,"Light","Closed","New electric pole. Street light not reinstalled","03/31/2018 02:41:13 PM","04/02/2018 09:10:05 AM","(21.260485088, -157.791058596)",2018-03-31 14:41:13,2018-04-02 09:10:05,"RoadSafety",152932s (~1.77 days),0.252863756613757
"276",500299,"Light","Closed","light disconnected with removal of old pole & taped to new pole","03/31/2018 02:38:47 PM","04/02/2018 09:19:05 AM","(21.260564926, -157.790607028)",2018-03-31 14:38:47,2018-04-02 09:19:05,"RoadSafety",153618s (~1.78 days),0.253998015873016
"277",500243,"Light","Closed","light disconnected with removal of old pole & taped to new pole","03/31/2018 11:36:50 AM","04/02/2018 09:34:11 AM","(21.260564926, -157.790607028)",2018-03-31 11:36:50,2018-04-02 09:34:11,"RoadSafety",165441s (~1.91 days),0.273546626984127
"278",500242,"Light","Closed","light disconnected with removal of old pole & taped to new pole","03/31/2018 11:36:33 AM","04/02/2018 09:31:35 AM","(21.260564926, -157.790607028)",2018-03-31 11:36:33,2018-04-02 09:31:35,"RoadSafety",165302s (~1.91 days),0.273316798941799
"279",500241,"Light","Closed","light disconnected with removal of old pole & taped to new pole","03/31/2018 11:35:27 AM","04/02/2018 09:30:56 AM","(21.260564926, -157.790607028)",2018-03-31 11:35:27,2018-04-02 09:30:56,"RoadSafety",165329s (~1.91 days),0.273361441798942
"280",500240,"Light","Closed","light disconnected with removal of old pole & taped to new pole","03/31/2018 11:34:15 AM","04/02/2018 09:30:31 AM","(21.260564926, -157.790607028)",2018-03-31 11:34:15,2018-04-02 09:30:31,"RoadSafety",165376s (~1.91 days),0.273439153439153
"281",500190,"Light","Closed","light disconnected with removal of old pole & taped to new pole","03/31/2018 08:57:13 AM","04/02/2018 09:19:58 AM","(21.260564926, -157.790607028)",2018-03-31 08:57:13,2018-04-02 09:19:58,"RoadSafety",174165s (~2.02 days),0.28797123015873
"282",500188,"Light","Closed","light disconnected with removal of old pole & taped to new pole","03/31/2018 08:55:56 AM","04/02/2018 09:21:58 AM","(21.260564926, -157.790607028)",2018-03-31 08:55:56,2018-04-02 09:21:58,"RoadSafety",174362s (~2.02 days),0.288296957671958
"283",500187,"Light","Closed","light disconnected with removal of old pole & taped to new pole","03/31/2018 08:54:31 AM","04/02/2018 09:23:08 AM","(21.260564926, -157.790607028)",2018-03-31 08:54:31,2018-04-02 09:23:08,"RoadSafety",174517s (~2.02 days),0.288553240740741
"284",500179,"Tree","Closed","3454  Sierra to Center street brush is overgrown and hanging in the streets. this is a safety hazard for the public. please cut trees and bushes that are obstructing traffic.","03/31/2018 08:21:31 AM","04/02/2018 10:16:32 AM","(21.2862882, -157.7982122)",2018-03-31 08:21:31,2018-04-02 10:16:32,"Tree",179701s (~2.08 days),0.297124669312169
"285",500052,"Broken / Vandalized signs","Closed","Teenagers break into the pool facility and vandalize it constantly.  Facility is for residents only and they do not belong there to begin with.","03/30/2018 02:51:22 PM","04/02/2018 10:38:58 AM","(21.313492, -158.02375)",2018-03-30 14:51:22,2018-04-02 10:38:58,"RoadSafety",244056s (~2.82 days),0.403531746031746
"286",500050,"Broken / Vandalized signs","Closed","Teenagers break into the pool facility and vandalize it constantly.  Facility is for residents only and they do not belong there to begin with.","03/30/2018 02:51:11 PM","04/02/2018 10:39:24 AM","(21.313492, -158.02375)",2018-03-30 14:51:11,2018-04-02 10:39:24,"RoadSafety",244093s (~2.83 days),0.403592923280423
"287",500049,"Broken / Vandalized signs","Closed","Teenagers break into the pool facility and vandalize it constantly.  Facility is for residents only and they do not belong there to begin with.","03/30/2018 02:50:36 PM","04/02/2018 10:39:48 AM","(21.313492, -158.02375)",2018-03-30 14:50:36,2018-04-02 10:39:48,"RoadSafety",244152s (~2.83 days),0.403690476190476
"288",497020,"Homeless","Closed","looks like a homeless is setting up house under the Mccully bridge.","03/23/2018 11:17:35 PM","03/27/2018 09:16:11 AM","(21.297992674, -157.829230301)",2018-03-23 23:17:35,2018-03-27 09:16:11,"Homeless",295116s (~3.42 days),0.487956349206349
"289",496991,"Trash","Closed","homeless dumping items under the McCully Bridge. getting larger every week.","03/23/2018 05:16:10 PM","03/27/2018 09:02:45 AM","(21.297819958, -157.829168968)",2018-03-23 17:16:10,2018-03-27 09:02:45,"Trash",315995s (~3.66 days),0.522478505291005
"290",496990,"Homeless","Closed","homeless set up house under the McCully Bridge","03/23/2018 05:13:34 PM","03/27/2018 09:02:15 AM","(21.297823995, -157.82916054)",2018-03-23 17:13:34,2018-03-27 09:02:15,"Homeless",316121s (~3.66 days),0.522686838624339
"291",495518,"Trash","Closed","Not illegal but big bulky items/move out","03/20/2018 03:45:13 PM","03/20/2018 03:53:33 PM","(21.29896229, -157.792132473)",2018-03-20 15:45:13,2018-03-20 15:53:33,"Trash",500s (~8.33 minutes),0.000826719576719577
"292",495327,"Light","Closed","One of my request was deemed a duplicate but there are actually 2 lights out. One fronting 1415 Meyers street and the next light at the intersection of Rose and Meyers street. Aloha","03/20/2018 09:32:57 AM","03/20/2018 09:37:24 AM","(21.341930381, -157.880393021)",2018-03-20 09:32:57,2018-03-20 09:37:24,"RoadSafety",267s (~4.45 minutes),0.000441468253968254
"293",495318,"Light","Closed","Light not working","03/20/2018 09:23:14 AM","03/20/2018 09:27:53 AM","(21.341929963, -157.880448427)",2018-03-20 09:23:14,2018-03-20 09:27:53,"RoadSafety",279s (~4.65 minutes),0.000461309523809524
"294",493895,"Tree","Closed","Overgrown grass covering sidewalks. Needs to be trimmed. Mauka side of Moanalua road below freeway side.","03/17/2018 07:17:26 AM","03/19/2018 08:09:35 AM","(21.38953383, -157.946357228)",2018-03-17 07:17:26,2018-03-19 08:09:35,"Tree",175929s (~2.04 days),0.290887896825397
"295",493894,"Tree","Closed","Overgrown grass covering sidewalks. Needs to be trimmed. Mauka side of Moanalua road below freeway side.","03/17/2018 07:16:00 AM","03/19/2018 08:09:24 AM","(21.38996832, -157.946569125)",2018-03-17 07:16:00,2018-03-19 08:09:24,"Tree",176004s (~2.04 days),0.291011904761905
"296",493892,"Tree","Closed","Overgrown grass covering sidewalks. Needs to be trimmed. Mauka side of Moanalua road below freeway side.","03/17/2018 07:15:46 AM","03/19/2018 08:09:16 AM","(21.38996832, -157.946569125)",2018-03-17 07:15:46,2018-03-19 08:09:16,"Tree",176010s (~2.04 days),0.291021825396825
"297",492377,"Light","Closed","Light not working. It was repaired last week and that same night it wasnet on.","03/13/2018 10:24:30 PM","03/14/2018 09:40:39 AM","(21.369178017, -158.084479765)",2018-03-13 22:24:30,2018-03-14 09:40:39,"RoadSafety",40569s (~11.27 hours),0.067078373015873
"298",491680,"Light","Closed","the lights along the Kalanianaole area near the keolu hills street lights are out","03/12/2018 11:57:27 AM","03/12/2018 12:02:56 PM","(21.367855503, -157.740189584)",2018-03-12 11:57:27,2018-03-12 12:02:56,"RoadSafety",329s (~5.48 minutes),0.000543981481481481
"299",491641,"Trash","Closed","tires, trash, furniture and appliances","03/12/2018 10:45:41 AM","03/12/2018 10:46:56 AM","(21.314986637, -157.669970208)",2018-03-12 10:45:41,2018-03-12 10:46:56,"Trash",75s (~1.25 minutes),0.000124007936507937
"300",491640,"Trash","Closed","tires, trash, furniture and appliances","03/12/2018 10:44:26 AM","03/12/2018 10:46:46 AM","(21.315624398, -157.669851067)",2018-03-12 10:44:26,2018-03-12 10:46:46,"Trash",140s (~2.33 minutes),0.000231481481481481
"301",491639,"Trash","Closed","tires, trash, furniture and appliances","03/12/2018 10:43:38 AM","03/12/2018 10:46:38 AM","(21.315624398, -157.669851067)",2018-03-12 10:43:38,2018-03-12 10:46:38,"Trash",180s (~3 minutes),0.000297619047619048
"302",491638,"Trash","Closed","tires, trash, furniture and appliances","03/12/2018 10:43:08 AM","03/12/2018 10:46:16 AM","(21.315624398, -157.669851067)",2018-03-12 10:43:08,2018-03-12 10:46:16,"Trash",188s (~3.13 minutes),0.000310846560846561
"303",491637,"Trash","Closed","tires, trash, furniture and appliances","03/12/2018 10:42:11 AM","03/12/2018 10:45:49 AM","(21.315624398, -157.669851067)",2018-03-12 10:42:11,2018-03-12 10:45:49,"Trash",218s (~3.63 minutes),0.000360449735449735
"304",490912,"Trash","Closed","Fishing net on the reef adjacent to Uppers Beach Park.","03/10/2018 12:14:10 PM","03/12/2018 07:57:28 AM","(21.633476645, -158.070386809)",2018-03-10 12:14:10,2018-03-12 07:57:28,"Trash",157398s (~1.82 days),0.260248015873016
"305",490911,"Trash","Closed","Fishing net on the reef adjacent to Uppers Beach Park.","03/10/2018 12:13:37 PM","03/12/2018 07:57:22 AM","(21.633476645, -158.070386809)",2018-03-10 12:13:37,2018-03-12 07:57:22,"Trash",157425s (~1.82 days),0.260292658730159
"306",490592,"Pothole","Closed","multiple pot holes","03/09/2018 11:14:24 AM","03/09/2018 01:20:04 PM","(21.304022605, -157.861605604)",2018-03-09 11:14:24,2018-03-09 13:20:04,"RoadSafety",7540s (~2.09 hours),0.0124669312169312
"307",490223,"Light","Closed","This is an official CitySourced test. Please ignore. Call me if needed but you should ignore this test service request.","03/08/2018 02:18:17 PM","03/09/2018 07:43:29 AM","(21.3067801, -157.8627595)",2018-03-08 14:18:17,2018-03-09 07:43:29,"RoadSafety",62712s (~17.42 hours),0.103690476190476
"308",488020,"Light","Closed","3rd request....thank you!","03/04/2018 08:36:01 PM","03/05/2018 07:50:44 AM","(21.369267731, -158.08445725)",2018-03-04 20:36:01,2018-03-05 07:50:44,"RoadSafety",40483s (~11.25 hours),0.0669361772486772
"309",488019,"Light","Closed","3rd request....thank you!","03/04/2018 08:35:47 PM","03/05/2018 07:51:10 AM","(21.369267731, -158.08445725)",2018-03-04 20:35:47,2018-03-05 07:51:10,"RoadSafety",40523s (~11.26 hours),0.0670023148148148
"310",488018,"Light","Closed","3rd request....thank you!","03/04/2018 08:35:31 PM","03/05/2018 07:52:17 AM","(21.369267731, -158.08445725)",2018-03-04 20:35:31,2018-03-05 07:52:17,"RoadSafety",40606s (~11.28 hours),0.0671395502645503
"311",488017,"Light","Closed","3rd request....thank you!","03/04/2018 08:35:14 PM","03/05/2018 07:52:53 AM","(21.369267731, -158.08445725)",2018-03-04 20:35:14,2018-03-05 07:52:53,"RoadSafety",40659s (~11.29 hours),0.0672271825396825
"312",487650,"Broken / Vandalized signs","Closed","No parking sign faded","03/03/2018 03:57:55 PM","03/05/2018 08:28:55 AM","(21.338411338, -157.86694203)",2018-03-03 15:57:55,2018-03-05 08:28:55,"RoadSafety",145860s (~1.69 days),0.241170634920635
"313",487529,"Broken / Vandalized signs","Closed","Broken bench.  Nails coming out","03/03/2018 10:05:04 AM","03/05/2018 08:01:03 AM","(21.453262, -158.019126)",2018-03-03 10:05:04,2018-03-05 08:01:03,"RoadSafety",165359s (~1.91 days),0.273411044973545
"314",487527,"Broken / Vandalized signs","Closed","Broken bench.  Nails coming out","03/03/2018 10:04:06 AM","03/05/2018 08:00:55 AM","(21.453262, -158.019126)",2018-03-03 10:04:06,2018-03-05 08:00:55,"RoadSafety",165409s (~1.91 days),0.273493716931217
"315",487524,"Broken / Vandalized signs","Closed","Broken bench.  Nails coming out","03/03/2018 10:02:59 AM","03/05/2018 08:00:46 AM","(21.453262, -158.019126)",2018-03-03 10:02:59,2018-03-05 08:00:46,"RoadSafety",165467s (~1.92 days),0.273589616402116
"316",487464,"Broken / Vandalized signs","Closed","Broken bench by dugout.  Nails showing and termit eaten","03/03/2018 07:52:25 AM","03/05/2018 08:00:39 AM","(21.453262, -158.019126)",2018-03-03 07:52:25,2018-03-05 08:00:39,"RoadSafety",173294s (~2.01 days),0.286531084656085
"317",487463,"Broken / Vandalized signs","Closed","Broken bench by dugout.  Nails showing and termit eaten","03/03/2018 07:50:17 AM","03/05/2018 08:00:33 AM","(21.453262, -158.019126)",2018-03-03 07:50:17,2018-03-05 08:00:33,"RoadSafety",173416s (~2.01 days),0.286732804232804
"318",487462,"Broken / Vandalized signs","Closed","Broken bench by dugout.  Nails showing and termit eaten","03/03/2018 07:49:47 AM","03/05/2018 08:00:24 AM","(21.453262, -158.019126)",2018-03-03 07:49:47,2018-03-05 08:00:24,"RoadSafety",173437s (~2.01 days),0.286767526455026
"319",487461,"Broken / Vandalized signs","Closed","Broken bench by dugout.  Nails showing and termit eaten","03/03/2018 07:49:33 AM","03/05/2018 08:00:15 AM","(21.453262, -158.019126)",2018-03-03 07:49:33,2018-03-05 08:00:15,"RoadSafety",173442s (~2.01 days),0.286775793650794
"320",487460,"Broken / Vandalized signs","Closed","Broken bench by dugout.  Nails showing and termit eaten","03/03/2018 07:49:26 AM","03/05/2018 08:00:08 AM","(21.453262, -158.019126)",2018-03-03 07:49:26,2018-03-05 08:00:08,"RoadSafety",173442s (~2.01 days),0.286775793650794
"321",487371,"Pothole","Closed","Pothole","03/02/2018 11:02:12 PM","03/05/2018 07:54:50 AM","(21.3930783, -157.7448595)",2018-03-02 23:02:12,2018-03-05 07:54:50,"RoadSafety",204758s (~2.37 days),0.338554894179894
"322",487369,"Pothole","Closed","Pothole","03/02/2018 11:01:37 PM","03/05/2018 07:54:40 AM","(21.3930783, -157.7448595)",2018-03-02 23:01:37,2018-03-05 07:54:40,"RoadSafety",204783s (~2.37 days),0.33859623015873
"323",487367,"Pothole","Closed","Pot hole on the right hand lane on Hamakua. Cactus restaurant will be on the right heading-towards kimocs surf hut and kalapawai market.","03/02/2018 10:54:45 PM","03/05/2018 07:54:32 AM","(21.39305952, -157.744902832)",2018-03-02 22:54:45,2018-03-05 07:54:32,"RoadSafety",205187s (~2.37 days),0.33926421957672
"324",487366,"Pothole","Closed","Pot hole on the right hand lane on Hamakua. Cactus restaurant will be on the right heading-towards kimots surf hut and kalapawai market.","03/02/2018 10:52:57 PM","03/05/2018 07:54:24 AM","(21.39305952, -157.744902832)",2018-03-02 22:52:57,2018-03-05 07:54:24,"RoadSafety",205287s (~2.38 days),0.339429563492063
"325",487365,"Pothole","Closed","Pot hole on the right hand lane on Hamakua. Cactus restaurant will be on the right heading-towards kimots surf hut and kalapawai market.","03/02/2018 10:52:22 PM","03/05/2018 07:53:59 AM","(21.39305952, -157.744902832)",2018-03-02 22:52:22,2018-03-05 07:53:59,"RoadSafety",205297s (~2.38 days),0.339446097883598
"326",487364,"Pothole","Closed","Pot hole on the right hand lane on Hamakua. Cactus restaurant will be on the right heading-towards kimots surf hut and kalapawai market.","03/02/2018 10:51:58 PM","03/05/2018 07:53:51 AM","(21.39305952, -157.744902832)",2018-03-02 22:51:58,2018-03-05 07:53:51,"RoadSafety",205313s (~2.38 days),0.339472552910053
"327",487363,"Pothole","Closed","Pot hole on the right hand lane on Hamakua. Cactus restaurant will be on the right heading-towards kimots surf hut and kalapawai market.","03/02/2018 10:50:45 PM","03/05/2018 07:53:45 AM","(21.39305952, -157.744902832)",2018-03-02 22:50:45,2018-03-05 07:53:45,"RoadSafety",205380s (~2.38 days),0.339583333333333
"328",487362,"Pothole","Closed","Pot hole on the right hand lane on Hamakua. Cactus restaurant will be on the right heading-towards kimots surf hut and kalapawai market.","03/02/2018 10:50:33 PM","03/05/2018 07:53:36 AM","(21.39305952, -157.744902832)",2018-03-02 22:50:33,2018-03-05 07:53:36,"RoadSafety",205383s (~2.38 days),0.339588293650794
"329",487361,"Pothole","Closed","Pot hole on the right hand lane on Hamakua. Cactus restaurant will be on the right heading-towards kimots surf hut and kalapawai market.","03/02/2018 10:50:00 PM","03/05/2018 07:53:27 AM","(21.39305952, -157.744902832)",2018-03-02 22:50:00,2018-03-05 07:53:27,"RoadSafety",205407s (~2.38 days),0.339627976190476
"330",487360,"Pothole","Closed","Pot hole on the right hand lane on Hamakua. Cactus restaurant will be on the right heading-towards kimots surf hut and kalapawai market.","03/02/2018 10:49:44 PM","03/05/2018 07:53:19 AM","(21.39305952, -157.744902832)",2018-03-02 22:49:44,2018-03-05 07:53:19,"RoadSafety",205415s (~2.38 days),0.339641203703704
"331",487359,"Pothole","Closed","Pot hole on the right hand lane on Hamakua. Cactus restaurant will be on the right heading-towards kimots surf hut and kalapawai market.","03/02/2018 10:49:29 PM","03/05/2018 07:53:10 AM","(21.39305952, -157.744902832)",2018-03-02 22:49:29,2018-03-05 07:53:10,"RoadSafety",205421s (~2.38 days),0.339651124338624
"332",487354,"Light","Closed","there are no street lights on Metcalf from Wilder thru the McCully St freeway overpass.  This is critically dangerous for those of us who ride bicycle along this path in the dark both morning and night.","03/02/2018 09:42:44 PM","03/05/2018 08:18:06 AM","(21.298044646, -157.829051403)",2018-03-02 21:42:44,2018-03-05 08:18:06,"RoadSafety",210922s (~2.44 days),0.348746693121693
"333",487353,"Light","Closed","there are no street lights on Metcalf from Wilder thru the McCully St freeway overpass.  This is critically dangerous for those of us who ride bicycle along this path in the dark both morning and night.","03/02/2018 09:42:34 PM","03/05/2018 08:17:57 AM","(21.298044646, -157.829051403)",2018-03-02 21:42:34,2018-03-05 08:17:57,"RoadSafety",210923s (~2.44 days),0.348748346560847
"334",486742,"Homeless","Closed","Full shopping cart covered with a tarp and other things have been stored by the roadside for at least 2 months.","03/01/2018 08:55:13 PM","03/02/2018 08:33:01 AM","(21.4148127, -157.8018788)",2018-03-01 20:55:13,2018-03-02 08:33:01,"Homeless",41868s (~11.63 hours),0.0692261904761905
"335",486741,"Homeless","Closed","Full shopping cart covered with a tarp and other things have been stored by the roadside for at least 2 months.","03/01/2018 08:53:25 PM","03/02/2018 08:32:39 AM","(21.4148127, -157.8018788)",2018-03-01 20:53:25,2018-03-02 08:32:39,"Homeless",41954s (~11.65 hours),0.0693683862433862
"336",486740,"Homeless","Closed","Full shopping cart covered with a tarp and other things have been stored by the roadside for at least 2 months.","03/01/2018 08:53:12 PM","03/02/2018 08:32:14 AM","(21.4148127, -157.8018788)",2018-03-01 20:53:12,2018-03-02 08:32:14,"Homeless",41942s (~11.65 hours),0.069348544973545
"337",486739,"Homeless","Closed","shopping cart covered with tarp and other things are being stored along side the road and parked cars.  have been there for about 2 months.","03/01/2018 08:48:27 PM","03/02/2018 08:31:48 AM","(21.4148127, -157.8018788)",2018-03-01 20:48:27,2018-03-02 08:31:48,"Homeless",42201s (~11.72 hours),0.0697767857142857
